,type,id,title,text,date,votes_ratio,url,author
985,submission,lfj2k0,The Bull Case for CLNE: A Stepping Stone to the Future,"The Bull Case for CLNE: A Stepping Stone to the Future This is my first DD post so please forgive me. I meant to post this on the weekend but shit happens lol.

**What is CLNE?**

Since this is pretty googleable information, I'll keept it short. CLNE provides natural gas solutions for transportation throughout the US and Canada. They started out with compressed natural gas (CNG) and liquified natural gas (LNG), which are both good, but more importantly now have renewable natural gas (RNG). They sell RNG under the name Redeem and you can read all about it [here](https://redeem.cleanenergyfuels.com/) The important thing here is that RNG is carbon negative.

CLNE also has a large infrastructure for natural gas refueling. They currently have a shitload of stations around the US and Canada, which is great because the candiates for using natural gas most are things like 18 wheelers and other stuff that just make big long trips. It's too bad for them that they were so early, because no one was using natural gas till more recent times (unless you look at other countries, but...).

CLNE is also on a recent uptrend after [getting an upgrade from Credit Suisse to $17.](https://www.benzinga.com/news/21/02/19463411/credit-suisse-initiates-coverage-on-clean-energy-fuels-with-outperform-rating-announces-price-target)

**Why Natural Gas?**

As I mentioned before, RNG is carbon negative. More and more commercial vehicles are being converted to natural gas use in order to reduce carbon footprint (70% decrease according to CLNE's own website). More companies are going to be converting their vehicles to use natural gas (in fact, Amazon is already making the move [here](https://www.reuters.com/article/us-amazon-engines-natural-gas-exclusive/exclusive-amazon-orders-hundreds-of-trucks-that-run-on-natural-gas-idUSKBN2A52ML)). This is an easy stepping stone right now, since doing electric fleets is a non-trivial matter (but will eventually happen). In fact, RNG has a lower carbon rating than electric batteries, [according to Commiefornia's Air Resource Board](http://biomassmagazine.com/articles/17518/rng-helps-reach-carbon-negative-milestone-in-california). With demand for natural gas ramping up in the transportation sector, who else but CLNE who provides both RNG and the facilities to refuel with more, which are already established.

**Increasing Natural Gas Demand**

Companies are not changing their fleets to start using natural gas out of the goodness of their hearts. With Buyden now in office, we can expect more sweeping green policies. Most of these policies in the past have focused on a carbon tax, which means carbon intensive fuels will get more expensive. I'd imagine you also get a tax credit for going carbon-negative (hey there's that word again), [which RNG will assist with](https://www.cleanenergyfuels.com/press-room/clean-energy-lauds-passage-of-alternative-fuel-tax-credit-by-congress).

We also see an increase in demand for RNG happening right now. [CLNE last December reported signing deals for 58 million gallons of RNG](https://www.wsj.com/articles/clean-energy-signs-deals-for-over-58-million-gallons-of-redeem-tm-renewable-natural-gas-to-meet-growing-demand-for-carbon-neutral-fuel-01608030439?tesla=y), which is quite good because in the entirety of 2019 [they only sold 143 million gallons](https://www.cleanenergyfuels.com/press-room/clean-energy-delivers-143-million-gallons-of-redeem-renewable-natural-gas-in-2019-a-30-jump-from-last-year-strong-finish-in-transit-and-solid-waste)

[Lastly, we have new trucks coming in that run on natural gas from Volvo and more](https://www.forbes.com/sites/kensilverstein/2020/11/08/natural-gas-vehicles-are-making-inroads-and-want-joe-biden-to-get-aboard/?sh=34de9bfb2d5e). I believe we will continue to see more companies move to natural gas fleets which will continuously pump this stock.

**Partnerships**

CLNE has entered partnerships with BP and has an upcoming one with Total. With BP, [they are joint owning and operating RNG facilities](https://www.wsj.com/articles/clean-energy-to-make-more-carbon-negative-fuel-available-for-transportation-with-bp-01608567431?tesla=y). With BP that will share half the control, and BP fronted $50 million to fund the costs of the join venture. 

With Total [they have a memorandum of understanding](https://www.wsj.com/articles/clean-energy-and-total-to-develop-additional-carbon-negative-fuel-and-infrastructure-01608548752?tesla=y) to develop more RNG infrastructure. They will similarly be having a 50/50 joint venture, with more support coming from Total. I believe Total is providing $50 million as well for this venture, with an additional credit support of $60 million. 

These deals were fairly recent, so CLNE is on the upswing here with big oil coming in and backing them up for natural gas.

**Expansion**

Well, CLNE was already early to natural gas infrastructure, much to their detriment to be honest. Luckily it's paying off now. I would think they would continue to expand with more refueling stations, and more ways to produce RNG (the joint ventures seem to be pointing in this direction so that's good).

I know there have been some rumblings for an expansion into Hydrogen, which honestly would be huge if their refueling stations can support that. However after talking to some people more familiar with hydrogen fuel, this might be unlikely. Apparently swapping natural gas infrastructure to also support hydrogen is not easy, on account of the fact that hydrogen is pretty liable to explode, plus some other issues (like leaching issues??). I would actually hope they DON'T expand into this area because I believe what they have is currently very strong, and hydrogen stations themselves are negative ROI. 

**The Numbers**

Honestly these don't look bad and if you want me to map this out more I'll do it if there's interest. I'm too lazy to do detailed analysis on this right now though.

**The Play**

As more news comes out this stock will pump further and further. If you want to get a small position you can do that now, and then just load up on any dips. I do expect retracement from today's price a bit. Conservative price target is $22 by Summer, and the bull target is $60 end of year. 

[I am holding 50 contracts of 3/19 $13c, and 50 contracts of 6/18 $17c which I purchased last week (These are printing hard). I also hold 7500 shares at a cost basis of around ~$6.](https://i.ibb.co/CJM6fDY/image.png) I will personally probably roll half my 3/19 $13c's into  4/16 $17c or something like that. I still think CLNE is a strong play and will be adding to my positions.",1612811118.0,0.84,https://www.reddit.com/r/wallstreetbets/comments/lfj2k0/the_bull_case_for_clne_a_stepping_stone_to_the/,Zrob
986,submission,lfjf5w,Ideanomics Reports and Closes an additional $80M in Financing,"Ideanomics Reports and Closes an additional $80M in Financing    
Ideanomics (Nasdaq-IDEX) has raised another $80M for a total of \~ $275,000,000 for future acquisitions, investment, and overall growth in the EV & Fintech sectors.  


**SEC Filings Reports**

*424B2 Form of prospectus filed in connection with primary offering of securities on a delayed basis*  
**PROSPECTUS SUPPLEMENT**  


**$80,000,000**  


**Ideanomics, Inc.**  


**4% Convertible Note Due 2021**  


Pursuant to this prospectus supplement and the accompanying prospectus, Ideanomics, Inc. (the “Company”, “we” or “us”) is offering $80,000,000 aggregate principal amount (the “Principal”) of our 4% convertible notes due 2021 (the “Note”) directly to YA II PN, Ltd. (the “Investor”) (and this prospectus supplement also relates to the shares of common stock that are issuable upon exercise of the Note) (the “Offering”). We will receive $80,000,000 from this Offering.  


The Note has a fixed conversion price of $4.95 (the “Conversion Price). The Conversion Price is not subject to adjustment except for subdivisions or combinations of common stock. The Principal and the interest payable under the Note will mature on August 8, 2021 (the “Maturity Date), unless earlier converted or redeemed by the Company.  


At any time before the Maturity Date, the Investor may convert the Note at their option into shares of our common stock at a fixed conversion price of $4.95.

[https://investors.ideanomics.com/sec-filings](https://investors.ideanomics.com/sec-filings)",1612812037.0,0.84,https://www.reddit.com/r/wallstreetbets/comments/lfjf5w/ideanomics_reports_and_closes_an_additional_80m/,SureSpeech5
987,submission,lfjogz,Fundamentals/technicals of dtcc setting collateral requirements,"Fundamentals/technicals of dtcc setting collateral requirements Going from 2-100% overnight LEGENDARILY fucked people and pleased only those who held gme shorts

How does this process work on a nuts and bolts calculation process?

Is it algorithms?

Is it a cabal of augurs sifting through offal?

All resources that I've found say that no one has any idea wtf is going on behind the scenes, that it's completely opaque. Sus af.

Lots of people on this forum in recent arguments with me insist it is all above board and totally legit but I can't find whatever information they've found that seems to back up their perspectives.

This is one aspect of fundamentals where a deep dive seems warranted

EDIT - I've been reading bunches of sec filings, rule changes, and specifically trying to find risk profiles to compare similar collateral requirements for companies in times past. would love to see the risk profiles here",1612812711.0,0.86,https://www.reddit.com/r/wallstreetbets/comments/lfjogz/fundamentalstechnicals_of_dtcc_setting_collateral/,rub_a_dub-dub
988,submission,lfjy25,I need some answers on the GME Squeeze.,"I need some answers on the GME Squeeze. Can someone with actual experience in investing help me out? 

So I was thinking, if a short squeeze was still to happen, the hedge funds would wait it out (pay interest on the borrowed stock) and buy all the shares they shorted back at the lowest possible price, logic would suggest that they would have not bought the shorted stock at the peak of 500$ but instead would let the waters calm down ( cause some chaos by driving the price down to trigger some sell off ) and then buy back the shares owed close to the price they sold it for to minimize losses ($5/share I believe).  

Now if the shorts are yet to be covered, would the stock sky rocket when the price reaches around the $5 - $6 range and all the shares shorted would all be bought at the same time?  Also do we have reliable information of when the short expires?   

Keep the trolling and speculation to a minimum please. I need people who actually know what they are talking about... not speculation of ""the squeeze already happened"" or the other side of ""it's going to the moon""",1612813416.0,0.81,https://www.reddit.com/r/wallstreetbets/comments/lfjy25/i_need_some_answers_on_the_gme_squeeze/,SultspartaLoL96
989,submission,lfk4ni,Oi! Is that that tendie da gaffer was on about?,Oi! Is that that tendie da gaffer was on about? ,1612813897.0,0.86,https://v.redd.it/ymoc2fi66bg61,mbhammock
990,submission,lfk73n,Genuine Question- Do You Feel You Can Make Money Investing?,"Genuine Question- Do You Feel You Can Make Money Investing? I don’t want to sound like r/investing, but I was surprised at how many new comers seem to believe the stock market is literally rigged against them... that just isn’t the case.

I know we hate the founder, but his original vision is very much alive and well today. He was a guy who was more interested in finance and public markets than most and wanted to have a forum where he could discuss single stock trades. He tried this on other outlets but was always told “that’s too risky” “most stock pickers underperform” “you are better off buying index funds”. The thing is, all of that is very much true, the only difference with us is that we know this and we understand the risks we take buying single stocks & options.

If you came here because you thought GameStop was the only way to make money in the market, then you need to take a step back and do some research. We take big risks here, but again, we know they’re risky and we know what we should be doing— in fact most of us largely save via index funds and trade as a hobby.

I genuinely encourage all new members to come back after you’ve watched some videos on portfolio theory, the efficient frontier, asset allocation, and the efficient market hypothesis. Almost anyone can make money buying index funds. It might not be huge money, but it’s how most people are able to retire these days. 

Most people who get rich on single stocks were already rich or they got those stocks by being employees of the company via compensation. Most options expire worthless (theta gang). You should know your risks before you come in with your nihilistic outlook and try to protest hedge funds by taking the losing end of their trades.",1612814070.0,0.79,https://www.reddit.com/r/wallstreetbets/comments/lfk73n/genuine_question_do_you_feel_you_can_make_money/,BagofBabbish
991,submission,lfkl9b,NOVAVAX,"NOVAVAX - Is closer to a traditional vaccine 

- requires a lot of the same equipment that poor countries already have to distribute, produce, and store. 

- shows the same effectiveness against the S. African and UK variants.

- shows a higher effectiveness against Covid-19

- They are already working on the Flu/COVID combo vaccination

- has stopped two of its competitors vaccine rollouts

All around NOVAVAX is out preforming Pfizer 


KEEP IN MIND THAT ALL THE VACCINES HAVE A 50%-60% effectiveness against the SA/COVID variant.",1612815078.0,0.64,https://www.reddit.com/r/wallstreetbets/comments/lfkl9b/novavax/,RoodyRoo1
992,submission,lfkprt,Finished my DIY project just in time for GME to 🚀🚀🚀🚀 (percentages simulated to show movement in the video),Finished my DIY project just in time for GME to 🚀🚀🚀🚀 (percentages simulated to show movement in the video) ,1612815405.0,0.89,https://v.redd.it/5gofhjblabg61,dickdemodickmarcinko
993,submission,lfkrdw,GME in a nutshell MEME,GME in a nutshell MEME ,1612815521.0,0.95,https://v.redd.it/0t82ygtyabg61,dp873
994,submission,lfks5q,🚀🚀 $NOK to the Moon 🚀🚀,🚀🚀 $NOK to the Moon 🚀🚀 ,1612815576.0,0.7,https://v.redd.it/juf4sld7bbg61,faisall1
995,submission,lfla1i,Why your GME losses have nothing to do with Robinhood,"Why your GME losses have nothing to do with Robinhood Before you downvote me to hell, no I don't use Robinhood because they don't support cost basis tax optimizations and other features like IRA accounts. I'm just tired of the daily posts crying about wsb tendies being stolen by Robinhood.

**You really want to know who stole your tendies?** Look at every single gain post on the front page. How the fuck do you think those users realized their gains? By SELLING their thousands of shares and call options and driving the price down. This is the nature of a short squeeze - it's just a pyramid scheme and the truth is that the all of the people buying in at the top are getting fucked. 


Now I know you retards can't do your own research so here's a FAQ to answer all your conspiracy theory questions:



**Why did Robinhood only restrict buy orders?**

Firstly, this is false. Robinhood paused *opening positions*. So if you were short GME (or short put options), you could close your position by buying back GME or buying back your put option. So why is closing positions OK but opening positions is not? Because closing a position is a reduction in risk (since you have realized your gain/loss) while opening positions is an increase in risk - something that the clearinghouse factors in when it calculates the broker's collateral requirement.

Secondly, if Robinhood had restricted closing positions as well, I'm 100% sure you retards would be complaining about not being able to sell on GME's second highest peak day.

**If I bought GME shares using cash, why did Robinhood have trouble posting collateral to the DTCC?**

First off, it's illegal for brokers to use cash from customers to post collateral. Secondly, the DTCC unilaterally raised the collateral requirement for both shares and options above its normal requirement (the exact percentage is confidential but will be revealed in the congressional hearing). And finally, trading volume *more than doubled* in a single day from January 26th - January 27th (most of this increase is due to trading on Robinhood). So Robinhood not having enough cash to cover a more than 3X increase in collateral is perfectly reasonable. If you have a 3k mortgage payment every month and one month your bank says you now owe 9k, how many of you would be able to pay up? Robinhood's decision was basically between restricting a stock that less than 10% of users on Robinhood own or shutting down for the rest of the week, if not longer, because it longer has its primary clearing house to settle any trades.

**Robinhood earns money from Citadel and Citadel bailed out Melvin Capital and even my smooth brain can connect the dots**

You're legitimately retarded if you actually think Citadel called up Robinhood to perpetuate market manipulation. Ah yes, Citadel pays quants 400k+ a year to come up with alpha generating strategies but the only way they can make money is to call up a broker and commit market manipulation in the most easily traceable way ever??? 

I actually don't understand the logic here. Your theory is that Citadel needed Robinhood to bail them out of their short positions. And yet the day after Robinhood lifted restrictions, short interest *increased* back to pre-restriction levels. **Why the fuck would hedge funds commit market manipulation to get out of their short positions, only to double down on more short positions the day after??**

**Robinhood restricting opening long positions caused GME to tank I'm fucking poor now fuck Robinhood etc.**

If you graph Robinhood's restrictions against the price of GME, you actually get an inverse correlation (r^2 = -0.73). That is, when Robinhood first introduced restrictions, GME had its second best trading day. Then every day following, as Robinhood reduced restrictions, GME price fell lower and lower. What does this mean? Robinhood adding restrictions is not the reason why GME is tanking.  

So why is it tanking? Short squeezes are basically a pyramid scheme. The people at the top are the people that got in early. Then as the hype builds, more people join the bottom of the pyramid. That influx of new retards is the ONLY thing that is supporting the upwards price movement because the company has zero fundamentals. Finally there comes a point when enough people at the top cash out their massive positions and at the same time new people aren't joining the hype quickly enough (realistically, who the fuck is buying 420 shares when the price is $300+). And everything comes crumbling down. 

Sorry to shatter your rosy perception of wsb, but you have to realize that every post telling you to 💎🙌 when the stock was 300+ was a massive fucking bait. Cramer pointed this out and advised everyone to cash out while we were ahead but you guys roasted him to fuck for it. It's only sad that you guys now choose to pin this on Robinhood, the company that made the entire squeeze and this very sub possible in the first place.

**tldr** you guys are fucking retards that bought into a pyramid scheme and now blame Robinhood for being unable to keep up with your chain inting.",1612816881.0,0.3,https://www.reddit.com/r/wallstreetbets/comments/lfla1i/why_your_gme_losses_have_nothing_to_do_with/,watershoe
996,submission,lfll8l,A big thank you to WSB,"A big thank you to WSB I would like to thank this community for getting me to start trading. After finishing business school i was disapointed at the entire prospect of working in my field (PR and Management) as most entry positions were either complete bullshit or nonexistant. I went to make a career out of my hobby, videoediting. Its been a successful career and ive gotten to a point where im well off enough to be able to throw some money around without risking much. Cue WSB. I had known about this reddit group for some time but didnt really pay much attention, until GME happened. I opened a trading acc and put in 650€ - a measly 1.25 shares... yes yes, i was late as fuck, but hear me out. I lost 85% within no time at all, but while looking at my portfolio every 15 seconds I invested into a bunch of other things like criptic currency and a few other stocks, including OCGN. Well, i got back my losses on GME and then some. And with my business education background i have a basic understanding of how the markets work. Now i can see this as a potential source of additional income for my family and myself. So thank you WSB!!!

All the best to all of you!

D",1612817699.0,0.82,https://www.reddit.com/r/wallstreetbets/comments/lfll8l/a_big_thank_you_to_wsb/,Dulimir69
997,submission,lflob4,The Solution to the Robinhood Problem,"The Solution to the Robinhood Problem Okay Smoothie Brains, I’ll make this short because I know you apes won’t read.

Whatever happened with GME and AMC would not be an issue with a digital securities platform. Trades will be settled real-time, no more T + 2. Brokers like RH post collateral because of the risks taken by the clearing house to settle the trade and when there was a run on GME they couldn’t keep up.  Something like that, I don’t really understand. It was irresponsible and greedy of them to hide their inability to handle high velocity and volume of trades. With digital securities this disappears. 

Not only that, we will see an eruption of tradeable securities in the marketplace. Any asset or security (i.e. stocks, bonds, mutual funds, ETFs, warrants, real estate, collectibles) will be tradable. You could buy securities that are tethered to real estate in California or New York or to cars like Rally Road does. Any private company can do this, you no longer need an IPO to have investors. And they can offer benefits like discounts and dividends or profit-sharing.

This democratizes markets because you are no longer kept out of the early stages by the rules. You no longer have to depend on a central authority to do their job. You don’t have to wait on the snail pace of the traditional market and you have the freedom to invest in whatever you want to essentially. Its possible we will see this as a 24/7 market.

Identify and invest in early players That’s what I want to do. The only one I could identify and invest in is OSTKs TZero (meaning zero days to settlement) but there must be competitors. We are going to see a revolution in markets and I think that any player in this space is a great investment opportunity right now. I can’t make promises because I an amateur and I’m not advocating that you invest in any one platform. I’m just a smoothie brain who thinks he has figured out the next big thing.

TL/DR: Understand how digital securities are going to change the securities markets.",1612817931.0,0.71,https://www.reddit.com/r/wallstreetbets/comments/lflob4/the_solution_to_the_robinhood_problem/,DIYjackass
998,submission,lflpoz,"What Are Your Moves Tomorrow, February 09, 2021","What Are Your Moves Tomorrow, February 09, 2021 Your daily trading discussion thread. Please keep the shitposting to a minimum. 

^Navigate ^WSB|^We ^recommend ^best ^daily ^DD
:--|:--                                 
**DD** | [All](https://reddit.com/r/wallstreetbets/search?sort=new&restrict_sr=on&q=flair%3ADD) / [**Best Daily**](https://www.reddit.com/r/wallstreetbets/search?sort=top&q=flair%3ADD&restrict_sr=on&t=day) / [Best Weekly](https://www.reddit.com/r/wallstreetbets/search?sort=top&q=flair%3ADD&restrict_sr=on&t=week)
**Discussion** | [All](https://reddit.com/r/wallstreetbets/search?sort=new&restrict_sr=on&q=flair%3ADiscussion) / [**Best Daily**](https://www.reddit.com/r/wallstreetbets/search?sort=top&q=flair%3ADiscussion&restrict_sr=on&t=day) / [Best Weekly](https://www.reddit.com/r/wallstreetbets/search?sort=top&q=flair%3ADiscussion&restrict_sr=on&t=week)
**YOLO** | [All](https://reddit.com/r/wallstreetbets/search?sort=new&restrict_sr=on&q=flair%3AYOLO) / [**Best Daily**](https://www.reddit.com/r/wallstreetbets/search?sort=top&q=flair%3AYOLO&restrict_sr=on&t=day) / [Best Weekly](https://www.reddit.com/r/wallstreetbets/search?sort=top&q=flair%3AYOLO&restrict_sr=on&t=week)
**Gain** | [All](https://reddit.com/r/wallstreetbets/search?sort=new&restrict_sr=on&q=flair%3AGain) / [**Best Daily**](https://www.reddit.com/r/wallstreetbets/search?sort=top&q=flair%3AGain&restrict_sr=on&t=day) / [Best Weekly](https://www.reddit.com/r/wallstreetbets/search?sort=top&q=flair%3AGain&restrict_sr=on&t=week)
**Loss** | [All](https://reddit.com/r/wallstreetbets/search?sort=new&restrict_sr=on&q=flair%3ALoss) / [**Best Daily**](https://www.reddit.com/r/wallstreetbets/search?sort=top&q=flair%3ALoss&restrict_sr=on&t=day) / [Best Weekly](https://www.reddit.com/r/wallstreetbets/search?sort=top&q=flair%3ALoss&restrict_sr=on&t=week)

[Weekly Earnings Discussion Thread](https://www.reddit.com/r/wallstreetbets/search?sort=new&restrict_sr=on&q=flair%3A%22Earnings%20Thread%22)

**Read the [rules](https://www.reddit.com/r/wallstreetbets/wiki/contentguide) and make sure other people follow them.**

Try [No Meme Mode](https://www.reddit.com/r/wallstreetbets/search/?q=-flair%3AMeme%20-flair%3ASatire%20-flair%3AShitpost&restrict_sr=1&t=day&sort=hot), also accessible through the top bar.",1612818023.0,0.94,https://www.reddit.com/r/wallstreetbets/comments/lflpoz/what_are_your_moves_tomorrow_february_09_2021/,OPINION_IS_UNPOPULAR
