,type,id,title,text,date,votes_ratio,url,author
0,comment,gmo3xyd,,Just wait until you stumble across the GME sub. 😬,1612849256.0,1,https://www.reddit.com/r/wallstreetbets/comments/lfu7mj/extraordinary_popular_delusions_and_the_madness/,hartleyshc
1,comment,gmo3y0m,,10x Spy 400c 2/19,1612849257.0,1,https://www.reddit.com/r/wallstreetbets/comments/lflpoz/what_are_your_moves_tomorrow_february_09_2021/,Not_an_okama
2,comment,gmo3y1c,,Only one way this ends. With him down $20k Friday.,1612849257.0,1,https://www.reddit.com/r/wallstreetbets/comments/lfgoit/most_genius_or_retarded_play/,TokeyX
3,comment,gmo3y1j,,But puts on Home Depot to stop the short ladder attacks,1612849257.0,1,https://www.reddit.com/r/wallstreetbets/comments/lf9rdy/gme_megathread_for_mon_28/,liquiscronr
4,comment,gmo3y3s,,"What? If I don’t sell, I don’t lose. 600 or 1000, if I don’t sell, I don’t lose",1612849259.0,1,https://v.redd.it/8fge2iflwbg61,Dogrules23
5,comment,gmo3y47,,"I've been investing for years. I've been researching GME a lot. I'm absolutely fascinated by this situation. I know you're probably sick of the same message, but it's really about comradery as we battle it out on this. 

You should check out r/stocks for what you're looking for.",1612849259.0,1,https://www.reddit.com/r/wallstreetbets/comments/lfva0j/gme/,pythonmine
6,comment,gmo3y4w,,Quit whining about the GME fools and just wait them out and slide their dumb content on the daily discussion.,1612849259.0,1,https://www.reddit.com/r/wallstreetbets/comments/lflpoz/what_are_your_moves_tomorrow_february_09_2021/,Jeff_Bezels
7,comment,gmo3y6m,,Oh? I thought it was r/traps,1612849260.0,1,https://www.reddit.com/r/wallstreetbets/comments/lflpoz/what_are_your_moves_tomorrow_february_09_2021/,innatangle
8,comment,gmo3y74,,"Hey, thanks for the DD. I went ahead and bought a share while I research more on this 

So glad to see...well, ANYTHING other than GME on my feed lol.",1612849261.0,1,https://www.reddit.com/r/wallstreetbets/comments/lfluvn/bionano_genomics_why_you_should_care_about_it/,RandalforMe
9,comment,gmo3y7b,,"Yea by then,
it would be eating raisins or making rent",1612849261.0,1,https://www.reddit.com/r/wallstreetbets/comments/lflpoz/what_are_your_moves_tomorrow_february_09_2021/,sockchaser
10,comment,gmo3y7o,,I like your user tag,1612849261.0,1,https://www.reddit.com/r/wallstreetbets/comments/lf9rdy/gme_megathread_for_mon_28/,eatbooties
11,comment,gmo3y87,,Then what is it? A gain?,1612849261.0,1,https://www.reddit.com/r/wallstreetbets/comments/lf9huy/daily_discussion_thread_for_february_08_2021/,ice_jj
12,comment,gmo3y88,,Funny I am currently watching this movie 😂,1612849261.0,1,https://v.redd.it/8fge2iflwbg61,King_Matt99
13,comment,gmo3y8j,,Fully liquid by tomorrow. Bears can have their day.,1612849262.0,1,https://www.reddit.com/r/wallstreetbets/comments/lflpoz/what_are_your_moves_tomorrow_february_09_2021/,redneckrich
14,comment,gmo3yan,,"Democratic funding in military budgets far exceeds republican spending in wars. I’d go long. We haven’t had a war in years and Boeing/ratheon were the biggest gainers in the Obama admin. Plus senate stocks surged during that time. It’s a good play but longer than shorter, given the admin. We will make good money off that move.",1612849263.0,1,https://www.reddit.com/r/wallstreetbets/comments/lfv9ah/rycey/,callmealyft
15,comment,gmo3yfr,,I was simply hoping to make quick money,1612849265.0,1,https://www.reddit.com/r/wallstreetbets/comments/lfva0j/gme/,grindrbuddy
16,comment,gmo3ygg,,I wouldn't have invested in it,1612849266.0,1,https://www.reddit.com/r/wallstreetbets/comments/lfs22f/why_ill_never_stop_buying_gme_and_why_you/,Bad-Roll-Blues
17,comment,gmo3ykc,,I'm still holding the line! Cant everyone buy more shares? wont that cause a Run ? no ?,1612849268.0,1,https://www.reddit.com/r/wallstreetbets/comments/lf9rdy/gme_megathread_for_mon_28/,new_patriot_david
18,comment,gmo3ykp,,Hmm I think we lowered them at the exact bottom of the pandemic crash...they gonna go negative to save our ass next time?,1612849268.0,1,https://www.reddit.com/r/wallstreetbets/comments/lflpoz/what_are_your_moves_tomorrow_february_09_2021/,iTradePasts
19,comment,gmo3ym6,,As a CRSR bull I hope it goes down in the short term to buy more of it,1612849269.0,1,https://www.reddit.com/r/wallstreetbets/comments/lflpoz/what_are_your_moves_tomorrow_february_09_2021/,Scrubdubss
20,comment,gmo3ytc,,"I am in the process of migrating my account to fidelity. I haven't had any issues, but I'm doing a full migration. I'm not trying to move any money. I should be fully moved over by the 12th. But, I found out that my stocks are locked and I can't do shit with them until the account has migrated. This, could be a major problem.",1612849272.0,1,https://www.reddit.com/r/wallstreetbets/comments/lfiji9/robinhoods_pieceofshittery_extends_to_them/,whyrweyelling
21,comment,gmo3yvj,,My long term bear case for CVS is that their PBM segment (Caremark) will get regulated out of existence (along with express scripts.),1612849273.0,1,https://www.reddit.com/r/wallstreetbets/comments/lfvg9b/cvs_10_of_michael_burrys_portfolio_and_why_it_is/,4858693929292
22,comment,gmo3ywx,,I’m fine with watching these idiots literally throw their money away more entertainment for me,1612849274.0,1,https://www.reddit.com/r/wallstreetbets/comments/lflpoz/what_are_your_moves_tomorrow_february_09_2021/,Coldkiller14
23,comment,gmo3yz9,,Holy shit I laughed myself into a fit and had to get my I haler for this shit...,1612849275.0,1,https://v.redd.it/8fge2iflwbg61,spiegro
24,comment,gmo3z20,,"Freshly posted into the game thread 

""Still think it's a movement you clowns you guys are taking it in the ass so hard"" 

Let's see how many down votes I get in 5 min",1612849277.0,1,https://www.reddit.com/r/wallstreetbets/comments/lflpoz/what_are_your_moves_tomorrow_february_09_2021/,jakebee55
25,comment,gmo3z2h,,SPY CALLS 🚀🚀,1612849277.0,1,https://www.reddit.com/r/wallstreetbets/comments/lflpoz/what_are_your_moves_tomorrow_february_09_2021/,ZiGgyOwl
26,comment,gmo3z86,,"AMD GANG, get some sleep, we leave at dawn",1612849280.0,1,https://www.reddit.com/r/wallstreetbets/comments/lflpoz/what_are_your_moves_tomorrow_february_09_2021/,Jww2124
27,comment,gmo3z9s,,"The most junior mod, I just handle spam and mop the floors at night.",1612849281.0,1,https://i.redd.it/u9n4gk4q7af61.jpg,Dan_inKuwait
28,comment,gmo3zbe,,after close?,1612849282.0,1,https://www.reddit.com/r/wallstreetbets/comments/lf9rdy/gme_megathread_for_mon_28/,buhurns
29,comment,gmo3zh8,,***Melvin! Melvin!!!***,1612849285.0,1,https://v.redd.it/8fge2iflwbg61,rwarimaursus
30,comment,gmo3zho,,"Found a new kink, thanks",1612849285.0,1,https://www.reddit.com/r/wallstreetbets/comments/lflpoz/what_are_your_moves_tomorrow_february_09_2021/,WSBNon-Believer
31,comment,gmo3zi3,,🚀🚀,1612849285.0,1,https://www.reddit.com/r/wallstreetbets/comments/lflpoz/what_are_your_moves_tomorrow_february_09_2021/,ZiGgyOwl
32,comment,gmo3zkc,,"Hello lil man! Bing it, champ.",1612849287.0,1,https://www.reddit.com/r/wallstreetbets/comments/lfs22f/why_ill_never_stop_buying_gme_and_why_you/,artofchores
33,comment,gmo3zqp,,"So you invested what you couldn’t afford

ROOKIE MISTAKE #1 

BUT DIAMONDS HANDS BABY ✋🏻💎",1612849290.0,3,https://www.reddit.com/r/wallstreetbets/comments/lflpoz/what_are_your_moves_tomorrow_february_09_2021/,Foliews
34,comment,gmo3zu2,,Thanks 😎,1612849292.0,1,https://www.reddit.com/r/wallstreetbets/comments/lf9rdy/gme_megathread_for_mon_28/,ImAMaaanlet
35,comment,gmo3zxz,,"But my question is what is their short cost basis now? Really think it’s still $10, $30, $50? Anything else and you’re fucked. Any arrogant hedger would short $200 gme looking to turn the bullion loss into a home run on the way back down.",1612849294.0,1,https://v.redd.it/0t82ygtyabg61,spacepanthermilk
36,comment,gmo3zzq,,“TCL ROKU” being mentioned on Ellen everyday doesn’t hurt either,1612849295.0,1,https://www.reddit.com/gallery/lfg4vq,DuckDuckYoga
37,comment,gmo409s,,Sorry best I can do is 270 degrees,1612849300.0,1,https://v.redd.it/5gofhjblabg61,SimplyTiredd
38,comment,gmo40cz,,If you sold calls youd be up a lot,1612849302.0,2,https://www.reddit.com/r/wallstreetbets/comments/lflpoz/what_are_your_moves_tomorrow_february_09_2021/,rsnerdout
39,comment,gmo40d0,,Yeah but for my two shares that's only $60. Might as well gamble!,1612849302.0,1,https://www.reddit.com/r/wallstreetbets/comments/lf9rdy/gme_megathread_for_mon_28/,vannucker
40,comment,gmo40ik,,Wouldn't the put buyer be paying tons of money to buy from OP? It's way deep ITM.,1612849305.0,1,https://www.reddit.com/r/wallstreetbets/comments/lfgoit/most_genius_or_retarded_play/,Punch_Tornado
41,comment,gmo40kc,,"Most brokers have good faith agreements where (even in a cash account), they'll let you trade instantly on the assumption the transfer you initiated will hit the account immediately. However, there's then the good faith violation, where:
Day 1: Buy security ABC
Day 2: Sell security ABC, Buy security XYZ
Day 3: Sell security XYZ, attempt to buy something else

That's a good faith violation, because the initial funds from sale of ABC haven't settled by the time you want to buy that third stock. Hence why a general rule is keep about 10% in cash or cash equivalent to prevent an accidental good faith violation. But at that point, you'd probably have graduated to a margin account to avoid this. Good faith is moreso based on settlement of stock trades, rather than bank funds.",1612849306.0,1,https://www.reddit.com/r/wallstreetbets/comments/lfugw9/robinhood_was_calling_my_account_a_margin_account/,sirgentrification
42,comment,gmo40ke,,Ban,1612849306.0,1,https://www.reddit.com/r/wallstreetbets/comments/lfvlb3/would_robinhood_have_to_buy_stock_for_customers/,dawgster99
43,comment,gmo40oi,,"PLTR is the minority report, the Direct listing and Lockup is all planned. They got 4 bald kids in a room feeding data into Foundry predicting best chart setups with Zaddy Karp orchestrating moves. This shit is gonna fucking rocket 🚀🚀🚀🚀🚀🚀🚀",1612849308.0,1,https://www.reddit.com/r/wallstreetbets/comments/lflpoz/what_are_your_moves_tomorrow_february_09_2021/,bigbosslord
44,comment,gmo40om,,i wish i could upvote this to the moon.,1612849308.0,1,https://v.redd.it/8fge2iflwbg61,DopeDetective
45,comment,gmo40oo,,Cathy bought a shit ton today. I say yes,1612849308.0,1,https://www.reddit.com/r/wallstreetbets/comments/lflpoz/what_are_your_moves_tomorrow_february_09_2021/,ZiGgyOwl
46,comment,gmo40pd,,It really is sad.  Poor bastards experiencing their first rug pull.,1612849309.0,1,https://www.reddit.com/r/wallstreetbets/comments/lflpoz/what_are_your_moves_tomorrow_february_09_2021/,livetomtb
47,comment,gmo40t9,,Enjoy life!,1612849311.0,1,https://i.redd.it/os2t8yayibg61.png,Wehhass
48,comment,gmo40tg,,Lmao it's from a 1440p monitor so there's a cock ton of pixels,1612849311.0,1,https://www.reddit.com/r/wallstreetbets/comments/lf9rdy/gme_megathread_for_mon_28/,Tucker-French
49,comment,gmo40w2,,Nice,1612849312.0,1,https://www.reddit.com/r/wallstreetbets/comments/lflpoz/what_are_your_moves_tomorrow_february_09_2021/,ilikepie145
50,comment,gmo40w1,,"Thanks for the explanation, very cool",1612849312.0,1,https://v.redd.it/8fge2iflwbg61,blazbluecore
51,comment,gmo4100,,Pls just let me out of these small pharma positions better than -30% and I swear I’ll never fomo again 🙏🏼,1612849314.0,1,https://www.reddit.com/r/wallstreetbets/comments/lflpoz/what_are_your_moves_tomorrow_february_09_2021/,killerk14
52,comment,gmo4102,,Because the goalposts will continue to move.,1612849314.0,1,https://www.reddit.com/r/wallstreetbets/comments/lfsuxd/serious_question_about_gme_short_data_report/,IFromDaFuture
53,comment,gmo410h,,Lemonade go moon?,1612849314.0,1,https://www.reddit.com/r/wallstreetbets/comments/lf9hby/dd_why_gamestop_gme_is_worth_1000_without_a/,kingopeth
54,comment,gmo411l,,"In that case I assume you haven’t sold since you like the stock, and in that case your losses are all on unrealized anyways. 

When GME rebounds to $420 in 69 years you could sell for a profit!",1612849315.0,1,https://v.redd.it/8fge2iflwbg61,schmeckesman
55,comment,gmo414j,,💎✊ not selling!!!!,1612849317.0,1,https://www.reddit.com/r/wallstreetbets/comments/lflzy4/fellow_gme_bagholders_and_retard_brother_apes_the/,DJLeBlanc77
56,comment,gmo419z,,It’s what I’ll miss the most about RH. Rotating extra cash into whatever whenever without it counting as a day trade.,1612849320.0,1,https://www.reddit.com/r/wallstreetbets/comments/lflpoz/what_are_your_moves_tomorrow_february_09_2021/,alphuscorp
57,comment,gmo41e3,,"I like this stock. 

There is a huge untapped market. Kids 10 and up, and the parents trying to buy a little sunshine cause the middle school and high school years can suck for some kids. Kids today don’t go to malt shops, record stores, and malls like past generations. Nope, they game, online. I will buy my 13 yr old a ps5, for his birthday just to get him to hug me. There is so much money to be made by retailers if they figure it out. And GameStop just might, they’re they’re employees have great customer service and that’s lacking elsewhere. They have answered some very dumb questions from me. So I will hold this stock till it rockets or I retire. And I will put money where my mouth is and buy more games and gear from them in the future.",1612849322.0,1,https://www.reddit.com/r/wallstreetbets/comments/lflzy4/fellow_gme_bagholders_and_retard_brother_apes_the/,CreativeRiddle
58,comment,gmo41fr,,Make this comment make sense,1612849323.0,1,https://www.reddit.com/r/wallstreetbets/comments/lfuzpe/noob_question_but_is_everything_published/,ttcmzx
59,comment,gmo41is,,"-$1k gang 😆😆

Fucking morons we are 😆😆😆😆",1612849325.0,1,https://v.redd.it/8fge2iflwbg61,spiegro
60,comment,gmo41j6,,RIP,1612849325.0,1,https://www.reddit.com/r/wallstreetbets/comments/lflpoz/what_are_your_moves_tomorrow_february_09_2021/,ZiGgyOwl
61,comment,gmo41k4,,"hey you know what would help, then? A clear list of rules, rather than instant permabans",1612849326.0,1,https://www.reddit.com/r/wallstreetbets/comments/lflpoz/what_are_your_moves_tomorrow_february_09_2021/,LovablePorn
62,comment,gmo41lr,,GUH,1612849327.0,1,https://www.reddit.com/r/wallstreetbets/comments/lflpoz/what_are_your_moves_tomorrow_february_09_2021/,arikevs
63,comment,gmo41vj,,What site is this?,1612849332.0,1,https://i.redd.it/os2t8yayibg61.png,Lazyleader
64,comment,gmo41wn,,Put in an order for 89,1612849333.0,1,https://www.reddit.com/r/wallstreetbets/comments/lfgvek/why_amd_is_gonna_blow_its_load_soon_15k_yolo/,touchmypenguinagain
65,comment,gmo41zj,,Ur mother was sick of you spending the rent money on GME so she asked me to pull some strings sorry man,1612849334.0,1,https://www.reddit.com/r/wallstreetbets/comments/lfv6li/can_we_just_have_a_gme_bb_amc_megathread/,RaiseYourLenny
66,comment,gmo425t,,"In all seriousness wouldn’t recommend the strategy. RYCEY may be worthwhile for a long play but like you said, the stock barely moves and has only been dropping. Held a 1000 shared at 1.5 and got rid around 1.4. It Has a long road to recovery",1612849338.0,1,https://www.reddit.com/r/wallstreetbets/comments/lfv9ah/rycey/,Muted-Habit
67,comment,gmo4275,,Probably walking around money for Marc Cuban.,1612849339.0,1,https://www.reddit.com/r/wallstreetbets/comments/lflpoz/what_are_your_moves_tomorrow_february_09_2021/,Jeff_Bezels
68,comment,gmo428r,,F,1612849340.0,1,https://v.redd.it/8fge2iflwbg61,spiegro
69,comment,gmo42bi,,4:20 PM 4/20/21 MOASS during AH get ready retards,1612849341.0,1,https://www.reddit.com/r/wallstreetbets/comments/lfr8nx/stop_giving_out_dates_for_when_stuff_will_happen/,budispro
70,comment,gmo42h2,,"Ignore these new cucks who came in here for GME fast money and are bag holding.

Good DD OP. I see you.",1612849344.0,1,https://www.reddit.com/r/wallstreetbets/comments/lfvg9b/cvs_10_of_michael_burrys_portfolio_and_why_it_is/,USFederalReserve
71,comment,gmo42hu,,"Complex financial instruments and detailed risk analysis through structural and regulatory frameworks allowed us to contain the unprecedented market volatility through industry standard capital requirements.

You’re welcome, Now fuck off. 

Regards,
DTCC",1612849345.0,1,https://www.reddit.com/r/wallstreetbets/comments/lfjogz/fundamentalstechnicals_of_dtcc_setting_collateral/,Wholistic
72,comment,gmo42lo,,r/RacismIsKindaBadass,1612849347.0,0,https://www.reddit.com/r/wallstreetbets/comments/lflpoz/what_are_your_moves_tomorrow_february_09_2021/,1005thArmbar
73,comment,gmo42pr,,Seriously.  We need to 💎✋ VXX shares.  Really show the establishment who's boss.,1612849349.0,1,https://www.reddit.com/r/wallstreetbets/comments/lflpoz/what_are_your_moves_tomorrow_february_09_2021/,mPiR_3dot1415
74,comment,gmo42qa,,Buy any 3d printing stock to make back your gme losses ya noobs,1612849349.0,1,https://www.reddit.com/r/wallstreetbets/comments/lflpoz/what_are_your_moves_tomorrow_february_09_2021/,RedWhiteBlueGreen
75,comment,gmo42rm,,$1 mil every 5 min,1612849350.0,1,https://www.reddit.com/r/wallstreetbets/comments/lf9rdy/gme_megathread_for_mon_28/,ziggy_rose
76,comment,gmo42tx,,"First we have SPY and VIX both being green, now 🌈🐻 coming out of the woodwork. Starting to make me feel a bit 🌈 myself",1612849351.0,2,https://www.reddit.com/r/wallstreetbets/comments/lflpoz/what_are_your_moves_tomorrow_february_09_2021/,ascendant23
77,comment,gmo42vv,,I would think the transfer would go through the same clearinghouse that allows companies to go more than 100% short. RH is probably just a pass through.,1612849352.0,1,https://www.reddit.com/r/wallstreetbets/comments/lfvlb3/would_robinhood_have_to_buy_stock_for_customers/,HockeyCookie
78,comment,gmo42w6,,"That is exactly what house money is.  I’m not sure why that term keeps getting cast about as some sort of heresy, when it’s precisely what most will try to achieve when gambling and/or trading.",1612849352.0,1,https://www.reddit.com/r/wallstreetbets/comments/lfu7mj/extraordinary_popular_delusions_and_the_madness/,windirfull
79,comment,gmo42xl,,6 pm,1612849353.0,1,https://www.reddit.com/r/wallstreetbets/comments/lfsuxd/serious_question_about_gme_short_data_report/,Ome6a13
80,comment,gmo42ym,,"Top is almost in we just need a celebrity to talk about stocks, mia doesnt count

Edit: ja rule killed gme LOL",1612849354.0,1,https://www.reddit.com/r/wallstreetbets/comments/lflpoz/what_are_your_moves_tomorrow_february_09_2021/,rsnerdout
81,comment,gmo42zu,,No.,1612849354.0,1,https://www.reddit.com/r/wallstreetbets/comments/lfva0j/gme/,UncleSusan01
82,comment,gmo4318,,As others have said I am seeing that it is activated automatically by them for instant deposits. My issue is that with Fidelity which I have used for years for other accounts also allows instant deposits but is not classified as a margin account.,1612849355.0,1,https://www.reddit.com/r/wallstreetbets/comments/lfugw9/robinhood_was_calling_my_account_a_margin_account/,CaveDeco
83,comment,gmo4351,,Ah so not much insight on why your mod team is apparently banning people for trying to stop users from killing themselves?,1612849357.0,1,https://i.redd.it/u9n4gk4q7af61.jpg,TIMMAH2
84,comment,gmo439m,,So let me get this straight... you want me to be your broker without paying me. Something tells me you won’t like my free advice.,1612849359.0,1,https://www.reddit.com/r/wallstreetbets/comments/lf9huy/daily_discussion_thread_for_february_08_2021/,professormaaark
85,comment,gmo439y,,That sounds like you would give up a fight because the other guy was fighting dirty. I call that a loser. Man the fuck up and beat his ass or at least try. Things need to be changed. It’s going to take more than just holding a stock but at least we are shedding some light on it. How about just let us fight and you can go home to mommy instead of throwing random sucker punches from the sidelines.,1612849359.0,1,https://www.reddit.com/r/wallstreetbets/comments/lfpzz9/qanongme_comparisons_and_how_we_learned_to_love/,-Workin-it-
86,comment,gmo43d3,,Idk if you're new here. Wsb is run by retard apes 💎🙌,1612849361.0,1,https://www.reddit.com/r/wallstreetbets/comments/lf9rdy/gme_megathread_for_mon_28/,swiese11234
87,comment,gmo43kh,,🚀,1612849365.0,2,https://www.reddit.com/r/wallstreetbets/comments/lflpoz/what_are_your_moves_tomorrow_february_09_2021/,CMurr1711
88,comment,gmo43o5,,"Like are we all in agreement that this is a bubble caused by interest rates and printer go brrr? 
Except we all just have different opinions about when it pops? Or are there legit people who think this isn’t a bubble?",1612849367.0,2,https://www.reddit.com/r/wallstreetbets/comments/lflpoz/what_are_your_moves_tomorrow_february_09_2021/,SpankyTheDog69
89,comment,gmo43t7,,All in psth calls (and my webull is all in gme),1612849370.0,1,https://www.reddit.com/r/wallstreetbets/comments/lflpoz/what_are_your_moves_tomorrow_february_09_2021/,Ballparkbuds
90,comment,gmo43tw,,"Quick , what do I go all in on tmr? I need to spice my week up",1612849370.0,3,https://www.reddit.com/r/wallstreetbets/comments/lflpoz/what_are_your_moves_tomorrow_february_09_2021/,Inner-Trip-456
91,comment,gmo43ut,,I got this weird feeling that gme bout to take off just as people are turning their attention away..,1612849371.0,5,https://www.reddit.com/r/wallstreetbets/comments/lf9rdy/gme_megathread_for_mon_28/,stevejobswasmurdered
92,comment,gmo43z2,,How’re you bagholding BB?,1612849373.0,1,https://www.reddit.com/r/wallstreetbets/comments/lftn5l/elons_raging_hard_boner_for_nokia/,pumabreath
93,comment,gmo441k,,"TOMORROW IS THE BIG DAY 🚀

• ⁠ITM call options for 1/31 expire • ⁠FTD’s settle which means hedge funds have to margin call all ITM options • ⁠Short ladder attacks are reactivated for 24 hours. ITM options expiring + FTD (Failure to Delivers for you pineheads) + suspension of ladder attacks = hedge funds are screwed.

💎 🙌

Repost for visibility

not financial advice I lick sharpies",1612849375.0,7,https://www.reddit.com/r/wallstreetbets/comments/lf9rdy/gme_megathread_for_mon_28/,oystrodoom
94,comment,gmo443o,,"Bitch with the bowl cut bossing those poor helpers around and annoying everyone . You should see how fucking dumb she looks coming back as a judge in S2 holy shit. Like a cartoon character. 

Lmfao I binged Blown Away S2 yesterday . Great show.",1612849376.0,1,https://www.reddit.com/r/wallstreetbets/comments/lflpoz/what_are_your_moves_tomorrow_february_09_2021/,DiekeanZero
95,comment,gmo446g,,"Eh, I’d rather drop truths on them til they go away. 

Fuck Karma. What’s Karma mean w/o WSB?

#ZERO!",1612849377.0,1,https://www.reddit.com/r/wallstreetbets/comments/lflpoz/what_are_your_moves_tomorrow_february_09_2021/,Prestigious_Count_62
96,comment,gmo4478,,Lol I had a 2000 corolla for years I feel ya,1612849378.0,1,https://www.reddit.com/r/wallstreetbets/comments/lflpoz/what_are_your_moves_tomorrow_february_09_2021/,Fizzy_T
97,comment,gmo448m,,Not a man.  Nice try. Go cry some more.,1612849378.0,1,https://www.reddit.com/r/wallstreetbets/comments/lfv6li/can_we_just_have_a_gme_bb_amc_megathread/,Ashpro2000
98,comment,gmo44bb,,You had me up until Detroit fintech capital of the world,1612849380.0,1,https://www.reddit.com/r/wallstreetbets/comments/lfsacx/but_analysts_say_rkt_isnt_a_buy_no_shit/,Gaffyd
99,comment,gmo44bm,,10% dividend stocks are trash,1612849380.0,1,https://i.redd.it/os2t8yayibg61.png,DarkLordKohan
100,comment,gmo44di,,bought calls on DKNG and immediately lost money. It was great.,1612849381.0,1,https://www.reddit.com/r/wallstreetbets/comments/lflpoz/what_are_your_moves_tomorrow_february_09_2021/,SoundSelection
101,comment,gmo44dj,,💪💪,1612849381.0,1,https://www.reddit.com/r/wallstreetbets/comments/lflpoz/what_are_your_moves_tomorrow_february_09_2021/,Turlututu_2
102,comment,gmo44ex,,Trying to find mircochip and semi conductor stonks to go in on... who has something sexy,1612849382.0,3,https://www.reddit.com/r/wallstreetbets/comments/lflpoz/what_are_your_moves_tomorrow_february_09_2021/,I8TheBeans
103,comment,gmo44iz,,I live for these posts,1612849384.0,1,https://www.reddit.com/r/wallstreetbets/comments/lfe7rn/robinhood_colluding_with_citadel_to_halt_buying/,Acesonnall
104,comment,gmo44ko,,oh yes. 250 end of march easy. i think etsy is really gonna blow up and i’m surprised that wsb hasn’t really caught onto it yet. it’s a perfect becky stock among other things,1612849385.0,1,https://www.reddit.com/r/wallstreetbets/comments/lflpoz/what_are_your_moves_tomorrow_february_09_2021/,pencilartsy
105,comment,gmo44no,,Sell because you need to pay back that payday loan eventually.,1612849386.0,1,https://www.reddit.com/r/wallstreetbets/comments/lflzy4/fellow_gme_bagholders_and_retard_brother_apes_the/,Notorious-PIG
106,comment,gmo44rt,,We need a group to go. Rent out a bunch of rooms and have a makeshift WSB retreat,1612849388.0,1,https://www.reddit.com/r/wallstreetbets/comments/lflpoz/what_are_your_moves_tomorrow_february_09_2021/,alphuscorp
107,comment,gmo44y3,,🤯,1612849392.0,1,https://www.reddit.com/r/wallstreetbets/comments/lflpoz/what_are_your_moves_tomorrow_february_09_2021/,Legolas_i_am
108,comment,gmo4519,,Lol yeah brooo my awareness,1612849394.0,2,https://www.reddit.com/r/wallstreetbets/comments/lflpoz/what_are_your_moves_tomorrow_february_09_2021/,THEYachtking
109,comment,gmo451e,,Every time.,1612849394.0,1,https://v.redd.it/8fge2iflwbg61,psychxticrose
