,type,id,title,text,date,votes_ratio,url,author
1420,comment,gmod75n,,"You the reason shampoo bottles have instructions on it.

Makes GME post to complain about too many GME posts SMH",1612856699.0,1,https://www.reddit.com/r/wallstreetbets/comments/lfq7ub/when_did_this_sub_become_gamestopbets/,King031
1421,comment,gmod77l,,holding for two more months drops federal tax rate to 22% while the retards were saying that's stupid and to just cash out back in november at 42% tax rate.,1612856701.0,1,https://www.reddit.com/r/wallstreetbets/comments/lf657e/to_ape_gang_why_sentiment_has_turned_against_you/,aecolu
1422,comment,gmod78s,,All I see is round 2,1612856702.0,1,https://www.reddit.com/gallery/lelqrc,illusionist_iv
1423,comment,gmod79x,,"Were are you buying that stuff at those prices?

- Arduino Nano Clone: $2
- LCD display: $3
- Servo: $2
- Prices for the Box and Rocket, cables is about right I would say
- Add another $20 for own manual labour for mass production 
Total about $40.

If you sell those $65-70 excl shipping you might even be able to make it profitable.",1612856703.0,1,https://v.redd.it/5gofhjblabg61,xxJohnxx
1424,comment,gmod7ga,,SNOW and ZM look ready to move,1612856707.0,1,https://www.reddit.com/r/wallstreetbets/comments/lflpoz/what_are_your_moves_tomorrow_february_09_2021/,Tilted-
1425,comment,gmod7o5,,change the fucking channel and GTFO!!!! your man tears is irritating!,1612856712.0,1,https://www.reddit.com/r/wallstreetbets/comments/lfva0j/gme/,Pretend2know
1426,comment,gmod7oi,,"Fuck you I was into bbby. my calls was going to make me a millionaire until they stopped the buying. :(  

why RKT over SQ?",1612856712.0,1,https://www.reddit.com/r/wallstreetbets/comments/lfsacx/but_analysts_say_rkt_isnt_a_buy_no_shit/,slashrshot
1427,comment,gmod7p2,,You think the same will work if it goes back down and buying LEAPS for 2022 ?,1612856712.0,1,https://i.redd.it/os2t8yayibg61.png,No_Dealer_8473
1428,comment,gmod7rg,,Agreed.,1612856714.0,1,https://www.reddit.com/r/wallstreetbets/comments/lflpoz/what_are_your_moves_tomorrow_february_09_2021/,Sweaty-Heat8384
1429,comment,gmod7tw,,What the fuck? August $80 leaps are like $500 a pop. I feel like this is just fucking free money?,1612856716.0,1,https://www.reddit.com/r/wallstreetbets/comments/lfvg9b/cvs_10_of_michael_burrys_portfolio_and_why_it_is/,captshtpst
1430,comment,gmod7uy,,Relax there are promising reasons to be long on BB,1612856716.0,1,https://www.reddit.com/r/wallstreetbets/comments/lflpoz/what_are_your_moves_tomorrow_february_09_2021/,BullyBumble
1431,comment,gmod7vo,,/r/micropenisstreetbets,1612856717.0,4,https://www.reddit.com/r/wallstreetbets/comments/lflpoz/what_are_your_moves_tomorrow_february_09_2021/,fawkesmulder
1432,comment,gmod7vq,,"We know, that’s why we’re here instead",1612856717.0,6,https://www.reddit.com/r/wallstreetbets/comments/lflpoz/what_are_your_moves_tomorrow_february_09_2021/,ascendant23
1433,comment,gmod7yi,,"good thing you did, rides over",1612856719.0,1,https://i.redd.it/os2t8yayibg61.png,tedwardbundy
1434,comment,gmod8an,,"Yes, S3 will publish, but it could be false data.",1612856727.0,2,https://www.reddit.com/r/wallstreetbets/comments/lf9rdy/gme_megathread_for_mon_28/,ItzBoogieMan
1435,comment,gmod8br,,FoR TeH LuLZ,1612856728.0,1,https://v.redd.it/8fge2iflwbg61,B__O__X__X__Y
1436,comment,gmod8c6,,"I’m down 80% as it is. I’ve lost that much already why paper hand for a few dollars.

Losses are just theoretical until you sell",1612856728.0,1,https://v.redd.it/8fge2iflwbg61,aesthetic_cock
1437,comment,gmod8h4,,This smells of pump and dump,1612856731.0,1,https://www.reddit.com/r/wallstreetbets/comments/lfttp8/free_money_alert_5_on_semiconductor_on_40c_exp_416/,dober88
1438,comment,gmod8jw,,Either that or after it expires,1612856733.0,1,https://www.reddit.com/gallery/lelqrc,illusionist_iv
1439,comment,gmod8ni,,I can be that real real you're looking for,1612856736.0,1,https://www.reddit.com/r/wallstreetbets/comments/lflpoz/what_are_your_moves_tomorrow_february_09_2021/,LeniSnow
1440,comment,gmod8r4,,I can't look at the front page. Has diamond hands McGee posted lately?,1612856738.0,1,https://www.reddit.com/r/wallstreetbets/comments/lflpoz/what_are_your_moves_tomorrow_february_09_2021/,the_heat_waver
1441,comment,gmod8xm,,Evolution is a myth,1612856742.0,2,https://www.reddit.com/r/wallstreetbets/comments/lflpoz/what_are_your_moves_tomorrow_february_09_2021/,donefukupped
1442,comment,gmod8zq,,"I can understand that. Definitely a lot better than coven, hotel, Roanoke and this new 80’s one tho",1612856743.0,1,https://www.reddit.com/r/wallstreetbets/comments/lflpoz/what_are_your_moves_tomorrow_february_09_2021/,GamesFranco
1443,comment,gmod92b,,"Been in since $1.7, moon seems fun",1612856745.0,1,https://www.reddit.com/r/wallstreetbets/comments/ld53bz/alpp/,de-joip
1444,comment,gmod93j,,Amc with good earnings reports? Dude have you been living under a rock? Half the country was closed down last quarter due to covid,1612856746.0,1,https://www.reddit.com/r/wallstreetbets/comments/lflpoz/what_are_your_moves_tomorrow_february_09_2021/,ryanryans425
1445,comment,gmod9eq,,shit lets get to 30 something first,1612856754.0,2,https://www.reddit.com/r/wallstreetbets/comments/lflpoz/what_are_your_moves_tomorrow_february_09_2021/,F10andTheHotKeys
1446,comment,gmod9fl,,TSLA please show me some love today,1612856755.0,5,https://www.reddit.com/r/wallstreetbets/comments/lflpoz/what_are_your_moves_tomorrow_february_09_2021/,getmetodc
1447,comment,gmod9g7,,This might sound a little strange but I think going forward routine testing for covid-19 variants will become increasingly more commonplace. I imagine it'll be part of your regular checkups. Of course I'm just a retard talking at like 11:45 on a weekday.,1612856755.0,1,https://www.reddit.com/r/wallstreetbets/comments/lfx076/vaccine_stonks_a_good_investment_now_that_its/,Blatheringman
1448,comment,gmod9gv,,"I bought $50k of the Canadian Airline Air Canada.  Gov bailout incoming; nice pop coming soon.

I also have a call on KEY.TO for $212 on 3/19",1612856755.0,2,https://www.reddit.com/r/wallstreetbets/comments/lflpoz/what_are_your_moves_tomorrow_february_09_2021/,MomoTheFarmer
1449,comment,gmod9qk,,I'm just a 🐒 please explain what last is,1612856763.0,3,https://i.redd.it/78clurt0eeg61.jpg,BearishDieVirgins
1450,comment,gmod9ur,,"QCOM is only 10% off of its all-time high, and trading on the same plateau it reached only 3 months ago. That right there doesn't make it sound ""oversold"".",1612856766.0,1,https://www.reddit.com/r/wallstreetbets/comments/lftq2y/i_believe_qualcomm_will_recover/,Nintendie69
1451,comment,gmod9w3,,"So, how is this ""useful"" as the rules dictate?",1612856766.0,1,https://i.redd.it/os2t8yayibg61.png,Buzzed_Bee
1452,comment,gmod9wq,,Is this a... what day is this?,1612856767.0,1,https://www.reddit.com/r/wallstreetbets/comments/lfx076/vaccine_stonks_a_good_investment_now_that_its/,BigLebowskiBot
1453,comment,gmod9z4,,Mad cus you're porn addicted and alone with a coomer brain.,1612856769.0,1,https://www.reddit.com/r/wallstreetbets/comments/lflpoz/what_are_your_moves_tomorrow_february_09_2021/,PISSTICKLER11
1454,comment,gmod9zq,,GE 1/22 $25 leaps are .19. When they purchase FCEL they will be 1.00 or more,1612856769.0,1,https://www.reddit.com/r/wallstreetbets/comments/lflpoz/what_are_your_moves_tomorrow_february_09_2021/,backfromthedead
1455,comment,gmoda4l,,I mean it’s unfortunate and all but I wouldn’t be blaming his death on them as much as I hate Robinhood,1612856772.0,0,https://www.dailymail.co.uk/news/article-9236987/Parents-man-committed-suicide-thinking-owed-Robinhood-730k-sues-company.html,thisistough1
1456,comment,gmoda5u,,nah I can afford to move. just that I'm traveling 3 months in asia first.,1612856773.0,1,https://www.reddit.com/r/wallstreetbets/comments/lf657e/to_ape_gang_why_sentiment_has_turned_against_you/,aecolu
1457,comment,gmoda6h,,"Bleeding, lol.",1612856773.0,1,https://www.reddit.com/r/wallstreetbets/comments/lflpoz/what_are_your_moves_tomorrow_february_09_2021/,CashisCole253
1458,comment,gmoda8e,,"Going all in, so when my wife's boyfriend ask me how I ~~lost~~ made all my money in 2021 I can say: **GAME ON**.",1612856775.0,1,https://www.reddit.com/r/wallstreetbets/comments/lfttp8/free_money_alert_5_on_semiconductor_on_40c_exp_416/,r2002
1459,comment,gmoda8h,,"That’s too low, 1000 minimum",1612856775.0,1,https://www.reddit.com/r/wallstreetbets/comments/lflpoz/what_are_your_moves_tomorrow_february_09_2021/,Grotty199
1460,comment,gmoda9k,,Mind Medicine,1612856775.0,1,https://www.reddit.com/r/wallstreetbets/comments/lflpoz/what_are_your_moves_tomorrow_february_09_2021/,AmbitiousSingh
1461,comment,gmodaa8,,"hey, it's a start",1612856776.0,2,https://www.reddit.com/r/wallstreetbets/comments/lflpoz/what_are_your_moves_tomorrow_february_09_2021/,SketchyConcierge
1462,comment,gmodady,,This is actually a really good analogy.,1612856778.0,1,https://www.reddit.com/r/wallstreetbets/comments/lff3g1/something_i_noticed_people_have_confused_about/,poopiedoodles
1463,comment,gmodafc,,"Yeh I mean we been saying that, but I feel like I'd lose my fucking mind at his age. You know? Just bein too emotional to think rationally.

Like the other dude said though, I'd bet he probably had other mental problems going on before this",1612856779.0,1,https://www.dailymail.co.uk/news/article-9236987/Parents-man-committed-suicide-thinking-owed-Robinhood-730k-sues-company.html,DarkStar668
1464,comment,gmodagg,,How come she made a big deal about never even showing nips for ages and then BAM now she’s just taking loads to her face left and right?,1612856780.0,4,https://www.reddit.com/r/wallstreetbets/comments/lflpoz/what_are_your_moves_tomorrow_february_09_2021/,ascendant23
1465,comment,gmodaid,,"They might be referring to this:

https://finance.yahoo.com/video/ibm-palantir-partner-ai-offerings-195006040.html",1612856781.0,1,https://www.reddit.com/r/wallstreetbets/comments/lflpoz/what_are_your_moves_tomorrow_february_09_2021/,CowboyBebopCrew
1466,comment,gmodajk,,Deez,1612856782.0,1,https://www.reddit.com/r/wallstreetbets/comments/lfttp8/free_money_alert_5_on_semiconductor_on_40c_exp_416/,Pma2kdota
1467,comment,gmodaly,,Amazing that you can only mischaracterize and generalize me and respond to a fucking straw man you've built in your head. Do you remember the part where I said it makes it or **breaks it**? As in I'm out if there aren't shorts? Stupid cunt.,1612856784.0,1,https://www.reddit.com/r/wallstreetbets/comments/lf9rdy/gme_megathread_for_mon_28/,besonder97
1468,comment,gmodape,,"Its a fucking edgy subreddit you pussy. You dont jump in mud and complain its dirty. 

&#x200B;

Stop. Being. A. Pussy.",1612856786.0,1,https://www.reddit.com/r/wallstreetbets/comments/lfi2hf/dont_let_people_shame_you_into_buying_selling_or/,bobikanucha
1469,comment,gmodapx,,Do you guys get tired of making the same memes over and over again?,1612856787.0,1,https://v.redd.it/6b02uj9yw9g61,Ieatassneverstarving
1470,comment,gmodasb,,"Well let's hope there are some good news, when it will be announced in 1 h  ?",1612856788.0,1,https://www.reddit.com/r/wallstreetbets/comments/lf9rdy/gme_megathread_for_mon_28/,Ansamemsium
1471,comment,gmodatm,,"I just meet my guy at a random hotel in my city.
In all seriousness think I sold my kidneys at the dip.",1612856789.0,2,https://www.reddit.com/r/wallstreetbets/comments/lfs22f/why_ill_never_stop_buying_gme_and_why_you/,TradingInMyLambo
1472,comment,gmodau4,,So you got just the tip?,1612856789.0,2,https://www.reddit.com/r/wallstreetbets/comments/lfwkt0/short_squeezing_for_dummies/,Aickrastly
1473,comment,gmodb4a,,"!remindME April 1, 2021

 **Amc** in [Simple Gematria](https://www.gematrix.org/?word=AMC#english-results) equals: **17**:a1m13c3",1612856797.0,1,https://www.reddit.com/r/wallstreetbets/comments/lfpzz9/qanongme_comparisons_and_how_we_learned_to_love/,wegbored
1474,comment,gmodb6f,,Congrats on your overnight millionaire status.,1612856798.0,1,https://i.redd.it/os2t8yayibg61.png,ObiJuanKenobi3
1475,comment,gmodbba,,"No. 

This is incredibly simple.....

43 aphria x 0.84 = total number of tilray shares you'll have",1612856802.0,1,https://www.reddit.com/r/wallstreetbets/comments/lfekke/millions_in_pot_stocks_rockets_to_mars_and_your/,TimsKillerRabbit
1476,comment,gmodbd6,,"I hope you will take care of yourself, mate. All the best.",1612856803.0,1,https://www.reddit.com/r/wallstreetbets/comments/lf9rdy/gme_megathread_for_mon_28/,shortyafter
1477,comment,gmodbh3,,Show 🍉,1612856806.0,1,https://www.reddit.com/r/wallstreetbets/comments/lflpoz/what_are_your_moves_tomorrow_february_09_2021/,Bexanderthebex
1478,comment,gmodbh5,,I'd rather call it a theory,1612856806.0,1,https://www.reddit.com/r/wallstreetbets/comments/lflpoz/what_are_your_moves_tomorrow_february_09_2021/,LeniSnow
1479,comment,gmodbog,,The downside to buying fractional shares is that limit sell/buy orders can’t be placed with them which makes things a lot easier oppose to market orders which  could potentially buy or sell at a much different price than it was at when you clicked buy/sell.,1612856812.0,1,https://v.redd.it/rw9nwwxmu6g61,iforgotmymainacc
1480,comment,gmodbpp,,This is the way,1612856812.0,1,https://v.redd.it/5gofhjblabg61,b0mbSquad_1
1481,comment,gmodbt6,,What makes u think this? The government has done nothing but fuck things up for air Canada this past year.,1612856815.0,1,https://www.reddit.com/r/wallstreetbets/comments/lflpoz/what_are_your_moves_tomorrow_february_09_2021/,blazeitbets
1482,comment,gmodc0s,,Next week “I wish I bought Mara under 100”,1612856821.0,4,https://www.reddit.com/r/wallstreetbets/comments/lflpoz/what_are_your_moves_tomorrow_february_09_2021/,lenovo4life
1483,comment,gmodc9i,,What did you say?,1612856827.0,1,https://v.redd.it/8fge2iflwbg61,PiDawg
1484,comment,gmodccv,,"tis but a scratch

GREEN OPENING",1612856829.0,1,https://www.reddit.com/r/wallstreetbets/comments/lflpoz/what_are_your_moves_tomorrow_february_09_2021/,BluCSGO
1485,comment,gmodcgr,,You got lucky and basically won the lottery. GME was and still is a terrible stock to get into. Yall are legit dumb,1612856832.0,1,https://i.redd.it/os2t8yayibg61.png,SpaceCowboi13
1486,comment,gmodcgy,,"Go watch, is you

[https://www.netflix.com/title/80990663](https://www.netflix.com/title/80990663)",1612856832.0,1,https://www.reddit.com/r/wallstreetbets/comments/lfgoit/most_genius_or_retarded_play/,koreanz
1487,comment,gmodcjh,,🍉,1612856834.0,2,https://www.reddit.com/r/wallstreetbets/comments/lflpoz/what_are_your_moves_tomorrow_february_09_2021/,LeniSnow
1488,comment,gmodcm4,,I don't even have a wife no more.,1612856835.0,1,https://v.redd.it/qc9y9ps4jcg61,TradingInMyLambo
1489,comment,gmodcnj,,I thought it was a Wendy's?,1612856836.0,1,https://www.reddit.com/r/wallstreetbets/comments/lflpoz/what_are_your_moves_tomorrow_february_09_2021/,mattcruise
1490,comment,gmodcnl,,Actively trying to take it back. Pinned still a no man’s land though,1612856837.0,2,https://www.reddit.com/r/wallstreetbets/comments/lf9hv1/unpinned_daily_discussion_thread_for_february_08/,ManOfDiscovery
1491,comment,gmodco0,,Purchase occurring when,1612856837.0,2,https://www.reddit.com/r/wallstreetbets/comments/lflpoz/what_are_your_moves_tomorrow_february_09_2021/,AlphaZ33
1492,comment,gmodco3,,Yeah same ill buy it when its back at $15-20 for sure but this is insane,1612856837.0,1,https://www.reddit.com/r/wallstreetbets/comments/lfr8nx/stop_giving_out_dates_for_when_stuff_will_happen/,spearminto
1493,comment,gmodcom,,As opposed to this thread full of delusional people..,1612856837.0,2,https://www.reddit.com/r/wallstreetbets/comments/lflpoz/what_are_your_moves_tomorrow_february_09_2021/,Renegade2592
1494,comment,gmodcqz,,I like the way you describe it. Reminds me of bukowski and the racetrack,1612856839.0,1,https://www.reddit.com/r/wallstreetbets/comments/lfs22f/why_ill_never_stop_buying_gme_and_why_you/,ant_two
1495,comment,gmodctw,,"I will be messaging you in 1 month on [**2021-04-01 00:00:00 UTC**](http://www.wolframalpha.com/input/?i=2021-04-01%2000:00:00%20UTC%20To%20Local%20Time) to remind you of [**this link**](https://np.reddit.com/r/wallstreetbets/comments/lfpzz9/qanongme_comparisons_and_how_we_learned_to_love/gmodb4a/?context=3)

[**CLICK THIS LINK**](https://np.reddit.com/message/compose/?to=RemindMeBot&subject=Reminder&message=%5Bhttps%3A%2F%2Fwww.reddit.com%2Fr%2Fwallstreetbets%2Fcomments%2Flfpzz9%2Fqanongme_comparisons_and_how_we_learned_to_love%2Fgmodb4a%2F%5D%0A%0ARemindMe%21%202021-04-01%2000%3A00%3A00%20UTC) to send a PM to also be reminded and to reduce spam.

^(Parent commenter can ) [^(delete this message to hide from others.)](https://np.reddit.com/message/compose/?to=RemindMeBot&subject=Delete%20Comment&message=Delete%21%20lfpzz9)

*****

|[^(Info)](https://np.reddit.com/r/RemindMeBot/comments/e1bko7/remindmebot_info_v21/)|[^(Custom)](https://np.reddit.com/message/compose/?to=RemindMeBot&subject=Reminder&message=%5BLink%20or%20message%20inside%20square%20brackets%5D%0A%0ARemindMe%21%20Time%20period%20here)|[^(Your Reminders)](https://np.reddit.com/message/compose/?to=RemindMeBot&subject=List%20Of%20Reminders&message=MyReminders%21)|[^(Feedback)](https://np.reddit.com/message/compose/?to=Watchful1&subject=RemindMeBot%20Feedback)|
|-|-|-|-|",1612856841.0,1,https://www.reddit.com/r/wallstreetbets/comments/lfpzz9/qanongme_comparisons_and_how_we_learned_to_love/,RemindMeBot
1496,comment,gmodcy6,,just buy the coins themselves imo,1612856844.0,4,https://www.reddit.com/r/wallstreetbets/comments/lflpoz/what_are_your_moves_tomorrow_february_09_2021/,fawkesmulder
1497,comment,gmodd2k,,If that was the case i would be rich,1612856847.0,1,https://www.reddit.com/r/wallstreetbets/comments/lflpoz/what_are_your_moves_tomorrow_february_09_2021/,The_good_die_2_young
1498,comment,gmodd5t,,"Man, that's how I feel living in California, but at least if I call those people morons they actually made a contribution that impacts my life.
I agree you're probably right that it's dead, yet you still are reading the megathread. Anyway if you want to give advice, why not tell people to buy puts since it will go down?",1612856849.0,1,https://www.reddit.com/r/wallstreetbets/comments/lf9rdy/gme_megathread_for_mon_28/,MonadoLink
1499,comment,gmodd83,,i bought 1 GME and like 70 some shares of AMC to show some support but already exited those lol,1612856850.0,1,https://www.reddit.com/r/wallstreetbets/comments/lf657e/to_ape_gang_why_sentiment_has_turned_against_you/,aecolu
1500,comment,gmoddda,,If you tards could jump into CNK to add some volume i’d love you. Its like the fookin Sahara in here...,1612856854.0,1,https://www.reddit.com/r/wallstreetbets/comments/lflpoz/what_are_your_moves_tomorrow_february_09_2021/,Kraketan
1501,comment,gmodde5,,name checks out,1612856854.0,1,https://www.reddit.com/r/wallstreetbets/comments/lfs22f/why_ill_never_stop_buying_gme_and_why_you/,flashosophy
1502,comment,gmoddhg,,You literally can’t lose,1612856857.0,1,https://v.redd.it/dk7dhj0v2eg61,Tugays_Tabs
1503,comment,gmoddiz,,Read the DD then shitpost idiot,1612856857.0,0,https://www.reddit.com/r/wallstreetbets/comments/lfs22f/why_ill_never_stop_buying_gme_and_why_you/,Broncer
1504,comment,gmoddjq,,">There are occasional nuggets of gold, but most of the time they don't get enough coverage because we're all retards and don't read so good. Anything popular gets turned into a meme though. This time last year DFV was posting incredibly in-depth GME DD and everyone was laughing about it because Gamestop was just the shitty retailer that ripped you off on trade-ins as a kid.

yep, that is what I knew gamestop for.  
bringing in a 100 dollar worth game and geting 3,99 for it.  


but then actually 2 bucks cause the cd was scratched according to the clerk.

&#x200B;

and then reselling it 2 hours later for 35 bucks

&#x200B;

&#x200B;

yeah, I dont really see any structure here on WSB.

sure, currently it's tons of holding GME memes, but before, it wasnt much different either, was it?

&#x200B;

like there arent really serious topics or serious discussions, from what I see",1612856858.0,1,https://www.reddit.com/r/wallstreetbets/comments/lfju61/the_sec_website_is_basically_a_government/,densch92
1505,comment,gmoddmy,,You have me,1612856860.0,2,https://www.reddit.com/r/wallstreetbets/comments/lfttp8/free_money_alert_5_on_semiconductor_on_40c_exp_416/,riotskunk
1506,comment,gmoddqy,,I wonder what’s the next stock that people in the nightly thread will always be checking the price of in Zimbabwe or Myanmar for,1612856863.0,5,https://www.reddit.com/r/wallstreetbets/comments/lflpoz/what_are_your_moves_tomorrow_february_09_2021/,ascendant23
1507,comment,gmoddsx,,"Also new, but it seems weird that there is evidence it was selling at that price, while that is not the price that is what is being shown on any of the charts.

Edit to add: just noticed it’s after hours. No idea then",1612856865.0,2,https://i.redd.it/78clurt0eeg61.jpg,Hiddenagenda876
1508,comment,gmoddti,,"He said he doesn’t want to jump in until it’s $20....which is far less likely now. 

Are you confusing cash secured puts with covered calls?",1612856865.0,0,https://www.reddit.com/r/wallstreetbets/comments/lf9rdy/gme_megathread_for_mon_28/,0ptimusPrim0
1509,comment,gmoddw5,,I’ll let you fuck my boyfriends wife. I have to ask him first though.,1612856867.0,1,https://www.reddit.com/gallery/lfg4vq,I__like__food__
1510,comment,gmoddz3,,"The fact that TSLA now tied itself to electric pennies, will it be tied to it when it goes for it's scheduled crashes??",1612856869.0,6,https://www.reddit.com/r/wallstreetbets/comments/lflpoz/what_are_your_moves_tomorrow_february_09_2021/,donefukupped
1511,comment,gmoddz6,,$469.20 and atill holding to be specific,1612856869.0,1,https://www.reddit.com/r/wallstreetbets/comments/lflpoz/what_are_your_moves_tomorrow_february_09_2021/,yoitsn8
1512,comment,gmode0i,,"My avatar profile looks so cool wtf yall looking like some real default bots 
DIS to the moon!!",1612856870.0,1,https://www.reddit.com/r/wallstreetbets/comments/lflpoz/what_are_your_moves_tomorrow_february_09_2021/,Wsbgodd
1513,comment,gmode1q,,What if it's a bag full of charters?,1612856871.0,1,https://www.reddit.com/r/wallstreetbets/comments/lff3g1/something_i_noticed_people_have_confused_about/,poopiedoodles
1514,comment,gmode2c,,Start growing gourds in my backyard. This is futures.,1612856871.0,7,https://www.reddit.com/r/wallstreetbets/comments/lflpoz/what_are_your_moves_tomorrow_february_09_2021/,THR0WAWAY417
1515,comment,gmode2w,,Maybe I can?,1612856871.0,2,https://www.reddit.com/r/wallstreetbets/comments/lflpoz/what_are_your_moves_tomorrow_february_09_2021/,LeniSnow
1516,comment,gmode3r,,Oh well that’s not very helpful then. I guess it will expose there lies that a lot believed about them saying they covered the shares on the 29th,1612856872.0,1,https://v.redd.it/rw9nwwxmu6g61,iforgotmymainacc
1517,comment,gmode85,,"Why not pull out and re put 50,000 again",1612856875.0,1,https://www.reddit.com/gallery/lfg4vq,laidbackc
1518,comment,gmodeew,,"I don't fully buy into the Pinterest hype, but man PIN options are insanely profitable.",1612856879.0,1,https://www.reddit.com/r/wallstreetbets/comments/lfb2w4/weekly_stock_market_news_goog_amzn_pins_sq_pypl/,r2002
1519,comment,gmodeik,,"I can’t read and I sure as shot can’t do maths, so I’m just gonna hold my stonk close and maybe take it out to dinner",1612856881.0,1,https://v.redd.it/8fge2iflwbg61,OWiseOne69
1520,comment,gmodekl,,You seem awfully angry but I guess I would be too if I was losing a lot of money. At least you’re smart enough to stick to a plan and get out. I’m speaking to the other cultists that are going to be switching reasons when stock price doesn’t explode.,1612856883.0,1,https://www.reddit.com/r/wallstreetbets/comments/lf9rdy/gme_megathread_for_mon_28/,1017GucciMane
1521,comment,gmodekv,,europoors letting me down on PLTR? wtf,1612856883.0,3,https://www.reddit.com/r/wallstreetbets/comments/lflpoz/what_are_your_moves_tomorrow_february_09_2021/,SketchyConcierge
1522,comment,gmodelo,,"For those that need it there's a small sub dedicated to helping people deal with losses, not so much financially as just a few kinds words and for those that don't need it but have experience dealing with losses and things like over investing it needs all the help it can get.

/r/Tradingtherapy 

It's very small RN, but the idea is a good one IMO. Also, it's all just money - don't trade on margin, never trade with more than you're willing to lose on speculative plays, etc. Be safe.",1612856884.0,1,https://www.dailymail.co.uk/news/article-9236987/Parents-man-committed-suicide-thinking-owed-Robinhood-730k-sues-company.html,SiFixD
1523,comment,gmodemk,,I’ve literally had those same contracts for a couple months lol bought at .26 though. Saw the article on robinhood of them potentially buying plug or fcel and hoping that goes through lol,1612856884.0,3,https://www.reddit.com/r/wallstreetbets/comments/lflpoz/what_are_your_moves_tomorrow_february_09_2021/,The_Dancing_Dolphin
1524,comment,gmodenc,,Some of you new ♿️ don’t know ARK and it shows,1612856885.0,5,https://www.reddit.com/r/wallstreetbets/comments/lflpoz/what_are_your_moves_tomorrow_february_09_2021/,ManOfDiscovery
1525,comment,gmodenz,,can someone explain exactly how this works. I know that you need to get at least 100 shares right? do you pay the current price? do you pay the price you think it will be?,1612856885.0,1,https://www.reddit.com/r/wallstreetbets/comments/lfgvek/why_amd_is_gonna_blow_its_load_soon_15k_yolo/,Hicrayert
1526,comment,gmodezv,,Will look out for his posts from now on. Thanks for pointing my out he does this often.,1612856894.0,2,https://www.reddit.com/r/wallstreetbets/comments/lfb2w4/weekly_stock_market_news_goog_amzn_pins_sq_pypl/,BennedictBennett
