,ACT Symbol,Company Name,Security Name,Exchange,CQS Symbol,ETF,Round Lot Size,Test Issue,NASDAQ Symbol
3752,PSA$T,Public Storage Depository Shares Representing 1/1000 Pfd Shares Beneficial Interest Series T,Public Storage Depository Shares Representing 1/1000 Pfd Shares Beneficial Interest Series T,N,PSApT,N,100.0,N,PSA-T
3753,PSA$U,Public Storage Depositary Shares Representing 1/1000 Preferred Benerficial Interest Series U,Public Storage Depositary Shares Representing 1/1000 Preferred Benerficial Interest Series U,N,PSApU,N,100.0,N,PSA-U
3754,PSA$V,Public Storage Dep Shs Repstg 1/1000th Pfd Sh Ben Int Ser V,Public Storage Dep Shs Repstg 1/1000th Pfd Sh Ben Int Ser V,N,PSApV,N,100.0,N,PSA-V
3755,PSA$W,Public Storage Depositary Shares Representing 1/1000 Preferred Shares of Benficial Interest Series W,Public Storage Depositary Shares Representing 1/1000 Preferred Shares of Benficial Interest Series W,N,PSApW,N,100.0,N,PSA-W
3756,PSA$X,Public Storage Depositary Shares Representing 1/1000th Cumulative Preferred Shares Beneficial Interest Series X,Public Storage Depositary Shares Representing 1/1000th Cumulative Preferred Shares Beneficial Interest Series X,N,PSApX,N,100.0,N,PSA-X
3757,PSA$Y,Public Storage Dep Shs Repstg 1/1000th Pfd Sh Ben Int Ser Y,Public Storage Dep Shs Repstg 1/1000th Pfd Sh Ben Int Ser Y,N,PSApY,N,100.0,N,PSA-Y
3758,PSA$Z,Public Storage Dep Shs Representing 1/1000th Pfd Sh Ben Int Ser Z,Public Storage Dep Shs Representing 1/1000th Pfd Sh Ben Int Ser Z,N,PSApZ,N,100.0,N,PSA-Z
3759,PSB,"PS Business Parks, Inc. Common Stock","PS Business Parks, Inc. Common Stock",N,PSB,N,100.0,N,PSB
3760,PSB$R,"PS Business Parks, Inc. Depositary Shares, Each representing 1/1,000 of a share of 6.875% Cumulative Preferred stock, Series R, $0.01 par","PS Business Parks, Inc. Depositary Shares, Each representing 1/1,000 of a share of 6.875% Cumulative Preferred stock, Series R, $0.01 par",N,PSBpR,N,100.0,N,PSB-R
3761,PSB$S,"PS Business Parks, Inc. Depositary Shares, each representing 1/1,000 of a share of 6.45% Cumulative Preferred Stock","PS Business Parks, Inc. Depositary Shares, each representing 1/1,000 of a share of 6.45% Cumulative Preferred Stock",N,PSBpS,N,100.0,N,PSB-S
3762,PSB$T,"PS Business Parks, Inc. Depositary Shares Representing 1/1000th Preferred Series T","PS Business Parks, Inc. Depositary Shares Representing 1/1000th Preferred Series T",N,PSBpT,N,100.0,N,PSB-T
3763,PSB$U,"PS Business Parks, Inc. Dep Shs Repstg 1/1000 Pfd Ser U","PS Business Parks, Inc. Dep Shs Repstg 1/1000 Pfd Ser U",N,PSBpU,N,100.0,N,PSB-U
3764,PSB$V,"PS Business Parks, Inc. Depositary Shares Represting 1/1000th Shares Cumulative Preferred Stock Series V","PS Business Parks, Inc. Depositary Shares Represting 1/1000th Shares Cumulative Preferred Stock Series V",N,PSBpV,N,100.0,N,PSB-V
3765,PSF,"Cohen & Steers Select Preferred and Income Fund, Inc. Common Stock","Cohen & Steers Select Preferred and Income Fund, Inc. Common Stock",N,PSF,N,100.0,N,PSF
3766,PSG,Performance Sports Group Ltd. Ordinary Shares (Canada),Performance Sports Group Ltd. Ordinary Shares (Canada),N,PSG,N,100.0,N,PSG
3767,PSI,PowerShares Dynamic Semiconductors,PowerShares Dynamic Semiconductors,P,PSI,Y,100.0,N,PSI
3768,PSJ,PowerShares Dynamic Software,PowerShares Dynamic Software,P,PSJ,Y,100.0,N,PSJ
3769,PSK,SPDR Wells Fargo Preferred Stock ETF,SPDR Wells Fargo Preferred Stock ETF,P,PSK,Y,100.0,N,PSK
3770,PSL,PowerShares DWA Consumer Staples Momentum Portfolio,PowerShares DWA Consumer Staples Momentum Portfolio,P,PSL,Y,100.0,N,PSL
3771,PSLV,Sprott Physical Silver Trust ETV,Sprott Physical Silver Trust ETV,P,PSLV,Y,100.0,N,PSLV
3772,PSO,"Pearson, Plc Common Stock","Pearson, Plc Common Stock",N,PSO,N,100.0,N,PSO
3773,PSP,PowerShares Listed Private Equity,PowerShares Listed Private Equity,P,PSP,Y,100.0,N,PSP
3774,PSQ,ProShares Short QQQ,ProShares Short QQQ,P,PSQ,Y,100.0,N,PSQ
3775,PSR,PowerShares Active U.S. Real Estate Fund,PowerShares Active U.S. Real Estate Fund,P,PSR,Y,100.0,N,PSR
3776,PST,ProShares UltraShort Lehman 7,ProShares UltraShort Lehman 7-10 Year Treasury,P,PST,Y,100.0,N,PST
3777,PSX,Phillips 66 Common Stock,Phillips 66 Common Stock,N,PSX,N,100.0,N,PSX
3778,PSXP,Phillips 66 Partners LP Common Units representing limited partner interest in the Partnership,Phillips 66 Partners LP Common Units representing limited partner interest in the Partnership,N,PSXP,N,100.0,N,PSXP
3779,PT,"Portugal Telecom SGPS, S.A . Common Stock","Portugal Telecom SGPS, S.A . Common Stock",N,PT,N,100.0,N,PT
3780,PTF,PowerShares DWA Technology Momentum Portfolio,PowerShares DWA Technology Momentum Portfolio,P,PTF,Y,100.0,N,PTF
3781,PTH,PowerShares DWA Healthcare Momentum Portfolio,PowerShares DWA Healthcare Momentum Portfolio,P,PTH,Y,100.0,N,PTH
3782,PTM,E,E-TRACS USB Bloomberg Commodity Index Exchange Traded Notes E-TRACS UBS Bloomberg CMCI Platinum ETN,P,PTM,N,100.0,N,PTM
3783,PTN,"Palatin Technologies, Inc. Common Stock","Palatin Technologies, Inc. Common Stock",A,PTN,N,100.0,N,PTN
3784,PTP,"Platinum Underwriters Holdings, Ltd","Platinum Underwriters Holdings, Ltd",N,PTP,N,100.0,N,PTP
3785,PTR,PetroChina Company Limited Common Stock,PetroChina Company Limited Common Stock,N,PTR,N,100.0,N,PTR
3786,PTY,Pimco Corporate & Income Opportunity Fund,Pimco Corporate & Income Opportunity Fund,N,PTY,N,100.0,N,PTY
3787,PUI,PowerShares DWA Utilities Momentum Portfolio,PowerShares DWA Utilities Momentum Portfolio,P,PUI,Y,100.0,N,PUI
3788,PUK,Prudential Public Limited Company Common Stock,Prudential Public Limited Company Common Stock,N,PUK,N,100.0,N,PUK
3789,PUK$,Prudential Public Limited Company 6.75% Perpetual Subordinated Captial Security,Prudential Public Limited Company 6.75% Perpetual Subordinated Captial Security,N,PUKp,N,100.0,N,PUK-
3790,PUK$A,Prudential Public Limited Company 6.50% Perpetual Subordinated Capital Securities Exchangeable at the Issuer's Option Into Non,Prudential Public Limited Company 6.50% Perpetual Subordinated Capital Securities Exchangeable at the Issuer's Option Into Non-Cumulative Dollar Denominated Preference Shares,N,PUKpA,N,100.0,N,PUK-A
3791,PUW,PowerShares WilderHill Progressive Energy Portfolio,PowerShares WilderHill Progressive Energy Portfolio,P,PUW,Y,100.0,N,PUW
3792,PVA,Penn Virginia Corporation Common Stock,Penn Virginia Corporation Common Stock,N,PVA,N,100.0,N,PVA
3793,PVCT,"Provectus Biopharmaceuticals, Inc.","Provectus Biopharmaceuticals, Inc.",A,PVCT,N,100.0,N,PVCT
3794,PVG,"Pretium Resources, Inc. Ordinary Shares (Canada)","Pretium Resources, Inc. Ordinary Shares (Canada)",N,PVG,N,100.0,N,PVG
3795,PVH,PVH Corp. Common Stock,PVH Corp. Common Stock,N,PVH,N,100.0,N,PVH
3796,PVI,PowerShares VRDO Tax Free Weekly Portfolio,PowerShares VRDO Tax Free Weekly Portfolio,P,PVI,Y,100.0,N,PVI
3797,PVTD,"PrivateBancorp, Inc. 7.125% Subordinated Debentures due 2042","PrivateBancorp, Inc. 7.125% Subordinated Debentures due 2042",N,PVTD,N,100.0,N,PVTD
3798,PW,Power REIT (MD) Common Stock,Power REIT (MD) Common Stock,A,PW,N,100.0,N,PW
3799,PW$A,Power REIT 7.75% Series A Cumulative Perpetual Preferred Stock,Power REIT 7.75% Series A Cumulative Perpetual Preferred Stock,A,PWpA,N,100.0,N,PW-A
3800,PWB,PowerShares Dynamic LargeCap Growth,PowerShares Dynamic LargeCap Growth,P,PWB,Y,100.0,N,PWB
3801,PWC,PowerShares XTF: Dynamic Market Portfolio,PowerShares XTF: Dynamic Market Portfolio,P,PWC,Y,100.0,N,PWC
3802,PWE,Penn West Petroleum Ltd,Penn West Petroleum Ltd,N,PWE,N,100.0,N,PWE
3803,PWR,"Quanta Services, Inc. Common Stock","Quanta Services, Inc. Common Stock",N,PWR,N,100.0,N,PWR
3804,PWV,PowerShares Dynamic LargeCap Value,PowerShares Dynamic LargeCap Value,P,PWV,Y,100.0,N,PWV
3805,PWZ,PowerShares California AMT,PowerShares California AMT-Free Municipal Bond Portfolio,P,PWZ,Y,100.0,N,PWZ
3806,PX,"Praxair, Inc. Common Stock","Praxair, Inc. Common Stock",N,PX,N,100.0,N,PX
3807,PXD,Pioneer Natural Resources Company Common Stock,Pioneer Natural Resources Company Common Stock,N,PXD,N,100.0,N,PXD
3808,PXE,PowerShares Dynamic Energy E&P,PowerShares Dynamic Energy E&P,P,PXE,Y,100.0,N,PXE
3809,PXF,PowerShares FTSE RAFI Developed Markets ex,PowerShares FTSE RAFI Developed Markets ex-U.S. Portfolio,P,PXF,Y,100.0,N,PXF
3810,PXH,PowerShares FTSE RAFI Emerging Markets Portfolio,PowerShares FTSE RAFI Emerging Markets Portfolio,P,PXH,Y,100.0,N,PXH
3811,PXI,PowerShares DWA Energy Momentum Portfolio,PowerShares DWA Energy Momentum Portfolio,P,PXI,Y,100.0,N,PXI
3812,PXJ,PowerShares Dynamic Oil Services,PowerShares Dynamic Oil Services,P,PXJ,Y,100.0,N,PXJ
3813,PXLC,PowerShares Fundamental Pure Large Core Portfolio,PowerShares Fundamental Pure Large Core Portfolio,P,PXLC,Y,100.0,N,PXLC
3814,PXLG,PowerShares Fundamental Pure Large Growth Portfolio,PowerShares Fundamental Pure Large Growth Portfolio,P,PXLG,Y,100.0,N,PXLG
3815,PXLV,PowerShares Fundamental Pure Large Value Portfolio,PowerShares Fundamental Pure Large Value Portfolio,P,PXLV,Y,100.0,N,PXLV
3816,PXMC,PowerShares Fundamental Pure Mid Core Portfolio,PowerShares Fundamental Pure Mid Core Portfolio,P,PXMC,Y,100.0,N,PXMC
3817,PXMG,PowerShares Fundamental Pure Mid Growth Portfolio,PowerShares Fundamental Pure Mid Growth Portfolio,P,PXMG,Y,100.0,N,PXMG
3818,PXMV,PowerShares Fundamental Pure Mid Value Portfolio,PowerShares Fundamental Pure Mid Value Portfolio,P,PXMV,Y,100.0,N,PXMV
3819,PXQ,PowerShares Dynamic Networking,PowerShares Dynamic Networking,P,PXQ,Y,100.0,N,PXQ
3820,PXR,PowerShares Global Emerging Markets Infrastructure,PowerShares Global Emerging Markets Infrastructure,P,PXR,Y,100.0,N,PXR
3821,PXSC,PowerShares Fundamental Pure Small Core Portfolio,PowerShares Fundamental Pure Small Core Portfolio,P,PXSC,Y,100.0,N,PXSC
3822,PXSG,PowerShares Fundamental Pure Small Growth Portfolio,PowerShares Fundamental Pure Small Growth Portfolio,P,PXSG,Y,100.0,N,PXSG
3823,PXSV,PowerShares Fundamental Pure Small Value Portfolio,PowerShares Fundamental Pure Small Value Portfolio,P,PXSV,Y,100.0,N,PXSV
3824,PYB,PPlus Trust Series GSG,PPlus Trust Series GSG-2 Tr Ctf Cl A,N,PYB,N,100.0,N,PYB
3825,PYN,PIMCO New York Municipal Income Fund III Common Shares of Beneficial Interest,PIMCO New York Municipal Income Fund III Common Shares of Beneficial Interest,N,PYN,N,100.0,N,PYN
3826,PYS,Merrill Lynch Depositor Inc PPlus Tr Ser RRD,Merrill Lynch Depositor Inc PPlus Tr Ser RRD-1 Tr Ctf Cl A,N,PYS,N,100.0,N,PYS
3827,PYT,PPlus Tr GSC,PPlus Tr GSC-2 Tr Ctf Fltg Rate,N,PYT,N,100.0,N,PYT
3828,PYZ,PowerShares DWA Basic Materials Momentum Portfolio,PowerShares DWA Basic Materials Momentum Portfolio,P,PYZ,Y,100.0,N,PYZ
3829,PZA,PowerShares National AMT,PowerShares National AMT-Free Municipal Bond Portfolio,P,PZA,Y,100.0,N,PZA
3830,PZB,"Merrill Lynch Depositor, Inc. Merrill Lynch Depositor, Inc. PPLUS Class A 6.7% Callable Trust Certificates, Series LTD","Merrill Lynch Depositor, Inc. Merrill Lynch Depositor, Inc. PPLUS Class A 6.7% Callable Trust Certificates, Series LTD-1 (Issues by Limited Brands, Inc.)",N,PZB,N,100.0,N,PZB
3831,PZC,PIMCO California Municipal Income Fund III Common Shares of Beneficial Interest,PIMCO California Municipal Income Fund III Common Shares of Beneficial Interest,N,PZC,N,100.0,N,PZC
3832,PZD,PowerShares Cleantech Portfolio,PowerShares Cleantech Portfolio,P,PZD,Y,100.0,N,PZD
3833,PZE,Petrobras Argentina S.A. ADS,Petrobras Argentina S.A. ADS,N,PZE,N,100.0,N,PZE
3834,PZG,Paramount Gold and Silver Corp. Common Stock,Paramount Gold and Silver Corp. Common Stock,A,PZG,N,100.0,N,PZG
3835,PZI,PowerShares Zacks Micro Cap,PowerShares Zacks Micro Cap,P,PZI,Y,100.0,N,PZI
3836,PZN,Pzena Investment Management Inc Class A Common Stock,Pzena Investment Management Inc Class A Common Stock,N,PZN,N,100.0,N,PZN
3837,PZT,PowerShares New York AMT,PowerShares New York AMT-Free Municipal Bond Portfolio,P,PZT,Y,100.0,N,PZT
3838,Q,Quintiles Transnational Holdings Inc. Common Stock,Quintiles Transnational Holdings Inc. Common Stock,N,Q,N,100.0,N,Q
3839,QAI,IQ Hedge MultiIQ Hedge Multi,IQ Hedge MultiIQ Hedge Multi-Strategy Tracker ETF,P,QAI,Y,100.0,N,QAI
3840,QAUS,SPDR MSCI Australia Quality Mix ETF,SPDR MSCI Australia Quality Mix ETF,P,QAUS,Y,100.0,N,QAUS
3841,QCAN,SPDR MSCI Canada Quality Mix ETF,SPDR MSCI Canada Quality Mix ETF,P,QCAN,Y,100.0,N,QCAN
3842,QDEF,FlexShares Quality Dividend Defensive Index Fund,FlexShares Quality Dividend Defensive Index Fund,P,QDEF,Y,100.0,N,QDEF
3843,QDEM,Market Vectors MSCI Emerging Markets Quality Dividend ETF,Market Vectors MSCI Emerging Markets Quality Dividend ETF,P,QDEM,Y,100.0,N,QDEM
3844,QDEU,SPDR MSCI Germany Quality Mix ETF,SPDR MSCI Germany Quality Mix ETF,P,QDEU,Y,100.0,N,QDEU
3845,QDF,FlexShares Quality Dividend Index Fund,FlexShares Quality Dividend Index Fund,P,QDF,Y,100.0,N,QDF
3846,QDXU,Market Vectors MSCI International Quality Dividend ETF,Market Vectors MSCI International Quality Dividend ETF,P,QDXU,Y,100.0,N,QDXU
3847,QDYN,FlexShares Quality Dynamic Index Fund,FlexShares Quality Dynamic Index Fund,P,QDYN,Y,100.0,N,QDYN
3848,QEFA,SPDR EURO STOXX Small Cap ETF,SPDR EURO STOXX Small Cap ETF,P,QEFA,Y,100.0,N,QEFA
3849,QEH,AdvisorShares QAM Equity Hedge,AdvisorShares QAM Equity Hedge,P,QEH,Y,100.0,N,QEH
3850,QEM,Market Vectors MSCI Emerging Markets Quality ETF,Market Vectors MSCI Emerging Markets Quality ETF,P,QEM,Y,100.0,N,QEM
3851,QEMM,SPDR MSCI Emerging Markets Quality Mix ETF,SPDR MSCI Emerging Markets Quality Mix ETF,P,QEMM,Y,100.0,N,QEMM
3852,QEP,"QEP Resources, Inc. Common Stock","QEP Resources, Inc. Common Stock",N,QEP,N,100.0,N,QEP
3853,QEPM,"QEP Midstream Partners, LP Common Units representing Limited Partner Interests","QEP Midstream Partners, LP Common Units representing Limited Partner Interests",N,QEPM,N,100.0,N,QEPM
3854,QESP,SPDR MSCI Spain Quality Mix ETF,SPDR MSCI Spain Quality Mix ETF,P,QESP,Y,100.0,N,QESP
3855,QGBR,SPDR MSCI United Kingdom Quality Mix ETF,SPDR MSCI United Kingdom Quality Mix ETF,P,QGBR,Y,100.0,N,QGBR
3856,QID,ProShares UltraShort QQQ,ProShares UltraShort QQQ,P,QID,Y,100.0,N,QID
3857,QIHU,"Qihoo 360 Technology Co. Ltd. American Depositary Shares, every 2 of which representing three Class A Ordinary Shares","Qihoo 360 Technology Co. Ltd. American Depositary Shares, every 2 of which representing three Class A Ordinary Shares",N,QIHU,N,100.0,N,QIHU
3858,QJPN,SPDR MSCI Japan Quality Mix ETF,SPDR MSCI Japan Quality Mix ETF,P,QJPN,Y,100.0,N,QJPN
3859,QKOR,SPDR MSCI South Korea Quality Mix ETF,SPDR MSCI South Korea Quality Mix ETF,P,QKOR,Y,100.0,N,QKOR
3860,QLD,ProShares Ultra QQQ,ProShares Ultra QQQ,P,QLD,Y,100.0,N,QLD
3861,QLTA,iShares Aaa A Rated Corporate Bond ETF,iShares Aaa A Rated Corporate Bond ETF,P,QLTA,Y,100.0,N,QLTA
3862,QLTB,iShares Baa Ba Rated Corporate Bond ETF,iShares Baa Ba Rated Corporate Bond ETF,Z,QLTB,Y,100.0,N,QLTB
3863,QLTC,iShares B Ca Rated Corporate Bond ETF,iShares B Ca Rated Corporate Bond ETF,Z,QLTC,Y,100.0,N,QLTC
3864,QMEX,SPDR MSCI Mexico Quality Mix ETF,SPDR MSCI Mexico Quality Mix ETF,P,QMEX,Y,100.0,N,QMEX
3865,QMN,IQ Hedge Market Neutral Tracker ETF,IQ Hedge Market Neutral Tracker ETF,P,QMN,Y,100.0,N,QMN
3866,QQQE,Direxion NASDAQ,Direxion NASDAQ-100 Equal Weighted Index Shares,P,QQQE,Y,100.0,N,QQQE
3867,QRM,Quest Rare Minerals Ltd Common Shares (Canada),Quest Rare Minerals Ltd Common Shares (Canada),A,QRM,N,100.0,N,QRM
3868,QSR,Restaurant Brands International Inc. Common Shares,Restaurant Brands International Inc. Common Shares,N,QSR,N,100.0,N,QSR
3869,QTM,Quantum Corporation Common Stock,Quantum Corporation Common Stock,N,QTM,N,100.0,N,QTM
3870,QTS,"QTS Realty Trust, Inc. Class A Common Stock","QTS Realty Trust, Inc. Class A Common Stock",N,QTS,N,100.0,N,QTS
3871,QTWN,SPDR MSCI Taiwan Quality Mix ETF,SPDR MSCI Taiwan Quality Mix ETF,P,QTWN,Y,100.0,N,QTWN
3872,QTWO,"Q2 Holdings, Inc. Common Stock","Q2 Holdings, Inc. Common Stock",N,QTWO,N,100.0,N,QTWO
3873,QUAD,"Quad Graphics, Inc Class A Common Stock","Quad Graphics, Inc Class A Common Stock",N,QUAD,N,100.0,N,QUAD
3874,QUAL,iShares MSCI USA Quality Factor ETF,iShares MSCI USA Quality Factor ETF,P,QUAL,Y,100.0,N,QUAL
3875,QVAL,ValueShares U.S. Quantitative Value ETF ETF,ValueShares U.S. Quantitative Value ETF ETF,Z,QVAL,Y,100.0,N,QVAL
3876,QWLD,SPDR MSCI World Quality Mix ETF,SPDR MSCI World Quality Mix ETF,P,QWLD,Y,100.0,N,QWLD
3877,QXUS,Market Vectors MSCI Int'l Qlty,Market Vectors MSCI Int'l Qlty,P,QXUS,Y,100.0,N,QXUS
3878,R,"Ryder System, Inc. Common Stock","Ryder System, Inc. Common Stock",N,R,N,100.0,N,R
3879,RAD,Rite Aid Corporation Common Stock,Rite Aid Corporation Common Stock,N,RAD,N,100.0,N,RAD
3880,RAI,Reynolds American Inc Common Stock,Reynolds American Inc Common Stock,N,RAI,N,100.0,N,RAI
3881,RALS,ProShares RAFI Long Short ETF,ProShares RAFI Long Short ETF,P,RALS,Y,100.0,N,RALS
3882,RALY,Rally Software Development Corp. Common Stock,Rally Software Development Corp. Common Stock,N,RALY,N,100.0,N,RALY
3883,RAS,RAIT Financial Trust New Common Shares of Beneficial Interest,RAIT Financial Trust New Common Shares of Beneficial Interest,N,RAS,N,100.0,N,RAS
3884,RAS$A,RAIT Financial Trust  7.75% Series A Cumulative Redeemable Preferred Shares of Beneficial Interest,RAIT Financial Trust  7.75% Series A Cumulative Redeemable Preferred Shares of Beneficial Interest,N,RASpA,N,100.0,N,RAS-A
3885,RAS$B,RAIT Financial Trust 8.375% Series B Cumulative Redeemable Preferred Shares of Beneficial Interest,RAIT Financial Trust 8.375% Series B Cumulative Redeemable Preferred Shares of Beneficial Interest,N,RASpB,N,100.0,N,RAS-B
3886,RAS$C,RAIT Financial Trust 8.875% Series C Cumulative Redeemable Preferred Shares of Beneficial Interest,RAIT Financial Trust 8.875% Series C Cumulative Redeemable Preferred Shares of Beneficial Interest,N,RASpC,N,100.0,N,RAS-C
3887,RATE,"Bankrate, Inc. Common Stock","Bankrate, Inc. Common Stock",N,RATE,N,100.0,N,RATE
3888,RAVI,FlexShares Ready Access Variable Income Fund,FlexShares Ready Access Variable Income Fund,P,RAVI,Y,100.0,N,RAVI
3889,RAX,"Rackspace Hosting, Inc Common Stock","Rackspace Hosting, Inc Common Stock",N,RAX,N,100.0,N,RAX
3890,RBA,Ritchie Bros. Auctioneers Incorporated Common Stock,Ritchie Bros. Auctioneers Incorporated Common Stock,N,RBA,N,100.0,N,RBA
3891,RBC,Regal Beloit Corporation Common Stock,Regal Beloit Corporation Common Stock,N,RBC,N,100.0,N,RBC
3892,RBL,SPDR S&P Russia ETF,SPDR S&P Russia ETF,P,RBL,Y,100.0,N,RBL
3893,RBS,Royal Bank of Scotland Group Plc New (The) ADS,Royal Bank of Scotland Group Plc New (The) ADS,N,RBS,N,100.0,N,RBS
3894,RBS$E,RBS Capital Funding Trust V,RBS Capital Funding Trust V,N,RBSpE,N,100.0,N,RBS-E
3895,RBS$F,Royal Bank of Scotland Group Plc (The) Preferred Stock,Royal Bank of Scotland Group Plc (The) Preferred Stock,N,RBSpF,N,100.0,N,RBS-F
3896,RBS$G,RBS Capital Funding Trust VII,RBS Capital Funding Trust VII,N,RBSpG,N,100.0,N,RBS-G
3897,RBS$H,Royal Bank of Scotland Group Plc (The) Preferred Stock,Royal Bank of Scotland Group Plc (The) Preferred Stock,N,RBSpH,N,100.0,N,RBS-H
3898,RBS$I,RBS Capital Funding Trust VI,RBS Capital Funding Trust VI,N,RBSpI,N,100.0,N,RBS-I
3899,RBS$L,Royal Bank of Scotland Group Plc (The) ADR representing One Non,"Royal Bank of Scotland Group Plc (The) ADR representing One Non-cumulative Dollar 5.75% Preference Shares, Series L",N,RBSpL,N,100.0,N,RBS-L
3900,RBS$M,Royal Bank of Scotland Group Plc (The) ADS Series M,Royal Bank of Scotland Group Plc (The) ADS Series M,N,RBSpM,N,100.0,N,RBS-M
3901,RBS$N,Royal Bank of Scotland Group Plc (The) Royal Bank of Scotland Group PLC (The) American Depositary Shares (each representing One Non,"Royal Bank of Scotland Group Plc (The) Royal Bank of Scotland Group PLC (The) American Depositary Shares (each representing One Non-Cumulative Dollar Preferenced Shares, Series N)",N,RBSpN,N,100.0,N,RBS-N
3902,RBS$P,Royal Bank of Scotland Group Plc (The) ADR representing Preferred Shares Series P,Royal Bank of Scotland Group Plc (The) ADR representing Preferred Shares Series P,N,RBSpP,N,100.0,N,RBS-P
3903,RBS$Q,Royal Bank of Scotland Group Plc (The) ADR repstg Pref Shs Ser Q,Royal Bank of Scotland Group Plc (The) ADR repstg Pref Shs Ser Q,N,RBSpQ,N,100.0,N,RBS-Q
3904,RBS$R,Royal Bank of Scotland Group Plc (The) ADR repstg USD Pfd Shs Ser R (United Kingdom),Royal Bank of Scotland Group Plc (The) ADR repstg USD Pfd Shs Ser R (United Kingdom),N,RBSpR,N,100.0,N,RBS-R
3905,RBS$S,Royal Bank of Scotland Group Plc (The) Sponsored ADR Repstg Pref Ser S (United Kingdom),Royal Bank of Scotland Group Plc (The) Sponsored ADR Repstg Pref Ser S (United Kingdom),N,RBSpS,N,100.0,N,RBS-S
3906,RBS$T,Royal Bank of Scotland Group Plc (The) Sponsored ADR Representing Pfef shs ser T (United Kingdom),Royal Bank of Scotland Group Plc (The) Sponsored ADR Representing Pfef shs ser T (United Kingdom),N,RBSpT,N,100.0,N,RBS-T
3907,RBY,Rubicon Minerals Corporation Ordinary Shares (Canada),Rubicon Minerals Corporation Ordinary Shares (Canada),A,RBY,N,100.0,N,RBY
3908,RCAP,RCS CAPITAL CORPORATION Common Stock,RCS CAPITAL CORPORATION Common Stock,N,RCAP,N,100.0,N,RCAP
3909,RCD,Guggenheim S&P 500 Equal Weight Consumer Discretionary ETF,Guggenheim S&P 500 Equal Weight Consumer Discretionary ETF,P,RCD,Y,100.0,N,RCD
3910,RCG,"RENN Fund, Inc Common Stock","RENN Fund, Inc Common Stock",A,RCG,N,100.0,N,RCG
3911,RCI,"Rogers Communication, Inc. Common Stock","Rogers Communication, Inc. Common Stock",N,RCI,N,100.0,N,RCI
3912,RCL,Royal Caribbean Cruises Ltd. Common Stock,Royal Caribbean Cruises Ltd. Common Stock,N,RCL,N,100.0,N,RCL
3913,RCS,"PIMCO Strategic Income Fund, Inc.","PIMCO Strategic Income Fund, Inc.",N,RCS,N,100.0,N,RCS
3914,RDC,Rowan Companies plc Class A Ordinary Shares,Rowan Companies plc Class A Ordinary Shares,N,RDC,N,100.0,N,RDC
3915,RDIV,RevenueShares Ultra Dividend Fund,RevenueShares Ultra Dividend Fund,P,RDIV,Y,100.0,N,RDIV
3916,RDN,Radian Group Inc. Common Stock,Radian Group Inc. Common Stock,N,RDN,N,100.0,N,RDN
3917,RDS.A,Royal Dutch Shell PLC Royal Dutch Shell American Depositary Shares (Each representing two Class A Ordinary Shares),Royal Dutch Shell PLC Royal Dutch Shell American Depositary Shares (Each representing two Class A Ordinary Shares),N,RDS/A,N,100.0,N,RDS.A
3918,RDS.B,Royal Dutch Shell PLC Royal Dutch Shell PLC American Depositary Shares (Each representing two Class B Ordinary Shares),Royal Dutch Shell PLC Royal Dutch Shell PLC American Depositary Shares (Each representing two Class B Ordinary Shares),N,RDS/B,N,100.0,N,RDS.B
3919,RDY,Dr. Reddy's Laboratories Ltd Common Stock,Dr. Reddy's Laboratories Ltd Common Stock,N,RDY,N,100.0,N,RDY
3920,RE,"Everest Re Group, Ltd. Common Stock","Everest Re Group, Ltd. Common Stock",N,RE,N,100.0,N,RE
3921,REE,Rare Element Resources Ltd. Ordinary Shares (Canada),Rare Element Resources Ltd. Ordinary Shares (Canada),A,REE,N,100.0,N,REE
3922,REED,"Reeds, Inc. Common Stock","Reeds, Inc. Common Stock",A,REED,N,100.0,N,REED
3923,REET,iShares Trust iShares Global REIT ETF,iShares Trust iShares Global REIT ETF,P,REET,Y,100.0,N,REET
3924,REG,Regency Centers Corporation Common Stock,Regency Centers Corporation Common Stock,N,REG,N,100.0,N,REG
3925,REG$F,Regency Centers Corporation Cumulative Red Preferred Series 6%,Regency Centers Corporation Cumulative Red Preferred Series 6%,N,REGpF,N,100.0,N,REG-F
3926,REG$G,Regency Centers Corporation Pfd Ser 7%,Regency Centers Corporation Pfd Ser 7%,N,REGpG,N,100.0,N,REG-G
3927,REI,"Ring Energy, Inc. Common Stock","Ring Energy, Inc. Common Stock",A,REI,N,100.0,N,REI
3928,REK,ProShares Short Real Estate,ProShares Short Real Estate,P,REK,Y,100.0,N,REK
3929,REM,iShares Mortgage Real Estate Capped ETF,iShares Mortgage Real Estate Capped ETF,P,REM,Y,100.0,N,REM
3930,REMX,Market Vectors Rare Earth Strategic Metals ETF,Market Vectors Rare Earth Strategic Metals ETF,P,REMX,Y,100.0,N,REMX
3931,REN,Resolute Energy Corporation Comon Stock,Resolute Energy Corporation Comon Stock,N,REN,N,100.0,N,REN
3932,RENN,"Renren Inc. American Depositary Shares, each representing three Class A ordinary shares","Renren Inc. American Depositary Shares, each representing three Class A ordinary shares",N,RENN,N,100.0,N,RENN
3933,RES,"RPC, Inc. Common Stock","RPC, Inc. Common Stock",N,RES,N,100.0,N,RES
3934,RESI,Altisource Residential Corporation Common Stock,Altisource Residential Corporation Common Stock,N,RESI,N,100.0,N,RESI
3935,RETL,Direxion Daily Retail Bull 3X Shares ETF,Direxion Daily Retail Bull 3X Shares ETF,P,RETL,Y,100.0,N,RETL
3936,REV,"Revlon, Inc. New Common Stock","Revlon, Inc. New Common Stock",N,REV,N,100.0,N,REV
3937,REW,ProShares UltraShort Technology,ProShares UltraShort Technology,P,REW,Y,100.0,N,REW
3938,REX,REX American Resources Corporation,REX American Resources Corporation,N,REX,N,100.0,N,REX
3939,REXR,"Rexford Industrial Realty, Inc. Common Stock","Rexford Industrial Realty, Inc. Common Stock",N,REXR,N,100.0,N,REXR
3940,REZ,iShares Residential Real Estate Capped ETF,iShares Residential Real Estate Capped ETF,P,REZ,Y,100.0,N,REZ
3941,RF,Regions Financial Corporation Common Stock,Regions Financial Corporation Common Stock,N,RF,N,100.0,N,RF
3942,RF$A,Regions Financial Corporation Depositary Shares Representing 1/40th Perpetual Preferred Series A,Regions Financial Corporation Depositary Shares Representing 1/40th Perpetual Preferred Series A,N,RFpA,N,100.0,N,RF-A
3943,RF$B,Regions Financial Corporation Depositary Shares Representing 1/40th Perpetual Preferred Series B,Regions Financial Corporation Depositary Shares Representing 1/40th Perpetual Preferred Series B,N,RFpB,N,100.0,N,RF-B
3944,RFG,Guggenheim S&P Midcap 400 Pure Growth ETF,Guggenheim S&P Midcap 400 Pure Growth ETF,P,RFG,Y,100.0,N,RFG
3945,RFI,"Cohen & Steers Total Return Realty Fund, Inc. Common Stock","Cohen & Steers Total Return Realty Fund, Inc. Common Stock",N,RFI,N,100.0,N,RFI
3946,RFP,Resolute Forest Products Inc. Common Stock,Resolute Forest Products Inc. Common Stock,N,RFP,N,100.0,N,RFP
3947,RFT,RAIT Financial Trust 7.625% Senior Notes due 2024,RAIT Financial Trust 7.625% Senior Notes due 2024,N,RFT,N,100.0,N,RFT
