,ACT Symbol,Company Name,Security Name,Exchange,CQS Symbol,ETF,Round Lot Size,Test Issue,NASDAQ Symbol
0,A,"Agilent Technologies, Inc. Common Stock","Agilent Technologies, Inc. Common Stock",N,A,N,100.0,N,A
1,AA,Alcoa Inc. Common Stock,Alcoa Inc. Common Stock,N,AA,N,100.0,N,AA
2,AA$,Alcoa Inc. $3.75 Preferred Stock,Alcoa Inc. $3.75 Preferred Stock,A,AAp,N,100.0,N,AA-
3,AA$B,Alcoa Inc. Depository Shares Representing 1/10th Preferred Convertilble Class B Series 1,Alcoa Inc. Depository Shares Representing 1/10th Preferred Convertilble Class B Series 1,N,AApB,N,100.0,N,AA-B
4,AAC,"AAC Holdings, Inc. Common Stock","AAC Holdings, Inc. Common Stock",N,AAC,N,100.0,N,AAC
5,AADR,WCM BNY Mellon Focused Growth ADR ETF,WCM BNY Mellon Focused Growth ADR ETF,P,AADR,Y,100.0,N,AADR
6,AAMC,Altisource Asset Management Corp Com,Altisource Asset Management Corp Com,A,AAMC,N,100.0,N,AAMC
7,AAN,"Aaron's, Inc. Common Stock","Aaron's, Inc. Common Stock",N,AAN,N,100.0,N,AAN
8,AAP,Advance Auto Parts Inc Advance Auto Parts Inc W/I,Advance Auto Parts Inc Advance Auto Parts Inc W/I,N,AAP,N,100.0,N,AAP
9,AAT,"American Assets Trust, Inc. Common Stock","American Assets Trust, Inc. Common Stock",N,AAT,N,100.0,N,AAT
10,AAU,"Almaden Minerals, Ltd. Ordinary Shares (Canada)","Almaden Minerals, Ltd. Ordinary Shares (Canada)",A,AAU,N,100.0,N,AAU
11,AAV,Advantage Oil & Gas Ltd  Ordinary Shares,Advantage Oil & Gas Ltd  Ordinary Shares,N,AAV,N,100.0,N,AAV
12,AB,Allianceberstein Holding L.P.  Units,Allianceberstein Holding L.P.  Units,N,AB,N,100.0,N,AB
13,ABB,ABB Ltd Common Stock,ABB Ltd Common Stock,N,ABB,N,100.0,N,ABB
14,ABBV,AbbVie Inc. Common Stock,AbbVie Inc. Common Stock,N,ABBV,N,100.0,N,ABBV
15,ABC,AmerisourceBergen Corporation (Holding Co) Common Stock,AmerisourceBergen Corporation (Holding Co) Common Stock,N,ABC,N,100.0,N,ABC
16,ABEV,Ambev S.A. American Depositary Shares (Each representing 1 Common Share),Ambev S.A. American Depositary Shares (Each representing 1 Common Share),N,ABEV,N,100.0,N,ABEV
17,ABG,Asbury Automotive Group Inc Common Stock,Asbury Automotive Group Inc Common Stock,N,ABG,N,100.0,N,ABG
18,ABM,ABM Industries Incorporated Common Stock,ABM Industries Incorporated Common Stock,N,ABM,N,100.0,N,ABM
19,ABR,Arbor Realty Trust Common Stock,Arbor Realty Trust Common Stock,N,ABR,N,100.0,N,ABR
20,ABR$A,Arbor Realty Trust Preferred Series A,Arbor Realty Trust Preferred Series A,N,ABRpA,N,100.0,N,ABR-A
21,ABR$B,Arbor Realty Trust Cumulative Redeemable Preferred Series B,Arbor Realty Trust Cumulative Redeemable Preferred Series B,N,ABRpB,N,100.0,N,ABR-B
22,ABR$C,Arbor Realty Trust Cumulative Redeemable Preferred Series C,Arbor Realty Trust Cumulative Redeemable Preferred Series C,N,ABRpC,N,100.0,N,ABR-C
23,ABRN,Arbor Realty Trust 7.375% Senior Notes due 2021,Arbor Realty Trust 7.375% Senior Notes due 2021,N,ABRN,N,100.0,N,ABRN
24,ABT,Abbott Laboratories Common Stock,Abbott Laboratories Common Stock,N,ABT,N,100.0,N,ABT
25,ABX,Barrick Gold Corporation Common Stock,Barrick Gold Corporation Common Stock,N,ABX,N,100.0,N,ABX
26,ACC,American Campus Communities Inc Common Stock,American Campus Communities Inc Common Stock,N,ACC,N,100.0,N,ACC
27,ACCO,Acco Brands Corporation Common Stock,Acco Brands Corporation Common Stock,N,ACCO,N,100.0,N,ACCO
28,ACCU,Accuvest Global Opportunities ETF,Accuvest Global Opportunities ETF,P,ACCU,Y,100.0,N,ACCU
29,ACE,Ace Limited Common Stock,Ace Limited Common Stock,N,ACE,N,100.0,N,ACE
30,ACG,Alliancebernstein Income Fund,Alliancebernstein Income Fund,N,ACG,N,100.0,N,ACG
31,ACH,Aluminum Corporation of China Limited American Depositary Shares,Aluminum Corporation of China Limited American Depositary Shares,N,ACH,N,100.0,N,ACH
32,ACI,"Arch Coal, Inc. Common Stock","Arch Coal, Inc. Common Stock",N,ACI,N,100.0,N,ACI
33,ACIM,SPDR MSCI ACWI IMI ETF,SPDR MSCI ACWI IMI ETF,P,ACIM,Y,100.0,N,ACIM
34,ACM,AECOM Common Stock,AECOM Common Stock,N,ACM,N,100.0,N,ACM
35,ACMP,"Access Midstream Partners, L.P. Common Units Representing Limited Partner Interests","Access Midstream Partners, L.P. Common Units Representing Limited Partner Interests",N,ACMP,N,100.0,N,ACMP
36,ACN,Accenture plc. Class A Ordinary Shares (Ireland),Accenture plc. Class A Ordinary Shares (Ireland),N,ACN,N,100.0,N,ACN
37,ACP,Avenue Income Credit Strategies Fund Common Shares,Avenue Income Credit Strategies Fund Common Shares,N,ACP,N,100.0,N,ACP
38,ACRE,Ares Commercial Real Estate Corporation Common Stock,Ares Commercial Real Estate Corporation Common Stock,N,ACRE,N,100.0,N,ACRE
39,ACT,Actavis plc Ordinary Shares,Actavis plc Ordinary Shares,N,ACT,N,100.0,N,ACT
40,ACU,Acme United Corporation. Common Stock,Acme United Corporation. Common Stock,A,ACU,N,100.0,N,ACU
41,ACW,Accuride Corporation Common Stock,Accuride Corporation Common Stock,N,ACW,N,100.0,N,ACW
42,ACWV,iShares MSCI All Country World Minimum Volatility Index Fund,iShares MSCI All Country World Minimum Volatility Index Fund,P,ACWV,Y,100.0,N,ACWV
43,ACY,AeroCentury Corp. Common Stock,AeroCentury Corp. Common Stock,A,ACY,N,100.0,N,ACY
44,ADC,Agree Realty Corporation Common Stock,Agree Realty Corporation Common Stock,N,ADC,N,100.0,N,ADC
45,ADGE,American DG Energy Inc. Common Stock,American DG Energy Inc. Common Stock,A,ADGE,N,100.0,N,ADGE
46,ADK,Adcare Health Systems Inc Common Stock (GA),Adcare Health Systems Inc Common Stock (GA),A,ADK,N,100.0,N,ADK
47,ADK$A,"Adcare Health Systems Inc 10.875% Series A Cumulative Redeemable Preferred Stock, no par value per share (GA)","Adcare Health Systems Inc 10.875% Series A Cumulative Redeemable Preferred Stock, no par value per share (GA)",A,ADKpA,N,100.0,N,ADK-A
48,ADM,Archer,Archer-Daniels-Midland Company Common Stock,N,ADM,N,100.0,N,ADM
49,ADPT,Adeptus Health Inc. Common Stock,Adeptus Health Inc. Common Stock,N,ADPT,N,100.0,N,ADPT
50,ADS,Alliance Data Systems Corporation Common Stock,Alliance Data Systems Corporation Common Stock,N,ADS,N,100.0,N,ADS
51,ADT,ADT Corporation Common Stock,ADT Corporation Common Stock,N,ADT,N,100.0,N,ADT
52,ADX,Adams Express Company (The),Adams Express Company (The),N,ADX,N,100.0,N,ADX
53,ADZ,DB Agriculture Short ETN DB Agriculture Short ETN,DB Agriculture Short ETN DB Agriculture Short ETN,P,ADZ,N,100.0,N,ADZ
54,AE,"Adams Resources & Energy, Inc. Common Stock","Adams Resources & Energy, Inc. Common Stock",A,AE,N,100.0,N,AE
55,AEB,AEGON N.V. Perp. Cap. Secs. Floating Rate (Netherlands),AEGON N.V. Perp. Cap. Secs. Floating Rate (Netherlands),N,AEB,N,100.0,N,AEB
56,AEC,Associated Estates Realty Corporation Common Stock,Associated Estates Realty Corporation Common Stock,N,AEC,N,100.0,N,AEC
57,AED,AEGON N.V. Perp. Cap. Securities (Netherlands),AEGON N.V. Perp. Cap. Securities (Netherlands),N,AED,N,100.0,N,AED
58,AEE,Ameren Corporation Common Stock,Ameren Corporation Common Stock,N,AEE,N,100.0,N,AEE
59,AEG,AEGON N.V. Common Stock,AEGON N.V. Common Stock,N,AEG,N,100.0,N,AEG
60,AEH,AEGON N.V. Perp. Cap Secs.,AEGON N.V. Perp. Cap Secs.,N,AEH,N,100.0,N,AEH
61,AEK,Aegon NV 8.00% Non,Aegon NV 8.00% Non-Cumulative Subordinated Notes due 2042,N,AEK,N,100.0,N,AEK
62,AEL,American Equity Investment Life Holding Company Common Stock,American Equity Investment Life Holding Company Common Stock,N,AEL,N,100.0,N,AEL
63,AEM,Agnico Eagle Mines Limited Common Stock,Agnico Eagle Mines Limited Common Stock,N,AEM,N,100.0,N,AEM
64,AEO,"American Eagle Outfitters, Inc. Common Stock","American Eagle Outfitters, Inc. Common Stock",N,AEO,N,100.0,N,AEO
65,AEP,"American Electric Power Company, Inc. Common Stock","American Electric Power Company, Inc. Common Stock",N,AEP,N,100.0,N,AEP
66,AER,Aercap Holdings N.V. Ordinary Shares,Aercap Holdings N.V. Ordinary Shares,N,AER,N,100.0,N,AER
67,AES,The AES Corporation Common Stock,The AES Corporation Common Stock,N,AES,N,100.0,N,AES
68,AES$C,AES Corporation (The) Class C Preferred Stock,AES Corporation (The) Class C Preferred Stock,N,AESpC,N,100.0,N,AES-C
69,AET,Aetna Inc. Common Stock,Aetna Inc. Common Stock,N,AET,N,100.0,N,AET
70,AF,Astoria Financial Corporation Common Stock,Astoria Financial Corporation Common Stock,N,AF,N,100.0,N,AF
71,AF$C,Astoria Financial Corporation Depositary Shs Repstg 1/40th Int Perp Pfd Ser C 6.5%,Astoria Financial Corporation Depositary Shs Repstg 1/40th Int Perp Pfd Ser C 6.5%,N,AFpC,N,100.0,N,AF-C
72,AFA,"American Financial Group, Inc. 5.75% Senior Notes due 2042","American Financial Group, Inc. 5.75% Senior Notes due 2042",N,AFA,N,100.0,N,AFA
73,AFB,AllianceBernstein National Municipal Income Fund Inc,AllianceBernstein National Municipal Income Fund Inc,N,AFB,N,100.0,N,AFB
74,AFC,"Allied Capital Corporation Allied Capital Corporation 6.875% Notes due April 15, 2047","Allied Capital Corporation Allied Capital Corporation 6.875% Notes due April 15, 2047",N,AFC,N,100.0,N,AFC
75,AFG,"American Financial Group, Inc. Common Stock","American Financial Group, Inc. Common Stock",N,AFG,N,100.0,N,AFG
76,AFGE,"American Financial Group, Inc. 6.25% Subordinated Debentures due 2054","American Financial Group, Inc. 6.25% Subordinated Debentures due 2054",N,AFGE,N,100.0,N,AFGE
77,AFK,Market Vectors,Market Vectors-Africa Index ETF,P,AFK,Y,100.0,N,AFK
78,AFL,AFLAC Incorporated Common Stock,AFLAC Incorporated Common Stock,N,AFL,N,100.0,N,AFL
79,AFM,"Affiliated Managers Group, Inc. 5.250% Senior Notes due 2022","Affiliated Managers Group, Inc. 5.250% Senior Notes due 2022",N,AFM,N,100.0,N,AFM
80,AFQ,"American Financial Group, Inc. 7% Senior Notes due 2050","American Financial Group, Inc. 7% Senior Notes due 2050",N,AFQ,N,100.0,N,AFQ
81,AFSD,"Aflac Incorporated 5.50% Subordinated Debentures due September 15, 2052","Aflac Incorporated 5.50% Subordinated Debentures due September 15, 2052",N,AFSD,N,100.0,N,AFSD
82,AFSI$A,"AmTrust Financial Services, Inc. Preferred Series A","AmTrust Financial Services, Inc. Preferred Series A",N,AFSIpA,N,100.0,N,AFSI-A
83,AFSI$B,"AmTrust Financial Services, Inc. Depository Shares Representing 1/40th Preferred Series B","AmTrust Financial Services, Inc. Depository Shares Representing 1/40th Preferred Series B",N,AFSIpB,N,100.0,N,AFSI-B
84,AFSI$C,"AmTrust Financial Services, Inc. Depository Shares Representing 1/40th Preferred Series C","AmTrust Financial Services, Inc. Depository Shares Representing 1/40th Preferred Series C",N,AFSIpC,N,100.0,N,AFSI-C
85,AFT,Apollo Senior Floating Rate Fund Inc. Common Stock,Apollo Senior Floating Rate Fund Inc. Common Stock,N,AFT,N,100.0,N,AFT
86,AFW,"American Financial Group, Inc. 6 3/8% Senior Notes due 2042","American Financial Group, Inc. 6 3/8% Senior Notes due 2042",N,AFW,N,100.0,N,AFW
87,AG,First Majestic Silver Corp. Ordinary Shares (Canada),First Majestic Silver Corp. Ordinary Shares (Canada),N,AG,N,100.0,N,AG
88,AGA,DB Agriculture Short ETN DB Agriculture Double Short ETN,DB Agriculture Short ETN DB Agriculture Double Short ETN,P,AGA,N,100.0,N,AGA
89,AGC,Advent Claymore Convertible Securities and Income Fund Common Shares of Beneficial Interest,Advent Claymore Convertible Securities and Income Fund Common Shares of Beneficial Interest,N,AGC,N,100.0,N,AGC
90,AGCO,AGCO Corporation Common Stock,AGCO Corporation Common Stock,N,AGCO,N,100.0,N,AGCO
91,AGD,Alpine Global Dynamic Dividend Fund Shares of Beneficial Interest,Alpine Global Dynamic Dividend Fund Shares of Beneficial Interest,N,AGD,N,100.0,N,AGD
92,AGF,DB Agriculture Long ETN DB Agriculture Long ETN,DB Agriculture Long ETN DB Agriculture Long ETN,P,AGF,N,100.0,N,AGF
93,AGG,iShares Core U.S. Aggregate Bond ETF,iShares Core U.S. Aggregate Bond ETF,P,AGG,Y,100.0,N,AGG
94,AGI,Alamos Gold Inc Ordinary Shares,Alamos Gold Inc Ordinary Shares,N,AGI,N,100.0,N,AGI
95,AGLS,Accuvest Global Long Short ETF,Accuvest Global Long Short ETF,P,AGLS,Y,100.0,N,AGLS
96,AGM,Federal Agricultural Mortgage Corporation Common Stock,Federal Agricultural Mortgage Corporation Common Stock,N,AGM,N,100.0,N,AGM
97,AGM$A,Federal Agricultural Mortgage Corporation 5.875% Non,"Federal Agricultural Mortgage Corporation 5.875% Non-CUmulative Preferred Stock, Series A",N,AGMpA,N,100.0,N,AGM-A
98,AGM$B,Federal Agricultural Mortgage Corporation Non Cumulative Preferred Stock Series B,Federal Agricultural Mortgage Corporation Non Cumulative Preferred Stock Series B,N,AGMpB,N,100.0,N,AGM-B
99,AGM$C,Federal Agricultural Mortgage Corporation Preferred Series C Fixed to Fltg,Federal Agricultural Mortgage Corporation Preferred Series C Fixed to Fltg,N,AGMpC,N,100.0,N,AGM-C
100,AGM.A,Federal Agricultural Mortgage Corporation Common Stock,Federal Agricultural Mortgage Corporation Common Stock,N,AGM/A,N,100.0,N,AGM.A
101,AGN,"Allergan, Inc. Common Stock","Allergan, Inc. Common Stock",N,AGN,N,100.0,N,AGN
102,AGO,Assured Guaranty Ltd. Common Stock,Assured Guaranty Ltd. Common Stock,N,AGO,N,100.0,N,AGO
103,AGO$B,Assured Guaranty Ltd.,Assured Guaranty Ltd.,N,AGOpB,N,100.0,N,AGO-B
104,AGO$E,Assured Guaranty Ltd.,Assured Guaranty Ltd.,N,AGOpE,N,100.0,N,AGO-E
105,AGO$F,Assured Guaranty Ltd.,Assured Guaranty Ltd.,N,AGOpF,N,100.0,N,AGO-F
106,AGOL,ETFS Asian Gold Trust,ETFS Asian Gold Trust,P,AGOL,Y,100.0,N,AGOL
107,AGQ,ProShares Ultra Silver,ProShares Ultra Silver,P,AGQ,Y,100.0,N,AGQ
108,AGRO,Adecoagro S.A. Common Shares,Adecoagro S.A. Common Shares,N,AGRO,N,100.0,N,AGRO
109,AGU,Agrium Inc. Common Stock,Agrium Inc. Common Stock,N,AGU,N,100.0,N,AGU
110,AGX,"Argan, Inc. Common Stock","Argan, Inc. Common Stock",N,AGX,N,100.0,N,AGX
111,AGZ,iShares  Agency Bond ETF,iShares  Agency Bond ETF,P,AGZ,Y,100.0,N,AGZ
112,AHC,A.H. Belo Corporation Common Stock,A.H. Belo Corporation Common Stock,N,AHC,N,100.0,N,AHC
113,AHH,"Armada Hoffler Properties, Inc. Common Stock","Armada Hoffler Properties, Inc. Common Stock",N,AHH,N,100.0,N,AHH
114,AHL,Aspen Insurance Holdings Limited Ordinary Shares,Aspen Insurance Holdings Limited Ordinary Shares,N,AHL,N,100.0,N,AHL
115,AHL$A,Aspen Insurance Holdings Limited Perp Pfd Shares (Bermuda),Aspen Insurance Holdings Limited Perp Pfd Shares (Bermuda),N,AHLpA,N,100.0,N,AHL-A
116,AHL$B,Aspen Insurance Holdings Limited Perp Pref Shs (Bermuda),Aspen Insurance Holdings Limited Perp Pref Shs (Bermuda),N,AHLpB,N,100.0,N,AHL-B
117,AHL$C,Aspen Insurance Holdings Limited 5.95% Fixed,Aspen Insurance Holdings Limited 5.95% Fixed-to-Floating Rate Perpetual Non-Cumulative Preference Shares,N,AHLpC,N,100.0,N,AHL-C
118,AHP,"Ashford Hospitality Prime, Inc. Common Stock","Ashford Hospitality Prime, Inc. Common Stock",N,AHP,N,100.0,N,AHP
119,AHS,AMN Healthcare Services Inc AMN Healthcare Services Inc,AMN Healthcare Services Inc AMN Healthcare Services Inc,N,AHS,N,100.0,N,AHS
120,AHT,Ashford Hospitality Trust Inc Common Stock,Ashford Hospitality Trust Inc Common Stock,N,AHT,N,100.0,N,AHT
121,AHT$A,Ashford Hospitality Trust Inc 8.55% Cum Preferred Series A,Ashford Hospitality Trust Inc 8.55% Cum Preferred Series A,N,AHTpA,N,100.0,N,AHT-A
122,AHT$D,Ashford Hospitality Trust Inc 8.45% Series D Cumulative Preferred Stock,Ashford Hospitality Trust Inc 8.45% Series D Cumulative Preferred Stock,N,AHTpD,N,100.0,N,AHT-D
123,AHT$E,Ashford Hospitality Trust Inc 9.00% Series E Cumulative Preferred Stock,Ashford Hospitality Trust Inc 9.00% Series E Cumulative Preferred Stock,N,AHTpE,N,100.0,N,AHT-E
124,AI,Arlington Asset Investment Corp Class A (new),Arlington Asset Investment Corp Class A (new),N,AI,N,100.0,N,AI
125,AIA,iShares Asia 50 ETF,iShares Asia 50 ETF,P,AIA,Y,100.0,N,AIA
126,AIB,Apollo Investment Corporation 6.625% Senior Notes due 2042,Apollo Investment Corporation 6.625% Senior Notes due 2042,N,AIB,N,100.0,N,AIB
127,AIF,Apollo Tactical Income Fund Inc. Common Stock,Apollo Tactical Income Fund Inc. Common Stock,N,AIF,N,100.0,N,AIF
128,AIG,"American International Group, Inc. New Common Stock","American International Group, Inc. New Common Stock",N,AIG,N,100.0,N,AIG
129,AIG.W,"American International Group, Inc. Warrant expiring January 19, 2021","American International Group, Inc. Warrant expiring January 19, 2021",N,AIG/WS,N,100.0,N,AIG+
130,AIN,Albany International Corporation Common Stock,Albany International Corporation Common Stock,N,AIN,N,100.0,N,AIN
131,AINC,Ashford Inc. Common Stock,Ashford Inc. Common Stock,A,AINC,N,100.0,N,AINC
132,AIR,AAR Corp. Common Stock,AAR Corp. Common Stock,N,AIR,N,100.0,N,AIR
133,AIRI,Air Industries Group Common Stock,Air Industries Group Common Stock,A,AIRI,N,100.0,N,AIRI
134,AIT,"Applied Industrial Technologies, Inc. Common Stock","Applied Industrial Technologies, Inc. Common Stock",N,AIT,N,100.0,N,AIT
135,AIV,Apartment Investment and Management Company Common Stock,Apartment Investment and Management Company Common Stock,N,AIV,N,100.0,N,AIV
136,AIV$A,Apartment Investment and Management Company Preferred Series Class A,Apartment Investment and Management Company Preferred Series Class A,N,AIVpA,N,100.0,N,AIV-A
137,AIV$Z,Apartment Investment and Management Company Class Z Cumulative Preferred Stock,Apartment Investment and Management Company Class Z Cumulative Preferred Stock,N,AIVpZ,N,100.0,N,AIV-Z
138,AIW,Arlington Asset Investment Corp 6.625% Notes due 2023,Arlington Asset Investment Corp 6.625% Notes due 2023,N,AIW,N,100.0,N,AIW
139,AIY,Apollo Investment Corporation 6.875% Senior Notes due 2043,Apollo Investment Corporation 6.875% Senior Notes due 2043,N,AIY,N,100.0,N,AIY
140,AIZ,"Assurant, Inc. Common Stock","Assurant, Inc. Common Stock",N,AIZ,N,100.0,N,AIZ
141,AJG,Arthur J. Gallagher & Co. Common Stock,Arthur J. Gallagher & Co. Common Stock,N,AJG,N,100.0,N,AJG
142,AKG,Asanko Gold Inc.,Asanko Gold Inc.,A,AKG,N,100.0,N,AKG
143,AKO.A,Embotelladora Andina S.A. Common Stock,Embotelladora Andina S.A. Common Stock,N,AKO/A,N,100.0,N,AKO.A
144,AKO.B,Embotelladora Andina S.A. Common Stock,Embotelladora Andina S.A. Common Stock,N,AKO/B,N,100.0,N,AKO.B
145,AKP,Alliance California Municipal Income Fund Inc,Alliance California Municipal Income Fund Inc,N,AKP,N,100.0,N,AKP
146,AKR,Acadia Realty Trust Common Stock,Acadia Realty Trust Common Stock,N,AKR,N,100.0,N,AKR
147,AKS,AK Steel Holding Corporation Common Stock,AK Steel Holding Corporation Common Stock,N,AKS,N,100.0,N,AKS
148,AL,Air Lease Corporation Class A Common Stock,Air Lease Corporation Class A Common Stock,N,AL,N,100.0,N,AL
149,ALB,Albemarle Corporation Common Stock,Albemarle Corporation Common Stock,N,ALB,N,100.0,N,ALB
150,ALD,WisdomTree Asia Local Debt Fund ETF,WisdomTree Asia Local Debt Fund ETF,P,ALD,Y,100.0,N,ALD
151,ALDW,"Alon USA Partners, LP Common Units representing Limited Partner Interests","Alon USA Partners, LP Common Units representing Limited Partner Interests",N,ALDW,N,100.0,N,ALDW
152,ALE,"Allete, Inc.","Allete, Inc.",N,ALE,N,100.0,N,ALE
153,ALEX,"Alexander & Baldwin, Inc. Common Stock","Alexander & Baldwin, Inc. Common Stock",N,ALEX,N,100.0,N,ALEX
154,ALFA,AlphaClone Alternative Alpha ETF,AlphaClone Alternative Alpha ETF,P,ALFA,Y,100.0,N,ALFA
155,ALG,"Alamo Group, Inc. Common Stock","Alamo Group, Inc. Common Stock",N,ALG,N,100.0,N,ALG
156,ALJ,"Alon USA Energy, Inc. common stick","Alon USA Energy, Inc. common stick",N,ALJ,N,100.0,N,ALJ
157,ALK,"Alaska Air Group, Inc. Common Stock","Alaska Air Group, Inc. Common Stock",N,ALK,N,100.0,N,ALK
158,ALL,Allstate Corporation (The) Common Stock,Allstate Corporation (The) Common Stock,N,ALL,N,100.0,N,ALL
159,ALL$A,Allstate Corporation (The) Dep Shs Repstg 1/1000th Perp Pfd Ser A,Allstate Corporation (The) Dep Shs Repstg 1/1000th Perp Pfd Ser A,N,ALLpA,N,100.0,N,ALL-A
160,ALL$B,Allstate Corporation (The) 5.100% Fixed,Allstate Corporation (The) 5.100% Fixed-to-Floating Rate Subordinated Debentures due 2053,N,ALLpB,N,100.0,N,ALL-B
161,ALL$C,Allstate Corporation (The) Dep Shs Repstg 1/1000th Int Shs Pfd Stk Ser C,Allstate Corporation (The) Dep Shs Repstg 1/1000th Int Shs Pfd Stk Ser C,N,ALLpC,N,100.0,N,ALL-C
162,ALL$D,The Allstate Corporation Leopards Each Representing A 1/1000th Interest In A Share Of Fixed Rate Noncumulative Perpetual Preferred Stock Series D,The Allstate Corporation Leopards Each Representing A 1/1000th Interest In A Share Of Fixed Rate Noncumulative Perpetual Preferred Stock Series D,N,ALLpD,N,100.0,N,ALL-D
163,ALL$E,Allstate Corporation Depositary Shares Representing 1/1000th Perpetual Preferred Series E,Allstate Corporation Depositary Shares Representing 1/1000th Perpetual Preferred Series E,N,ALLpE,N,100.0,N,ALL-E
164,ALL$F,Allstate Corporation (The) Leopards Dep Shares Representing 1/1000th Perp Pfd,Allstate Corporation (The) Leopards Dep Shares Representing 1/1000th Perp Pfd,N,ALLpF,N,100.0,N,ALL-F
165,ALLE,Allegion plc Ordinary Shares,Allegion plc Ordinary Shares,N,ALLE,N,100.0,N,ALLE
166,ALLY,Ally Financial Inc. Common Stock,Ally Financial Inc. Common Stock,N,ALLY,N,100.0,N,ALLY
167,ALLY$A,"GMAC Capital Trust I Fixed Rate Floating Rate Trust Preferred Securities, Series 2","GMAC Capital Trust I Fixed Rate Floating Rate Trust Preferred Securities, Series 2",N,ALLYpA,N,100.0,N,ALLY-A
168,ALLY$B,"Ally Financial Inc Fixed Rate Floating Rate Perpetual Preferred Stock, Series A","Ally Financial Inc Fixed Rate Floating Rate Perpetual Preferred Stock, Series A",N,ALLYpB,N,100.0,N,ALLY-B
169,ALN,American Lorain Corporation Common Stock,American Lorain Corporation Common Stock,A,ALN,N,100.0,N,ALN
170,ALP$N,Alabama Power Company Preferred Stock,Alabama Power Company Preferred Stock,N,ALPpN,N,100.0,N,ALP-N
171,ALP$O,Alabama Power Company Preferred Stock,Alabama Power Company Preferred Stock,N,ALPpO,N,100.0,N,ALP-O
172,ALP$P,Alabama Power Company 5.30% Cl A Pfd Stk,Alabama Power Company 5.30% Cl A Pfd Stk,N,ALPpP,N,100.0,N,ALP-P
173,ALR,Alere Inc. Common Stock,Alere Inc. Common Stock,N,ALR,N,100.0,N,ALR
174,ALR$B,"Alere Inc. Inverness Medical Innovations, Inc. Series B Convertible Perpetual Preferred Stock","Alere Inc. Inverness Medical Innovations, Inc. Series B Convertible Perpetual Preferred Stock",N,ALRpB,N,10.0,N,ALR-B
175,ALSN,"Allison Transmission Holdings, Inc. Common Stock","Allison Transmission Holdings, Inc. Common Stock",N,ALSN,N,100.0,N,ALSN
176,ALTL,RBS US Large Cap Alternator Exchange Traded Note,RBS US Large Cap Alternator Exchange Traded Note,P,ALTL,N,100.0,N,ALTL
177,ALTS,ProShares Morningstar Alternatives Solution ETF,ProShares Morningstar Alternatives Solution ETF,P,ALTS,Y,100.0,N,ALTS
178,ALTV,Alteva,Alteva,A,ALTV,N,100.0,N,ALTV
179,ALU,Alcatel,Alcatel-Lucent Common Stock,N,ALU,N,100.0,N,ALU
180,ALV,"Autoliv, Inc. Common Stock","Autoliv, Inc. Common Stock",N,ALV,N,100.0,N,ALV
181,ALX,"Alexander's, Inc. Common Stock","Alexander's, Inc. Common Stock",N,ALX,N,100.0,N,ALX
182,AM,Antero Midstream Partners LP Common Units representing limited partner interests,Antero Midstream Partners LP Common Units representing limited partner interests,N,AM,N,100.0,N,AM
183,AMBR,"Amber Road, Inc. Common Stock","Amber Road, Inc. Common Stock",N,AMBR,N,100.0,N,AMBR
184,AMC,"AMC Entertainment Holdings, Inc. Class A Common Stock","AMC Entertainment Holdings, Inc. Class A Common Stock",N,AMC,N,100.0,N,AMC
185,AMCO,"Armco Metals Holdings, Inc. Common Stock","Armco Metals Holdings, Inc. Common Stock",A,AMCO,N,100.0,N,AMCO
186,AME,"AMETEK, Inc.","AMETEK, Inc.",N,AME,N,100.0,N,AME
187,AMFW,AMEC Foster Wheeler plc American Depositary Shares,AMEC Foster Wheeler plc American Depositary Shares,N,AMFW,N,100.0,N,AMFW
188,AMG,"Affiliated Managers Group, Inc. Common Stock","Affiliated Managers Group, Inc. Common Stock",N,AMG,N,100.0,N,AMG
189,AMH,American Homes 4 Rent Common Shares of Beneficial Interest,American Homes 4 Rent Common Shares of Beneficial Interest,N,AMH,N,100.0,N,AMH
190,AMH$A,American Homes 4 Rent Participating Preferred Shares Series A,American Homes 4 Rent Participating Preferred Shares Series A,N,AMHpA,N,100.0,N,AMH-A
191,AMH$B,American Homes 4 Rent 5% Series B Participating Preferred Shares of Beneficial Interest,American Homes 4 Rent 5% Series B Participating Preferred Shares of Beneficial Interest,N,AMHpB,N,100.0,N,AMH-B
192,AMH$C,American Homes 4 Rent Participating Pfd Ser C,American Homes 4 Rent Participating Pfd Ser C,N,AMHpC,N,100.0,N,AMH-C
193,AMID,"American Midstream Partners, LP Common Units representing Limited Partner Interests","American Midstream Partners, LP Common Units representing Limited Partner Interests",N,AMID,N,100.0,N,AMID
194,AMJ,JPMorgan Chase Capital XVI JP Morgan Alerian MLP ETN,JPMorgan Chase Capital XVI JP Morgan Alerian MLP ETN,P,AMJ,N,100.0,N,AMJ
195,AMLP,Alerian MLP ETF,Alerian MLP ETF,P,AMLP,Y,100.0,N,AMLP
196,AMP,"Ameriprise Financial, Inc. Common Stock","Ameriprise Financial, Inc. Common Stock",N,AMP,N,100.0,N,AMP
197,AMPE,"Ampio Pharmaceuticals, Inc.","Ampio Pharmaceuticals, Inc.",A,AMPE,N,100.0,N,AMPE
198,AMPS,iShares Utilities Bond ETF,iShares Utilities Bond ETF,P,AMPS,Y,100.0,N,AMPS
199,AMRC,"Ameresco, Inc. Class A Common Stock","Ameresco, Inc. Class A Common Stock",N,AMRC,N,100.0,N,AMRC
200,AMRE,"AmREIT, Inc. Common stock","AmREIT, Inc. Common stock",N,AMRE,N,100.0,N,AMRE
201,AMS,American Shared Hospital Services Common Stock,American Shared Hospital Services Common Stock,A,AMS,N,100.0,N,AMS
202,AMT,American Tower Corporation (REIT) Common Stock,American Tower Corporation (REIT) Common Stock,N,AMT,N,100.0,N,AMT
203,AMT$A,American Tower Corporation (REIT) Pfd Conv Ser A,American Tower Corporation (REIT) Pfd Conv Ser A,N,AMTpA,N,100.0,N,AMT-A
204,AMTD,TD Ameritrade Holding Corporation Common Stock,TD Ameritrade Holding Corporation Common Stock,N,AMTD,N,100.0,N,AMTD
205,AMTG,"Apollo Residential Mortgage, Inc. Common Stock","Apollo Residential Mortgage, Inc. Common Stock",N,AMTG,N,100.0,N,AMTG
206,AMTG$A,"Apollo Residential Mortgage, Inc. Pfd Shs Series A  (US)","Apollo Residential Mortgage, Inc. Pfd Shs Series A  (US)",N,AMTGpA,N,100.0,N,AMTG-A
207,AMU,ETRACS Alerian MLP Index ETN,ETRACS Alerian MLP Index ETN,P,AMU,N,100.0,N,AMU
208,AMX,"America Movil, S.A.B. de C.V. American Depository Receipt Series L","America Movil, S.A.B. de C.V. American Depository Receipt Series L",N,AMX,N,100.0,N,AMX
209,AMZA,InfraCap MLP ETF,InfraCap MLP ETF,P,AMZA,Y,100.0,N,AMZA
