,ACT Symbol,Company Name,Security Name,Exchange,CQS Symbol,ETF,Round Lot Size,Test Issue,NASDAQ Symbol
2533,IWL,iShares Russell Top 200 ETF,iShares Russell Top 200 ETF,P,IWL,Y,100.0,N,IWL
2534,IWM,iShares Russell 2000 ETF,iShares Russell 2000 ETF,P,IWM,Y,100.0,N,IWM
2535,IWN,iShares Russell 2000 Value ETF,iShares Russell 2000 Value ETF,P,IWN,Y,100.0,N,IWN
2536,IWO,iShares Russell 2000 Growth ETF,iShares Russell 2000 Growth ETF,P,IWO,Y,100.0,N,IWO
2537,IWP,iShares Russell Midcap Growth ETF,iShares Russell Midcap Growth ETF,P,IWP,Y,100.0,N,IWP
2538,IWR,iShares Russell Mid,iShares Russell Mid-Cap ETF,P,IWR,Y,100.0,N,IWR
2539,IWS,iShares Russell Mid,iShares Russell Mid-cap Value ETF,P,IWS,Y,100.0,N,IWS
2540,IWV,iShares Russell 3000 ETF,iShares Russell 3000 ETF,P,IWV,Y,100.0,N,IWV
2541,IWX,iShares Russell Top 200 Value ETF,iShares Russell Top 200 Value ETF,P,IWX,Y,100.0,N,IWX
2542,IWY,iShares Russell Top 200 Growth ETF,iShares Russell Top 200 Growth ETF,P,IWY,Y,100.0,N,IWY
2543,IX,Orix Corp Ads Common Stock,Orix Corp Ads Common Stock,N,IX,N,100.0,N,IX
2544,IXC,iShares Global Energy ETF,iShares Global Energy ETF,P,IXC,Y,100.0,N,IXC
2545,IXG,iShares Global Financial ETF,iShares Global Financial ETF,P,IXG,Y,100.0,N,IXG
2546,IXJ,iShares Global Healthcare ETF,iShares Global Healthcare ETF,P,IXJ,Y,100.0,N,IXJ
2547,IXN,iShares Global Tech ETF,iShares Global Tech ETF,P,IXN,Y,100.0,N,IXN
2548,IXP,iShares Global Telecom ETF,iShares Global Telecom ETF,P,IXP,Y,100.0,N,IXP
2549,IXUS,iShares Core MSCI Total International Stock ETF,iShares Core MSCI Total International Stock ETF,P,IXUS,Y,100.0,N,IXUS
2550,IYC,iShares U.S. Consumer Services ETF,iShares U.S. Consumer Services ETF,P,IYC,Y,100.0,N,IYC
2551,IYE,iShares U.S. Energy ETF,iShares U.S. Energy ETF,P,IYE,Y,100.0,N,IYE
2552,IYF,iShares U.S. Financial ETF,iShares U.S. Financial ETF,P,IYF,Y,100.0,N,IYF
2553,IYG,iShares U.S. Financial Services ETF,iShares U.S. Financial Services ETF,P,IYG,Y,100.0,N,IYG
2554,IYH,iShares U.S. Healthcare ETF,iShares U.S. Healthcare ETF,P,IYH,Y,100.0,N,IYH
2555,IYJ,iShares U.S. Industrials ETF,iShares U.S. Industrials ETF,P,IYJ,Y,100.0,N,IYJ
2556,IYK,iShares U.S. Consumer Goods ETF,iShares U.S. Consumer Goods ETF,P,IYK,Y,100.0,N,IYK
2557,IYLD,iShares Morningstar Multi,iShares Morningstar Multi-Asset Income ETF,Z,IYLD,Y,100.0,N,IYLD
2558,IYM,iShares U.S. Basic Materials ETF,iShares U.S. Basic Materials ETF,P,IYM,Y,100.0,N,IYM
2559,IYR,iShares U.S. Real Estate ETF,iShares U.S. Real Estate ETF,P,IYR,Y,100.0,N,IYR
2560,IYT,iShares Transportation AverageETF,iShares Transportation AverageETF,P,IYT,Y,100.0,N,IYT
2561,IYW,iShares U.S. Technology ETF,iShares U.S. Technology ETF,P,IYW,Y,100.0,N,IYW
2562,IYY,iShares Dow Jones U.S. ETF,iShares Dow Jones U.S. ETF,P,IYY,Y,100.0,N,IYY
2563,IYZ,iShares U.S. Telecommunications ETF,iShares U.S. Telecommunications ETF,P,IYZ,Y,100.0,N,IYZ
2564,JAH,Jarden Corporation Common Stock,Jarden Corporation Common Stock,N,JAH,N,100.0,N,JAH
2565,JBK,Lehman ABS 3.50 3.50% Adjustable Corp Backed Tr Certs GS Cap I,Lehman ABS 3.50 3.50% Adjustable Corp Backed Tr Certs GS Cap I,N,JBK,N,100.0,N,JBK
2566,JBL,"Jabil Circuit, Inc. Common Stock","Jabil Circuit, Inc. Common Stock",N,JBL,N,100.0,N,JBL
2567,JBN,"Select Asset Inc. Select Asset Inc. on behalf of Corporate Backed Callable Trust Certificates, J.C. Penney Debenture Backed Series 2007","Select Asset Inc. Select Asset Inc. on behalf of Corporate Backed Callable Trust Certificates, J.C. Penney Debenture Backed Series 2007-1 Trust",N,JBN,N,100.0,N,JBN
2568,JBR,"Select Asset Inc. Corporate Backed Callable Trust Certificates, J.C. Penney Debenture","Select Asset Inc. Corporate Backed Callable Trust Certificates, J.C. Penney Debenture-Backed Series 2006-1, Class A-1",N,JBR,N,100.0,N,JBR
2569,JBT,John Bean Technologies Corporation Common Stock,John Bean Technologies Corporation Common Stock,N,JBT,N,100.0,N,JBT
2570,JCE,Nuveen Core Equity Alpha Fund Nuveen Core Equity Alpha Fund Common Shares of Beneficial Interest,Nuveen Core Equity Alpha Fund Nuveen Core Equity Alpha Fund Common Shares of Beneficial Interest,N,JCE,N,100.0,N,JCE
2571,JCI,"Johnson Controls, Inc. Common Stock","Johnson Controls, Inc. Common Stock",N,JCI,N,100.0,N,JCI
2572,JCP,"J.C. Penney Company, Inc. Holding Company Common Stock","J.C. Penney Company, Inc. Holding Company Common Stock",N,JCP,N,100.0,N,JCP
2573,JDD,Nuveen Diversified Dividend and Income Fund Shares of Beneficial Interest,Nuveen Diversified Dividend and Income Fund Shares of Beneficial Interest,N,JDD,N,100.0,N,JDD
2574,JDST,Direxion Daily Junior Gold Miners Index Bear 3X Shares,Direxion Daily Junior Gold Miners Index Bear 3X Shares,P,JDST,Y,100.0,N,JDST
2575,JE,"Just Energy Group, Inc. Ordinary Shares (Canada)","Just Energy Group, Inc. Ordinary Shares (Canada)",N,JE,N,100.0,N,JE
2576,JEC,Jacobs Engineering Group Inc. Common Stock,Jacobs Engineering Group Inc. Common Stock,N,JEC,N,100.0,N,JEC
2577,JEM,iPath GEMS Index ETN,iPath GEMS Index ETN,P,JEM,N,100.0,N,JEM
2578,JEQ,"Aberdeen Japan Equity Fund, Inc.  Common Stock","Aberdeen Japan Equity Fund, Inc.  Common Stock",N,JEQ,N,100.0,N,JEQ
2579,JFC,"JPMorgan China Region  Fund, Inc. Common Stock","JPMorgan China Region  Fund, Inc. Common Stock",N,JFC,N,100.0,N,JFC
2580,JFR,Nuveen Floating Rate Income Fund Common Stock,Nuveen Floating Rate Income Fund Common Stock,N,JFR,N,100.0,N,JFR
2581,JGBD,PowerShares DB 3X Inverse Govt Bond Futures ETN,PowerShares DB 3X Inverse Govt Bond Futures ETN,P,JGBD,N,100.0,N,JGBD
2582,JGBL,PowerShares DB Japanese Govt Bond Futures ETN,PowerShares DB Japanese Govt Bond Futures ETN,P,JGBL,N,100.0,N,JGBL
2583,JGBS,PowerShares DB Inverse Japanese Govt Bond Futures ETN,PowerShares DB Inverse Japanese Govt Bond Futures ETN,P,JGBS,N,100.0,N,JGBS
2584,JGBT,PowerShares DB 3X Japanese Govt Bond Futures ETN,PowerShares DB 3X Japanese Govt Bond Futures ETN,P,JGBT,N,100.0,N,JGBT
2585,JGH,Nuveen Global High Income Fund Common Shares of Beneficial Interest,Nuveen Global High Income Fund Common Shares of Beneficial Interest,N,JGH,N,100.0,N,JGH
2586,JGV,Nuveen Global Equity Income Fund,Nuveen Global Equity Income Fund,N,JGV,N,100.0,N,JGV
2587,JGW,J.G. Wentworth Company (The) Class A Common Stock,J.G. Wentworth Company (The) Class A Common Stock,N,JGW,N,100.0,N,JGW
2588,JHI,John Hancock Investors Trust Common Stock,John Hancock Investors Trust Common Stock,N,JHI,N,100.0,N,JHI
2589,JHP,Nuveen Quality Preferred Income Fund 3 Preferred Income 3,Nuveen Quality Preferred Income Fund 3 Preferred Income 3,N,JHP,N,100.0,N,JHP
2590,JHS,John Hancock Income Securities Trust Common Stock,John Hancock Income Securities Trust Common Stock,N,JHS,N,100.0,N,JHS
2591,JHX,James Hardie Industries plc American Depositary Shares (Ireland),James Hardie Industries plc American Depositary Shares (Ireland),N,JHX,N,100.0,N,JHX
2592,JJA,iPath Bloomberg Agriculture Total Return Sub,iPath Bloomberg Agriculture Total Return Sub-Index ETN,P,JJA,N,100.0,N,JJA
2593,JJC,iPath Bloomberg Copper Subindex Total Return Sub,iPath Bloomberg Copper Subindex Total Return Sub-Index ETN,P,JJC,N,100.0,N,JJC
2594,JJE,iPath Bloomberg Energy Total Return Sub,iPath Bloomberg Energy Total Return Sub-Index ETN,P,JJE,N,100.0,N,JJE
2595,JJG,iPath Bloomberg Grains Total Return Sub,iPath Bloomberg Grains Total Return Sub-Index ETN,P,JJG,N,100.0,N,JJG
2596,JJM,iPath Bloomberg Industrial Metals Total Return Sub,iPath Bloomberg Industrial Metals Total Return Sub-Index ETN,P,JJM,N,100.0,N,JJM
2597,JJN,iPath Bloomberg Nickel Subindex Total Return ETN,iPath Bloomberg Nickel Subindex Total Return ETN,P,JJN,N,100.0,N,JJN
2598,JJP,iPath Bloomberg Precious Metals Subindex Total Return SM Index ETN,iPath Bloomberg Precious Metals Subindex Total Return SM Index ETN,P,JJP,N,100.0,N,JJP
2599,JJS,iPath Bloomberg Softs Subindex Total Return SM Index ETN,iPath Bloomberg Softs Subindex Total Return SM Index ETN,P,JJS,N,100.0,N,JJS
2600,JJT,iPath Bloomberg Tin Subindex Total Return SM ETN,iPath Bloomberg Tin Subindex Total Return SM ETN,P,JJT,N,100.0,N,JJT
2601,JJU,iPath Bloomberg Aluminum Subindex Total Return SM IndexETN,iPath Bloomberg Aluminum Subindex Total Return SM IndexETN,P,JJU,N,100.0,N,JJU
2602,JKD,iShares Morningstar Large,iShares Morningstar Large-Cap ETF,P,JKD,Y,100.0,N,JKD
2603,JKE,iShares Morningstar Large,iShares Morningstar Large-Cap Growth ETF,P,JKE,Y,100.0,N,JKE
2604,JKF,iShares Morningstar Large,iShares Morningstar Large-Cap  Value ETF,P,JKF,Y,100.0,N,JKF
2605,JKG,iShares Morningstar Mid,iShares Morningstar Mid-Cap ETF,P,JKG,Y,100.0,N,JKG
2606,JKH,iShares Morningstar Mid,iShares Morningstar Mid-Cap Growth ETF,P,JKH,Y,100.0,N,JKH
2607,JKI,iShares Morningstar Mid,iShares Morningstar Mid-Cap Value ETF,P,JKI,Y,100.0,N,JKI
2608,JKJ,iShares Morningstar Small,iShares Morningstar Small-Cap ETF,P,JKJ,Y,100.0,N,JKJ
2609,JKK,iShares Morningstar Small,iShares Morningstar Small-Cap Growth ETF,P,JKK,Y,100.0,N,JKK
2610,JKL,iShares Morningstar Small,iShares Morningstar Small-Cap Value ETFnd,P,JKL,Y,100.0,N,JKL
2611,JKS,JinkoSolar Holding Company Limited American Depositary Shares (each representing 4 Common Shares),JinkoSolar Holding Company Limited American Depositary Shares (each representing 4 Common Shares),N,JKS,N,100.0,N,JKS
2612,JLL,Jones Lang LaSalle Incorporated Common Stock,Jones Lang LaSalle Incorporated Common Stock,N,JLL,N,100.0,N,JLL
2613,JLS,Nuveen Mortgage Opportunity Term Fund Nuveen Mortgage Opportunity Term Fund,Nuveen Mortgage Opportunity Term Fund Nuveen Mortgage Opportunity Term Fund,N,JLS,N,100.0,N,JLS
2614,JMEI,"Jumei International Holding Limited American Depositary Shares, each representing one Class A ordinary share","Jumei International Holding Limited American Depositary Shares, each representing one Class A ordinary share",N,JMEI,N,100.0,N,JMEI
2615,JMF,Nuveen Energy MLP Total Return Fund Common Shares of Beneficial Interest,Nuveen Energy MLP Total Return Fund Common Shares of Beneficial Interest,N,JMF,N,100.0,N,JMF
2616,JMI,Javelin Mortgage Investment Corp. Common Stock,Javelin Mortgage Investment Corp. Common Stock,N,JMI,N,100.0,N,JMI
2617,JMLP,Nuveen All Cap Energy MLP Opportunities Fund Common Shares of Beneficial Interest,Nuveen All Cap Energy MLP Opportunities Fund Common Shares of Beneficial Interest,N,JMLP,N,100.0,N,JMLP
2618,JMM,Nuveen Multi,Nuveen Multi-Market Income Fund (MA),N,JMM,N,100.0,N,JMM
2619,JMP,JMP Group LLC Common Shares,JMP Group LLC Common Shares,N,JMP,N,100.0,N,JMP
2620,JMPB,JMP Group Inc 8.00% Senior Notes due 2023,JMP Group Inc 8.00% Senior Notes due 2023,N,JMPB,N,100.0,N,JMPB
2621,JMPC,JMP Group Inc 7.25% Senior Notes due 2021,JMP Group Inc 7.25% Senior Notes due 2021,N,JMPC,N,100.0,N,JMPC
2622,JMT,Nuveen Mortgage Opportunity Term Fund 2 Common Shares of Beneficial Interest,Nuveen Mortgage Opportunity Term Fund 2 Common Shares of Beneficial Interest,N,JMT,N,100.0,N,JMT
2623,JNJ,Johnson & Johnson Common Stock,Johnson & Johnson Common Stock,N,JNJ,N,100.0,N,JNJ
2624,JNK,SPDR Barclays High Yield Bond ETF,SPDR Barclays High Yield Bond ETF,P,JNK,Y,100.0,N,JNK
2625,JNPR,"Juniper Networks, Inc. Common Stock","Juniper Networks, Inc. Common Stock",N,JNPR,N,100.0,N,JNPR
2626,JNS,"Janus Capital Group, Inc. Cmn Stk","Janus Capital Group, Inc. Cmn Stk",N,JNS,N,100.0,N,JNS
2627,JNUG,Direxion Daily Junior Gold Miners Index Bull 3X Shares,Direxion Daily Junior Gold Miners Index Bull 3X Shares,P,JNUG,Y,100.0,N,JNUG
2628,JO,iPath Bloomberg Coffee Subindex Total Return SM Index ETN,iPath Bloomberg Coffee Subindex Total Return SM Index ETN,P,JO,N,100.0,N,JO
2629,JOB,"General Employment Enterprises, Inc. Common Stock","General Employment Enterprises, Inc. Common Stock",A,JOB,N,100.0,N,JOB
2630,JOE,St. Joe Company (The) Common Stock,St. Joe Company (The) Common Stock,N,JOE,N,100.0,N,JOE
2631,JOF,Japan Smaller Capitalization Fund Inc Common Stock,Japan Smaller Capitalization Fund Inc Common Stock,N,JOF,N,100.0,N,JOF
2632,JONE,"Jones Energy, Inc. Class A Common Stock","Jones Energy, Inc. Class A Common Stock",N,JONE,N,100.0,N,JONE
2633,JOY,Joy Global Inc. Common Stock,Joy Global Inc. Common Stock,N,JOY,N,100.0,N,JOY
2634,JPC,Nuveen  Preferred Income Opportunities Fund,Nuveen  Preferred Income Opportunities Fund,N,JPC,N,100.0,N,JPC
2635,JPEM,JPMorgan Diversified Return Emerging Markets Equity ETF,JPMorgan Diversified Return Emerging Markets Equity ETF,P,JPEM,Y,100.0,N,JPEM
2636,JPEP,JP Energy Partners LP Common units representing limited partner interests,JP Energy Partners LP Common units representing limited partner interests,N,JPEP,N,100.0,N,JPEP
2637,JPGE,JPMorgan Diversified Return Global Equity ETF,JPMorgan Diversified Return Global Equity ETF,P,JPGE,Y,100.0,N,JPGE
2638,JPI,Nuveen Preferred and Income Term Fund Common Shares of Beneficial Interest,Nuveen Preferred and Income Term Fund Common Shares of Beneficial Interest,N,JPI,N,100.0,N,JPI
2639,JPIN,JPMorgan Diversified Return International Equity ETF,JPMorgan Diversified Return International Equity ETF,P,JPIN,Y,100.0,N,JPIN
2640,JPM,JP Morgan Chase & Co. Common Stock,JP Morgan Chase & Co. Common Stock,N,JPM,N,100.0,N,JPM
2641,JPM$A,J P Morgan Chase & Co Depositary Shs Repstg 1/400 Pfd Ser P,J P Morgan Chase & Co Depositary Shs Repstg 1/400 Pfd Ser P,N,JPMpA,N,100.0,N,JPM-A
2642,JPM$B,JP Morgan Chase & Co Depositary Shares Representing 1/400th Preferred Series T,JP Morgan Chase & Co Depositary Shares Representing 1/400th Preferred Series T,N,JPMpB,N,100.0,N,JPM-B
2643,JPM$C,"JPMorgan Chase Capital XXIX 6.70% Capital Securities, Series CC","JPMorgan Chase Capital XXIX 6.70% Capital Securities, Series CC",N,JPMpC,N,100.0,N,JPM-C
2644,JPM$D,JPMorgan Chase Bank N A London Branch Depositary Shs Repstg 1/400th Pfd Ser O,JPMorgan Chase Bank N A London Branch Depositary Shs Repstg 1/400th Pfd Ser O,N,JPMpD,N,100.0,N,JPM-D
2645,JPM$E,J P Morgan Chase & Co Depository Shares Representing 1/400th Int Perp Pfd Ser W,J P Morgan Chase & Co Depository Shares Representing 1/400th Int Perp Pfd Ser W,N,JPMpE,N,100.0,N,JPM-E
2646,JPM.W,"J P Morgan Chase & Co Warrant expiring October 28, 2018","J P Morgan Chase & Co Warrant expiring October 28, 2018",N,JPM/WS,N,100.0,N,JPM+
2647,JPMV,iShares MSCI Japan Minimum Volatility ETF,iShares MSCI Japan Minimum Volatility ETF,P,JPMV,Y,100.0,N,JPMV
2648,JPNL,Direxion Daily Japan Bull 3X ETF,Direxion Daily Japan Bull 3X ETF,P,JPNL,Y,100.0,N,JPNL
2649,JPP,SPDR Russell/Nomura PRIME Japan ETF,SPDR Russell/Nomura PRIME Japan ETF,P,JPP,Y,100.0,N,JPP
2650,JPS,Nuveen Quality Preferred Income Fund 2 Shares of Beneficial Interest,Nuveen Quality Preferred Income Fund 2 Shares of Beneficial Interest,N,JPS,N,100.0,N,JPS
2651,JPW,Nuveen Flexible Investment Income Fund Common Shares of Beneficial Interest,Nuveen Flexible Investment Income Fund Common Shares of Beneficial Interest,N,JPW,N,100.0,N,JPW
2652,JPX,ProShares UltraShort MSCI Pacific ex,ProShares UltraShort MSCI Pacific ex-Japan,P,JPX,Y,100.0,N,JPX
2653,JQC,Nuveen Credit Strategies Income Fund Shares of Beneficial Interest,Nuveen Credit Strategies Income Fund Shares of Beneficial Interest,N,JQC,N,100.0,N,JQC
2654,JRI,Nuveen Real Asset Income and Growth Fund Common Shares of Beneficial Interest,Nuveen Real Asset Income and Growth Fund Common Shares of Beneficial Interest,N,JRI,N,100.0,N,JRI
2655,JRN,"Journal Communications, Inc. Class A Common Stock","Journal Communications, Inc. Class A Common Stock",N,JRN,N,100.0,N,JRN
2656,JRO,Nuveen Floating Rate Income Opportuntiy Fund Shares of Beneficial Interest,Nuveen Floating Rate Income Opportuntiy Fund Shares of Beneficial Interest,N,JRO,N,100.0,N,JRO
2657,JRS,Nuveen Real Estate Income Fund Common Shares of Beneficial Interest,Nuveen Real Estate Income Fund Common Shares of Beneficial Interest,A,JRS,N,100.0,N,JRS
2658,JSC,SPDR Russell/Nomura Small Cap Japan,SPDR Russell/Nomura Small Cap Japan,P,JSC,Y,100.0,N,JSC
2659,JSD,Nuveen Short Duration Credit Opportunities Fund Common Shares of Beneficial Interest,Nuveen Short Duration Credit Opportunities Fund Common Shares of Beneficial Interest,N,JSD,N,100.0,N,JSD
2660,JTA,Nuveen Tax,Nuveen Tax-Advantaged Total Return Strategy Fund Common Share of Beneficial Interest,N,JTA,N,100.0,N,JTA
2661,JTD,Nuveen Tax,Nuveen Tax-Advantaged Dividend Growth Fund Common Shares of Beneficial Interest,N,JTD,N,100.0,N,JTD
2662,JTP,Nuveen Quality Preferred Income Fund Shares of Beneficial Interest,Nuveen Quality Preferred Income Fund Shares of Beneficial Interest,N,JTP,N,100.0,N,JTP
2663,JUNR,Global X Junior Miners ETF,Global X Junior Miners ETF,P,JUNR,Y,100.0,N,JUNR
2664,JW.A,"John Wiley & Sons, Inc. Common Stock","John Wiley & Sons, Inc. Common Stock",N,JW/A,N,100.0,N,JW.A
2665,JW.B,"John Wiley & Sons, Inc. Common Stock","John Wiley & Sons, Inc. Common Stock",N,JW/B,N,100.0,N,JW.B
2666,JWN,"Nordstrom, Inc. Common Stock","Nordstrom, Inc. Common Stock",N,JWN,N,100.0,N,JWN
2667,JXI,iShares Global Utilities ETF,iShares Global Utilities ETF,P,JXI,Y,100.0,N,JXI
2668,JYN,BARCLAYS BANK PLC iPath JPY/USD Exchange Rate ETN,BARCLAYS BANK PLC iPath JPY/USD Exchange Rate ETN,P,JYN,N,100.0,N,JYN
2669,K,Kellogg Company Common Stock,Kellogg Company Common Stock,N,K,N,100.0,N,K
2670,KAI,Kadant Inc Common Stock,Kadant Inc Common Stock,N,KAI,N,100.0,N,KAI
2671,KAMN,Kaman Corporation Common Stock,Kaman Corporation Common Stock,N,KAMN,N,100.0,N,KAMN
2672,KAP,"KCAP Financial, Inc. 7.375% Senior Notes due 2019","KCAP Financial, Inc. 7.375% Senior Notes due 2019",N,KAP,N,100.0,N,KAP
2673,KAR,"KAR Auction Services, Inc Common Stock","KAR Auction Services, Inc Common Stock",N,KAR,N,100.0,N,KAR
2674,KATE,Kate Spade & Company Common Stock,Kate Spade & Company Common Stock,N,KATE,N,100.0,N,KATE
2675,KB,KB Financial Group Inc,KB Financial Group Inc,N,KB,N,100.0,N,KB
2676,KBA,KraneShares Bosera MSCI China A ETF,KraneShares Bosera MSCI China A ETF,P,KBA,Y,100.0,N,KBA
2677,KBE,SPDR S&P Bank ETF,SPDR S&P Bank ETF,P,KBE,Y,100.0,N,KBE
2678,KBH,KB Home Common Stock,KB Home Common Stock,N,KBH,N,100.0,N,KBH
2679,KBR,"KBR, Inc. Common Stock","KBR, Inc. Common Stock",N,KBR,N,100.0,N,KBR
2680,KBWB,PowerShares KBW Bank Portfolio ETF,PowerShares KBW Bank Portfolio ETF,P,KBWB,Y,100.0,N,KBWB
2681,KBWC,PowerShares KBW Capital Markets Portfolio,PowerShares KBW Capital Markets Portfolio,P,KBWC,Y,100.0,N,KBWC
2682,KBWD,PowerShares KBW High Dividend Yield Financial Portfolio ETF,PowerShares KBW High Dividend Yield Financial Portfolio ETF,P,KBWD,Y,100.0,N,KBWD
2683,KBWI,PowerShares KBW Insurance Portfoliio ETF,PowerShares KBW Insurance Portfoliio ETF,P,KBWI,Y,100.0,N,KBWI
2684,KBWP,PowerShares KBW Property & Casualty Insurance Portfolio ETF,PowerShares KBW Property & Casualty Insurance Portfolio ETF,P,KBWP,Y,100.0,N,KBWP
2685,KBWR,PowerShares KBW Regional Banking Portfolio ETF,PowerShares KBW Regional Banking Portfolio ETF,P,KBWR,Y,100.0,N,KBWR
2686,KBWY,PowerShares KBW Premium Yield Equity REIT Portfolio ETF,PowerShares KBW Premium Yield Equity REIT Portfolio ETF,P,KBWY,Y,100.0,N,KBWY
2687,KCC,Structured Products Corp. 8.20% Corporate Backed Trust Securities (CorTS)Issued by Provident Financial Trust I,Structured Products Corp. 8.20% Corporate Backed Trust Securities (CorTS)Issued by Provident Financial Trust I,N,KCC,N,100.0,N,KCC
2688,KCE,SPDR S&P Capital Markets ETF,SPDR S&P Capital Markets ETF,P,KCE,Y,100.0,N,KCE
2689,KCG,"KCG Holdings, Inc. Class A Common Stock","KCG Holdings, Inc. Class A Common Stock",N,KCG,N,100.0,N,KCG
2690,KCNY,KraneShares E Fund China Commercial Paper ETF,KraneShares E Fund China Commercial Paper ETF,P,KCNY,Y,100.0,N,KCNY
2691,KED,Kayne Anderson Energy Development Company Common Stock,Kayne Anderson Energy Development Company Common Stock,N,KED,N,100.0,N,KED
2692,KEF,"Korea Equity Fund, Inc. Common Stock","Korea Equity Fund, Inc. Common Stock",N,KEF,N,100.0,N,KEF
2693,KEG,"Key Energy Services, Inc. Common Stock","Key Energy Services, Inc. Common Stock",N,KEG,N,100.0,N,KEG
2694,KEM,Kemet Corporation New Common Stock,Kemet Corporation New Common Stock,N,KEM,N,100.0,N,KEM
2695,KEN.V,Kenon Holdings Ltd. Ordinary Shares When Issued,Kenon Holdings Ltd. Ordinary Shares When Issued,N,KENw,N,100.0,N,KEN#
2696,KEP,Korea Electric Power Corporation Common Stock,Korea Electric Power Corporation Common Stock,N,KEP,N,100.0,N,KEP
2697,KEX,Kirby Corporation Common Stock,Kirby Corporation Common Stock,N,KEX,N,100.0,N,KEX
2698,KEY,KeyCorp Common Stock,KeyCorp Common Stock,N,KEY,N,100.0,N,KEY
2699,KEY$G,KeyCorp Non Cumulative Perp Conv Pfd Ser A,KeyCorp Non Cumulative Perp Conv Pfd Ser A,N,KEYpG,N,100.0,N,KEY-G
2700,KEYS,Keysight Technologies Inc. Common Stock,Keysight Technologies Inc. Common Stock,N,KEYS,N,100.0,N,KEYS
2701,KF,"Korea Fund, Inc. (The) New Common Stock","Korea Fund, Inc. (The) New Common Stock",N,KF,N,100.0,N,KF
2702,KFH,KKR Financial Holdings LLC 8.375% Senior Notes due 2041,KKR Financial Holdings LLC 8.375% Senior Notes due 2041,N,KFH,N,100.0,N,KFH
2703,KFI,KKR Financial Holdings LLC 7.50% Senior Notes due 2042,KKR Financial Holdings LLC 7.50% Senior Notes due 2042,N,KFI,N,100.0,N,KFI
2704,KFN$,KKR Financial Holdings LLC Pfd Ser A Llc,KKR Financial Holdings LLC Pfd Ser A Llc,N,KFNp,N,100.0,N,KFN-
2705,KFS,"Kingsway Financial Services, Inc. Ordinary Shares","Kingsway Financial Services, Inc. Ordinary Shares",N,KFS,N,100.0,N,KFS
2706,KFY,Korn/Ferry International Common Stock,Korn/Ferry International Common Stock,N,KFY,N,100.0,N,KFY
2707,KFYP,KraneShares CSI New China ETF,KraneShares CSI New China ETF,P,KFYP,Y,100.0,N,KFYP
2708,KGC,Kinross Gold Corporation Common Stock,Kinross Gold Corporation Common Stock,N,KGC,N,100.0,N,KGC
2709,KHI,Deutsche High Income Trust Shares of Beneficial Interest,Deutsche High Income Trust Shares of Beneficial Interest,N,KHI,N,100.0,N,KHI
2710,KIE,SPDR S&P Insurance ETF,SPDR S&P Insurance ETF,P,KIE,Y,100.0,N,KIE
2711,KIM,Kimco Realty Corporation Common Stock,Kimco Realty Corporation Common Stock,N,KIM,N,100.0,N,KIM
2712,KIM$H,Kimco Realty Corporation Depositary Shares Representing 1/100 Shares of Redeemable Preferred Class H,Kimco Realty Corporation Depositary Shares Representing 1/100 Shares of Redeemable Preferred Class H,N,KIMpH,N,100.0,N,KIM-H
2713,KIM$I,Kimco Realty Corporation DEPOSITARY SH REPSTG 1/1000TH PFD SER I,Kimco Realty Corporation DEPOSITARY SH REPSTG 1/1000TH PFD SER I,N,KIMpI,N,100.0,N,KIM-I
2714,KIM$J,Kimco Realty Corporation Depositary Sh Repstg 1/1000th Pfd CL J %,Kimco Realty Corporation Depositary Sh Repstg 1/1000th Pfd CL J %,N,KIMpJ,N,100.0,N,KIM-J
2715,KIM$K,Kimco Realty Corporation Depositary Shares Representing 1/1000th Preferred Series K,Kimco Realty Corporation Depositary Shares Representing 1/1000th Preferred Series K,N,KIMpK,N,100.0,N,KIM-K
2716,KING,King Digital Entertainment plc Ordinary Share,King Digital Entertainment plc Ordinary Share,N,KING,N,100.0,N,KING
2717,KIO,KKR Income Opportunities Fund Common Shares,KKR Income Opportunities Fund Common Shares,N,KIO,N,100.0,N,KIO
2718,KIQ,Kelso Technologies Inc Ordinary Shares,Kelso Technologies Inc Ordinary Shares,A,KIQ,N,100.0,N,KIQ
2719,KKD,"Krispy Kreme Doughnuts, Inc. Common Stock","Krispy Kreme Doughnuts, Inc. Common Stock",N,KKD,N,100.0,N,KKD
2720,KKR,KKR & Co. L.P. Common Units Representing Limited Partnership Interest,KKR & Co. L.P. Common Units Representing Limited Partnership Interest,N,KKR,N,100.0,N,KKR
2721,KLD,iShares MSCI USA ESG Select ETF,iShares MSCI USA ESG Select ETF,P,KLD,Y,100.0,N,KLD
2722,KMB,Kimberly,Kimberly-Clark Corporation Common Stock,N,KMB,N,100.0,N,KMB
2723,KME,SPDR S&P Mortgage Finance ETF,SPDR S&P Mortgage Finance ETF,P,KME,Y,100.0,N,KME
2724,KMF,"Kayne Anderson Midstream Energy Fund, Inc Common Stock","Kayne Anderson Midstream Energy Fund, Inc Common Stock",N,KMF,N,100.0,N,KMF
2725,KMG,"KMG Chemicals, Inc. Common Stock","KMG Chemicals, Inc. Common Stock",N,KMG,N,100.0,N,KMG
2726,KMI,"Kinder Morgan, Inc. Common Stock","Kinder Morgan, Inc. Common Stock",N,KMI,N,100.0,N,KMI
2727,KMI.W,"Kinder Morgan, Inc. Warrants Expiring 2017","Kinder Morgan, Inc. Warrants Expiring 2017",N,KMI/WS,N,100.0,N,KMI+
2728,KMM,Deutsche  Multi,Deutsche  Multi-Market Income Trust Common Sshares of Beneficial Interest,N,KMM,N,100.0,N,KMM
2729,KMPA,Kemper Corporation 7.375% Subordinated Debentures due 2054,Kemper Corporation 7.375% Subordinated Debentures due 2054,N,KMPA,N,100.0,N,KMPA
2730,KMPR,Kemper Corporation,Kemper Corporation,N,KMPR,N,100.0,N,KMPR
2731,KMT,Kennametal Inc. Common Stock,Kennametal Inc. Common Stock,N,KMT,N,100.0,N,KMT
2732,KMX,CarMax Inc,CarMax Inc,N,KMX,N,100.0,N,KMX
2733,KN,Knowles Corporation Common Stock,Knowles Corporation Common Stock,N,KN,N,100.0,N,KN
2734,KND,"Kindred Healthcare, Inc. Common Stock","Kindred Healthcare, Inc. Common Stock",N,KND,N,100.0,N,KND
2735,KNL,"Knoll, Inc. Common Stock","Knoll, Inc. Common Stock",N,KNL,N,100.0,N,KNL
2736,KNM,Konami Corporation American Depositary Shares (Each repstg one share of Common Stock),Konami Corporation American Depositary Shares (Each repstg one share of Common Stock),N,KNM,N,100.0,N,KNM
2737,KNOP,KNOT Offshore Partners LP Common Units representing Limited Partner Interests,KNOT Offshore Partners LP Common Units representing Limited Partner Interests,N,KNOP,N,100.0,N,KNOP
2738,KNOW,Direxion All Cap Insider Sentiment Shares,Direxion All Cap Insider Sentiment Shares,P,KNOW,Y,100.0,N,KNOW
2739,KNX,"Knight Transportation, Inc. Common Stock","Knight Transportation, Inc. Common Stock",N,KNX,N,100.0,N,KNX
2740,KO,Coca,Coca-Cola Company (The) Common Stock,N,KO,N,100.0,N,KO
2741,KODK,Eastman Kodak Company Common New,Eastman Kodak Company Common New,N,KODK,N,100.0,N,KODK
2742,KODK.A,Eastman Kodak Company Wt Exp 135%,Eastman Kodak Company Wt Exp 135%,N,KODK/WS/A,N,100.0,N,KODK+A
2743,KODK.W,"Eastman Kodak Company Warrant (Expiring September 3, 2018)","Eastman Kodak Company Warrant (Expiring September 3, 2018)",N,KODK/WS,N,100.0,N,KODK+
2744,KOF,Coca Cola Femsa S.A.B. de C.V.  Common Stock,Coca Cola Femsa S.A.B. de C.V.  Common Stock,N,KOF,N,100.0,N,KOF
