,ACT Symbol,Company Name,Security Name,Exchange,CQS Symbol,ETF,Round Lot Size,Test Issue,NASDAQ Symbol
1287,EAB,"Entergy Arkansas, Inc. First Mortgage Bonds, 4.90% Series Due December 1, 2052","Entergy Arkansas, Inc. First Mortgage Bonds, 4.90% Series Due December 1, 2052",N,EAB,N,100.0,N,EAB
1288,EAD,Wells Fargo Advantage Income Opportunities Fund Common Shares,Wells Fargo Advantage Income Opportunities Fund Common Shares,A,EAD,N,100.0,N,EAD
1289,EAE,"Entergy Arkansas, Inc. First Mortgage Bonds, 4.75% Series due June 1, 2063","Entergy Arkansas, Inc. First Mortgage Bonds, 4.75% Series due June 1, 2063",N,EAE,N,100.0,N,EAE
1290,EARN,Ellington Residential Mortgage REIT Common Shares of Beneficial Interest,Ellington Residential Mortgage REIT Common Shares of Beneficial Interest,N,EARN,N,100.0,N,EARN
1291,EAT,"Brinker International, Inc. Common Stock","Brinker International, Inc. Common Stock",N,EAT,N,100.0,N,EAT
1292,EBF,"Ennis, Inc. Common Stock","Ennis, Inc. Common Stock",N,EBF,N,100.0,N,EBF
1293,EBND,SPDR Barclays Emerging Markets Local Bond ETF,SPDR Barclays Emerging Markets Local Bond ETF,P,EBND,Y,100.0,N,EBND
1294,EBR,Centrais Elc Braz Pfb B Elbras American Depositary Shares,Centrais Elc Braz Pfb B Elbras American Depositary Shares,N,EBR,N,100.0,N,EBR
1295,EBR.B,Centrais Elc Braz Pfb B Elbras American Depositary Shares,Centrais Elc Braz Pfb B Elbras American Depositary Shares,N,EBR/B,N,100.0,N,EBR.B
1296,EBS,"Emergent Biosolutions, Inc. Common Stock","Emergent Biosolutions, Inc. Common Stock",N,EBS,N,100.0,N,EBS
1297,EC,Ecopetrol S.A. American Depositary Shares,Ecopetrol S.A. American Depositary Shares,N,EC,N,100.0,N,EC
1298,ECA,Encana Corporation,Encana Corporation,N,ECA,N,100.0,N,ECA
1299,ECC,Eagle Point Credit Company Inc. Common Stock,Eagle Point Credit Company Inc. Common Stock,N,ECC,N,100.0,N,ECC
1300,ECF,Ellsworth Fund Ltd,Ellsworth Fund Ltd,A,ECF,N,100.0,N,ECF
1301,ECH,iShares MSCI Chile Capped Investable Market Index Fund,iShares MSCI Chile Capped Investable Market Index Fund,P,ECH,Y,100.0,N,ECH
1302,ECL,Ecolab Inc. Common Stock,Ecolab Inc. Common Stock,N,ECL,N,100.0,N,ECL
1303,ECNS,iShares MSCI China Small,iShares MSCI China Small-Cap ETF,P,ECNS,Y,100.0,N,ECNS
1304,ECOM,ChannelAdvisor Corporation Common Stock,ChannelAdvisor Corporation Common Stock,N,ECOM,N,100.0,N,ECOM
1305,ECON,EGShares Emerging Markets Consumer ETF,EGShares Emerging Markets Consumer ETF,P,ECON,Y,100.0,N,ECON
1306,ECR,Eclipse Resources Corporation Common Stock,Eclipse Resources Corporation Common Stock,N,ECR,N,100.0,N,ECR
1307,ECT,ECA Marcellus Trust I Common Units of Beneficial Interest,ECA Marcellus Trust I Common Units of Beneficial Interest,N,ECT,N,100.0,N,ECT
1308,ED,"Consolidated Edison, Inc. Common Stock","Consolidated Edison, Inc. Common Stock",N,ED,N,100.0,N,ED
1309,EDC,Direxion Emerging Markets Bull 3X Shares,Direxion Emerging Markets Bull 3X Shares,P,EDC,Y,100.0,N,EDC
1310,EDD,"Morgan Stanley Emerging Markets Domestic Debt Fund, Inc. Morgan Stanley Emerging Markets Domestic Debt Fund, Inc. Common Stock","Morgan Stanley Emerging Markets Domestic Debt Fund, Inc. Morgan Stanley Emerging Markets Domestic Debt Fund, Inc. Common Stock",N,EDD,N,100.0,N,EDD
1311,EDE,Empire District Electric Company (The) Common Stock,Empire District Electric Company (The) Common Stock,N,EDE,N,100.0,N,EDE
1312,EDEN,Ishares MSCI Denmark Capped ETF,Ishares MSCI Denmark Capped ETF,Z,EDEN,Y,100.0,N,EDEN
1313,EDF,Stone Harbor Emerging Markets Income Fund Common Shares of Beneficial Interest,Stone Harbor Emerging Markets Income Fund Common Shares of Beneficial Interest,N,EDF,N,100.0,N,EDF
1314,EDI,Stone Harbor Emerging Markets Total Income Fund Common Shares of Beneficial Interests,Stone Harbor Emerging Markets Total Income Fund Common Shares of Beneficial Interests,N,EDI,N,100.0,N,EDI
1315,EDIV,SPDR S&P Emerging Markets Dividend ETF,SPDR S&P Emerging Markets Dividend ETF,P,EDIV,Y,100.0,N,EDIV
1316,EDN,Empresa Distribuidora Y Comercializadora Norte S.A. (Edenor) Empresa Distribuidora Y Comercializadora Norte S.A. (Edenor) American Depositary Shares,Empresa Distribuidora Y Comercializadora Norte S.A. (Edenor) Empresa Distribuidora Y Comercializadora Norte S.A. (Edenor) American Depositary Shares,N,EDN,N,100.0,N,EDN
1317,EDOG,ALPS Emerging Sector Dividend Dogs ETF,ALPS Emerging Sector Dividend Dogs ETF,P,EDOG,Y,100.0,N,EDOG
1318,EDR,"Education Realty Trust, Inc. Common Stock","Education Realty Trust, Inc. Common Stock",N,EDR,N,100.0,N,EDR
1319,EDU,"New Oriental Education & Technology Group, Inc. Sponsored ADR representing 1 Ordinary Share (Cayman Islands)","New Oriental Education & Technology Group, Inc. Sponsored ADR representing 1 Ordinary Share (Cayman Islands)",N,EDU,N,100.0,N,EDU
1320,EDV,Vanguard Extended Duration Treasury ETF,Vanguard Extended Duration Treasury ETF,P,EDV,Y,100.0,N,EDV
1321,EDZ,Direxion Emerging Markets Bear 3X Shares,Direxion Emerging Markets Bear 3X Shares,P,EDZ,Y,100.0,N,EDZ
1322,EE,El Paso Electric Company Common Stock,El Paso Electric Company Common Stock,N,EE,N,100.0,N,EE
1323,EEA,"The European Equity Fund, Inc. Common Stock","The European Equity Fund, Inc. Common Stock",N,EEA,N,100.0,N,EEA
1324,EEB,Guggenheim BRIC ETF,Guggenheim BRIC ETF,P,EEB,Y,100.0,N,EEB
1325,EEH,"Aktiebolaget Svensk Exportkredit (Swed Ex Cred Corp) Elements (SM) Linked to the SPECTRUM Large Cap U.S. Sector Momentum Index developed by BNP Paribas due August 8, 2022, Medium","Aktiebolaget Svensk Exportkredit (Swed Ex Cred Corp) Elements (SM) Linked to the SPECTRUM Large Cap U.S. Sector Momentum Index developed by BNP Paribas due August 8, 2022, Medium-Term Notes, Series D",P,EEH,N,100.0,N,EEH
1326,EEHB,PowerShares S&P Emerging Markets High Beta Portfolio Exchange Traded Fund,PowerShares S&P Emerging Markets High Beta Portfolio Exchange Traded Fund,P,EEHB,Y,100.0,N,EEHB
1327,EELV,PowerShares S&P Emerging Markets Low Volatility Portfolio,PowerShares S&P Emerging Markets Low Volatility Portfolio,P,EELV,Y,100.0,N,EELV
1328,EEM,iShares MSCI Emerging Index Fund,iShares MSCI Emerging Index Fund,P,EEM,Y,100.0,N,EEM
1329,EEMS,Ishares MSCI Emerging Markets Small Cap Index Fund,Ishares MSCI Emerging Markets Small Cap Index Fund,P,EEMS,Y,100.0,N,EEMS
1330,EEMV,iShares MSCI Emerging Markets Minimum Volatility Index Fund,iShares MSCI Emerging Markets Minimum Volatility Index Fund,P,EEMV,Y,100.0,N,EEMV
1331,EEP,"Enbridge Energy, L.P. Class A Common Units","Enbridge Energy, L.P. Class A Common Units",N,EEP,N,100.0,N,EEP
1332,EEQ,Enbridge Energy Management LLC Shares repstg limited liability company interests,Enbridge Energy Management LLC Shares repstg limited liability company interests,N,EEQ,N,100.0,N,EEQ
1333,EES,WisdomTree SmallCap Earnings Fund,WisdomTree SmallCap Earnings Fund,P,EES,Y,100.0,N,EES
1334,EET,ProShares Ultra MSCI Emerging Markets,ProShares Ultra MSCI Emerging Markets,P,EET,Y,100.0,N,EET
1335,EEV,ProShares UltraShort MSCI Emerging Markets,ProShares UltraShort MSCI Emerging Markets,P,EEV,Y,100.0,N,EEV
1336,EFA,iShares MSCI EAFE ETF,iShares MSCI EAFE ETF,P,EFA,Y,100.0,N,EFA
1337,EFAD,ProShares Trust ProShares MSCI EAFE Dividend Growers ETF,ProShares Trust ProShares MSCI EAFE Dividend Growers ETF,P,EFAD,Y,100.0,N,EFAD
1338,EFAV,iShares MSCI EAFE Minimum Volatility ETF,iShares MSCI EAFE Minimum Volatility ETF,P,EFAV,Y,100.0,N,EFAV
1339,EFC,"Ellington Financial LLC Common Shares representing Limitied Liability Company Interests, no par valu","Ellington Financial LLC Common Shares representing Limitied Liability Company Interests, no par valu",N,EFC,N,100.0,N,EFC
1340,EFF,Eaton vance Floating,Eaton vance Floating-Rate Income Plus Fund Common Shares of Beneficial Interest,N,EFF,N,100.0,N,EFF
1341,EFFE,Global X JPMorgan Efficiente Index ETF,Global X JPMorgan Efficiente Index ETF,P,EFFE,Y,100.0,N,EFFE
1342,EFG,iShares MSCI EAFE Growth ETF,iShares MSCI EAFE Growth ETF,P,EFG,Y,100.0,N,EFG
1343,EFM,"Entergy Mississippi, Inc. First Mortgage Bonds, 6.20% Series due April 15, 2040","Entergy Mississippi, Inc. First Mortgage Bonds, 6.20% Series due April 15, 2040",N,EFM,N,100.0,N,EFM
1344,EFNL,Ishares MSCI Finland Capped ETF,Ishares MSCI Finland Capped ETF,Z,EFNL,Y,100.0,N,EFNL
1345,EFO,ProShares Ultra MSCI EAFE,ProShares Ultra MSCI EAFE,P,EFO,Y,100.0,N,EFO
1346,EFR,Eaton Vance Senior Floating,Eaton Vance Senior Floating-Rate Fund Common Shares of Beneficial Interest,N,EFR,N,100.0,N,EFR
1347,EFT,Eaton Vance Floating Rate Income Trust Common Shares of Beneficial Interest,Eaton Vance Floating Rate Income Trust Common Shares of Beneficial Interest,N,EFT,N,100.0,N,EFT
1348,EFU,ProShares UltraShort MSCI EAFE,ProShares UltraShort MSCI EAFE,P,EFU,Y,100.0,N,EFU
1349,EFV,iShares MSCI EAFE Value ETF,iShares MSCI EAFE Value ETF,P,EFV,Y,100.0,N,EFV
1350,EFX,"Equifax, Inc. Common Stock","Equifax, Inc. Common Stock",N,EFX,N,100.0,N,EFX
1351,EFZ,ProShares Short MSCI EAFE,ProShares Short MSCI EAFE,P,EFZ,Y,100.0,N,EFZ
1352,EGAS,Gas Natural Inc. Common Stock (OH),Gas Natural Inc. Common Stock (OH),A,EGAS,N,100.0,N,EGAS
1353,EGF,"Blackrock Enhanced Government Fund, Inc. Common Stock","Blackrock Enhanced Government Fund, Inc. Common Stock",N,EGF,N,100.0,N,EGF
1354,EGI,Entree Gold Inc Ordinary Shares,Entree Gold Inc Ordinary Shares,A,EGI,N,100.0,N,EGI
1355,EGL,"Engility Holdings, Inc. Common Stock","Engility Holdings, Inc. Common Stock",N,EGL,N,100.0,N,EGL
1356,EGN,Energen Corporation Common Stock,Energen Corporation Common Stock,N,EGN,N,100.0,N,EGN
1357,EGO,Eldorado Gold Corporation Ordinary Shares,Eldorado Gold Corporation Ordinary Shares,N,EGO,N,100.0,N,EGO
1358,EGP,"EastGroup Properties, Inc. Common Stock","EastGroup Properties, Inc. Common Stock",N,EGP,N,100.0,N,EGP
1359,EGPT,Market Vectors Egypt Index ETF,Market Vectors Egypt Index ETF,P,EGPT,Y,100.0,N,EGPT
1360,EGY,Vaalco Energy Inc Common Stock,Vaalco Energy Inc Common Stock,N,EGY,N,100.0,N,EGY
1361,EHI,Western Asset Global High Income Fund Inc Common Stock,Western Asset Global High Income Fund Inc Common Stock,N,EHI,N,100.0,N,EHI
1362,EHIC,eHi Car Services Limited American Depositary Shares,eHi Car Services Limited American Depositary Shares,N,EHIC,N,100.0,N,EHIC
1363,EIA,"Eaton Vance California Municipal Bond Fund II Common Shares of Beneficial Interest, $.01 par value","Eaton Vance California Municipal Bond Fund II Common Shares of Beneficial Interest, $.01 par value",A,EIA,N,100.0,N,EIA
1364,EIDO,iShares MSCI Indonesia ETF,iShares MSCI Indonesia ETF,P,EIDO,Y,100.0,N,EIDO
1365,EIG,Employers Holdings Inc Common Stock,Employers Holdings Inc Common Stock,N,EIG,N,100.0,N,EIG
1366,EIM,"Eaton Vance Municipal Bond Fund Common Shares of Beneficial Interest, $.01 par value","Eaton Vance Municipal Bond Fund Common Shares of Beneficial Interest, $.01 par value",A,EIM,N,100.0,N,EIM
1367,EIO,"Eaton Vance Ohio Municipal Bond Fund Common Shared of Befeficial Interest, $.01 par value","Eaton Vance Ohio Municipal Bond Fund Common Shared of Befeficial Interest, $.01 par value",A,EIO,N,100.0,N,EIO
1368,EIP,"Eaton Vance Pennsylvania Municipal Bond Fund Common Shares of Befeficial Interest, $.01 par value","Eaton Vance Pennsylvania Municipal Bond Fund Common Shares of Befeficial Interest, $.01 par value",A,EIP,N,100.0,N,EIP
1369,EIRL,iShares MSCI Ireland Capped ETF,iShares MSCI Ireland Capped ETF,P,EIRL,Y,100.0,N,EIRL
1370,EIS,iShares MSCI Israel Capped Investable Market Index Fund,iShares MSCI Israel Capped Investable Market Index Fund,P,EIS,Y,100.0,N,EIS
1371,EIV,"Eaton Vance Municipal Bond Fund II Common Shares of Beneficial Interest, $.01 Par Value","Eaton Vance Municipal Bond Fund II Common Shares of Beneficial Interest, $.01 Par Value",A,EIV,N,100.0,N,EIV
1372,EIX,Edison International Common Stock,Edison International Common Stock,N,EIX,N,100.0,N,EIX
1373,EJ,E,E-House (China) Holdings Limited American Depositary Share,N,EJ,N,100.0,N,EJ
1374,EL,"Estee Lauder Companies, Inc. (The) Common Stock","Estee Lauder Companies, Inc. (The) Common Stock",N,EL,N,100.0,N,EL
1375,ELA,"Entergy Louisiana, LLC First Mortgage Bonds, 5.875% Series due June 15, 2041","Entergy Louisiana, LLC First Mortgage Bonds, 5.875% Series due June 15, 2041",N,ELA,N,100.0,N,ELA
1376,ELB,"Entergy Louisiana, Inc. 6.0% Series Due March 15, 2040","Entergy Louisiana, Inc. 6.0% Series Due March 15, 2040",N,ELB,N,100.0,N,ELB
1377,ELD,WisdomTree Emerging Markets Local Debt Fund,WisdomTree Emerging Markets Local Debt Fund,P,ELD,Y,100.0,N,ELD
1378,ELJ,"Entergy Louisiana, Inc. First Mortgage Bonds, 5.25% Series due July 1, 2052","Entergy Louisiana, Inc. First Mortgage Bonds, 5.25% Series due July 1, 2052",N,ELJ,N,100.0,N,ELJ
1379,ELLI,"Ellie Mae, Inc. Common Stock","Ellie Mae, Inc. Common Stock",N,ELLI,N,100.0,N,ELLI
1380,ELLO,Ellomay Capital Ltd Ordinary Shares (Israel),Ellomay Capital Ltd Ordinary Shares (Israel),A,ELLO,N,100.0,N,ELLO
1381,ELMD,"Electromed, Inc. Common Stock","Electromed, Inc. Common Stock",A,ELMD,N,100.0,N,ELMD
1382,ELP,Companhia Paranaense de Energia (COPEL) Common Stock,Companhia Paranaense de Energia (COPEL) Common Stock,N,ELP,N,100.0,N,ELP
1383,ELS,"Equity Lifestyle Properties, Inc. Common Stock","Equity Lifestyle Properties, Inc. Common Stock",N,ELS,N,100.0,N,ELS
1384,ELS$C,"Equity Lifestyle Properties, Inc. Depositary Shares each representing 1/100th of a share of 6.75% Series C Cumulative Redeemable Perpetual Preferred Stock","Equity Lifestyle Properties, Inc. Depositary Shares each representing 1/100th of a share of 6.75% Series C Cumulative Redeemable Perpetual Preferred Stock",N,ELSpC,N,100.0,N,ELS-C
1385,ELU,"Entergy Louisiana, Inc. First Mortgage Bonds, 4.70% Series due June 1, 2063","Entergy Louisiana, Inc. First Mortgage Bonds, 4.70% Series due June 1, 2063",N,ELU,N,100.0,N,ELU
1386,ELX,Emulex Corporation Common Stock,Emulex Corporation Common Stock,N,ELX,N,100.0,N,ELX
1387,ELY,Callaway Golf Company Common Stock,Callaway Golf Company Common Stock,N,ELY,N,100.0,N,ELY
1388,EMAG,Market Vectors Emerging Markets Aggregate Bond ETF,Market Vectors Emerging Markets Aggregate Bond ETF,P,EMAG,Y,100.0,N,EMAG
1389,EMAN,eMagin Corporation Common Stock,eMagin Corporation Common Stock,A,EMAN,N,100.0,N,EMAN
1390,EMB,"iShares J,P. Morgan USD Emerging Markets Bond ETF","iShares J,P. Morgan USD Emerging Markets Bond ETF",P,EMB,Y,100.0,N,EMB
1391,EMBB,SPDR MSCI EM Beyond BRIC ETF,SPDR MSCI EM Beyond BRIC ETF,P,EMBB,Y,100.0,N,EMBB
1392,EMC,EMC Corporation Common Stock,EMC Corporation Common Stock,N,EMC,N,100.0,N,EMC
1393,EMCD,SPDR BofA Merrill Emerging Markets Corporate Bond ETF,SPDR BofA Merrill Emerging Markets Corporate Bond ETF,P,EMCD,Y,100.0,N,EMCD
1394,EMCR,EGShares Emerging Markets CORE ETF,EGShares Emerging Markets CORE ETF,P,EMCR,Y,100.0,N,EMCR
1395,EMD,"Western Asset Emerging Markets Income Fund, Inc. Common Stock","Western Asset Emerging Markets Income Fund, Inc. Common Stock",N,EMD,N,100.0,N,EMD
1396,EMDD,EGShares Emerging Markets Domestic Demand ETF,EGShares Emerging Markets Domestic Demand ETF,P,EMDD,Y,100.0,N,EMDD
1397,EME,"EMCOR Group, Inc. Common Stock","EMCOR Group, Inc. Common Stock",N,EME,N,100.0,N,EME
1398,EMES,Emerge Energy Services LP Common Units representing Limited Partner Interests,Emerge Energy Services LP Common Units representing Limited Partner Interests,N,EMES,N,100.0,N,EMES
1399,EMF,Templeton Emerging Markets Fund Common Stock,Templeton Emerging Markets Fund Common Stock,N,EMF,N,100.0,N,EMF
1400,EMFM,Global X Next Emerging & Frontier ETF,Global X Next Emerging & Frontier ETF,P,EMFM,Y,100.0,N,EMFM
1401,EMFT,SPDR MSCI EM 50 ETF,SPDR MSCI EM 50 ETF,P,EMFT,Y,100.0,N,EMFT
1402,EMHY,iShares Emerging Markets High Yield Bond ETF,iShares Emerging Markets High Yield Bond ETF,Z,EMHY,Y,100.0,N,EMHY
1403,EMHZ,iShares MSCI Emerging Markets Horizon ETF,iShares MSCI Emerging Markets Horizon ETF,Z,EMHZ,Y,100.0,N,EMHZ
1404,EMI,Eaton Vance Michigan Municipal Income Trust Shares of Beneficial Interest,Eaton Vance Michigan Municipal Income Trust Shares of Beneficial Interest,A,EMI,N,100.0,N,EMI
1405,EMJ,"Eaton Vance New Jersey Municipal Bond Fund Common Shres of Beneficial Interest, $.01 par value","Eaton Vance New Jersey Municipal Bond Fund Common Shres of Beneficial Interest, $.01 par value",A,EMJ,N,100.0,N,EMJ
1406,EMLB,iPath Long Enhanced MSCI Emerging Markets Index ETN,iPath Long Enhanced MSCI Emerging Markets Index ETN,P,EMLB,N,100.0,N,EMLB
1407,EMLC,Market Vectors Emerging Markets Local Currency Bond ETF,Market Vectors Emerging Markets Local Currency Bond ETF,P,EMLC,Y,100.0,N,EMLC
1408,EMLP,First Trust North American Energy Infrastructure Fund,First Trust North American Energy Infrastructure Fund,P,EMLP,Y,100.0,N,EMLP
1409,EMN,Eastman Chemical Company Common Stock,Eastman Chemical Company Common Stock,N,EMN,N,100.0,N,EMN
1410,EMO,ClearBridge Energy MLP Opportunity Fund Inc. Common Stock,ClearBridge Energy MLP Opportunity Fund Inc. Common Stock,N,EMO,N,100.0,N,EMO
1411,EMQ,"Entergy Mississippi, Inc. 1st Mtg Bds","Entergy Mississippi, Inc. 1st Mtg Bds",N,EMQ,N,100.0,N,EMQ
1412,EMQQ,Emerging Markets Internet and Ecommerce ETF (The),Emerging Markets Internet and Ecommerce ETF (The),P,EMQQ,Y,100.0,N,EMQQ
1413,EMR,Emerson Electric Company Common Stock,Emerson Electric Company Common Stock,N,EMR,N,100.0,N,EMR
1414,EMRE,Guggenhein Emerging Market Real Estate ETF,Guggenhein Emerging Market Real Estate ETF,P,EMRE,Y,100.0,N,EMRE
1415,EMSA,iPath Short Enhanced MSCI Emerging Markets Index ETN,iPath Short Enhanced MSCI Emerging Markets Index ETN,P,EMSA,N,100.0,N,EMSA
1416,EMSH,ProShares Short Term USD Emerging Markets Bond ETF,ProShares Short Term USD Emerging Markets Bond ETF,Z,EMSH,Y,100.0,N,EMSH
1417,EMXX,Eurasian Minerals Inc Common Shares (Canada),Eurasian Minerals Inc Common Shares (Canada),A,EMXX,N,100.0,N,EMXX
1418,EMZ,"Entergy Mississippi, Inc. First Mortgage Bonds, 6.0% Series due May 1, 2051","Entergy Mississippi, Inc. First Mortgage Bonds, 6.0% Series due May 1, 2051",N,EMZ,N,100.0,N,EMZ
1419,ENB,Enbridge Inc Common Stock,Enbridge Inc Common Stock,N,ENB,N,100.0,N,ENB
1420,ENBL,"Enable Midstream Partners, LP Common Units representing limited partner interests","Enable Midstream Partners, LP Common Units representing limited partner interests",N,ENBL,N,100.0,N,ENBL
1421,ENFR,Alerian Energy Infrastructure ETF,Alerian Energy Infrastructure ETF,P,ENFR,Y,100.0,N,ENFR
1422,ENGN,iShares Industrial Bond ETF,iShares Industrial Bond ETF,P,ENGN,Y,100.0,N,ENGN
1423,ENH,Endurance Specialty Holdings Ltd Common Stock,Endurance Specialty Holdings Ltd Common Stock,N,ENH,N,100.0,N,ENH
1424,ENH$A,Endurance Specialty Holdings Ltd Preferred Series A,Endurance Specialty Holdings Ltd Preferred Series A,N,ENHpA,N,100.0,N,ENH-A
1425,ENH$B,Endurance Specialty Holdings Ltd PFD SER B (Bermuda),Endurance Specialty Holdings Ltd PFD SER B (Bermuda),N,ENHpB,N,100.0,N,ENH-B
1426,ENI,Enersis S A Common Stock,Enersis S A Common Stock,N,ENI,N,100.0,N,ENI
1427,ENJ,"Entergy New Orleans, Inc. First Mortgage Bonds, 5.0% Series due December 1, 2052","Entergy New Orleans, Inc. First Mortgage Bonds, 5.0% Series due December 1, 2052",N,ENJ,N,100.0,N,ENJ
1428,ENL,Reed Elsevier NV American Depositary Shares,Reed Elsevier NV American Depositary Shares,N,ENL,N,100.0,N,ENL
1429,ENLC,"EnLink Midstream, LLC Common Units representing Limited Partner Interests","EnLink Midstream, LLC Common Units representing Limited Partner Interests",N,ENLC,N,100.0,N,ENLC
1430,ENLK,"EnLink Midstream Partners, LP Common Units Representing Limited Partnership Interests","EnLink Midstream Partners, LP Common Units Representing Limited Partnership Interests",N,ENLK,N,100.0,N,ENLK
1431,ENOR,Ishares MSCI Norway Capped ETF,Ishares MSCI Norway Capped ETF,Z,ENOR,Y,100.0,N,ENOR
1432,ENR,"Energizer Holdings, Inc. Common Stock","Energizer Holdings, Inc. Common Stock",N,ENR,N,100.0,N,ENR
1433,ENRJ,"EnerJex Resources, Inc. (NEW) Common Stock","EnerJex Resources, Inc. (NEW) Common Stock",A,ENRJ,N,100.0,N,ENRJ
1434,ENRJ$,"EnerJex Resources, Inc. 10% Series A Cumulative Redeemable Perpetual Preferred Stock","EnerJex Resources, Inc. 10% Series A Cumulative Redeemable Perpetual Preferred Stock",A,ENRJp,N,100.0,N,ENRJ-
1435,ENS,Enersys Common Stock,Enersys Common Stock,N,ENS,N,100.0,N,ENS
1436,ENSV,Enservco Corporation Common Stock,Enservco Corporation Common Stock,A,ENSV,N,100.0,N,ENSV
1437,ENV,"Envestnet, Inc Common Stock","Envestnet, Inc Common Stock",N,ENV,N,100.0,N,ENV
1438,ENVA,"Enova International, Inc. Common Stock","Enova International, Inc. Common Stock",N,ENVA,N,100.0,N,ENVA
1439,ENX,"Eaton Vance New York Municipal Bond Fund Common Shares of Beneficial Interest, $.01 par value","Eaton Vance New York Municipal Bond Fund Common Shares of Beneficial Interest, $.01 par value",A,ENX,N,100.0,N,ENX
1440,ENY,Guggenheim Canadian Energy Income ETF,Guggenheim Canadian Energy Income ETF,P,ENY,Y,100.0,N,ENY
1441,ENZ,"Enzo Biochem, Inc. Common Stock ($0.01 Par Value)","Enzo Biochem, Inc. Common Stock ($0.01 Par Value)",N,ENZ,N,100.0,N,ENZ
1442,ENZL,iShares MSCI New Zealand Capped ETF,iShares MSCI New Zealand Capped ETF,P,ENZL,Y,100.0,N,ENZL
1443,EOC,Empresa Nacional de Electricidad S.A. Common Stock,Empresa Nacional de Electricidad S.A. Common Stock,N,EOC,N,100.0,N,EOC
1444,EOD,Wells Fargo Advantage Global Dividend Opportunity Fund,Wells Fargo Advantage Global Dividend Opportunity Fund,N,EOD,N,100.0,N,EOD
1445,EOG,"EOG Resources, Inc. Common Stock","EOG Resources, Inc. Common Stock",N,EOG,N,100.0,N,EOG
1446,EOI,Eaton Vance Enhance Equity Income Fund Eaton Vance Enhanced Equity Income Fund Shares of Beneficial Interest,Eaton Vance Enhance Equity Income Fund Eaton Vance Enhanced Equity Income Fund Shares of Beneficial Interest,N,EOI,N,100.0,N,EOI
1447,EOS,Eaton Vance Enhance Equity Income Fund II Common Stock,Eaton Vance Enhance Equity Income Fund II Common Stock,N,EOS,N,100.0,N,EOS
1448,EOT,Eaton Vance Municipal Income Trust EATON VANCE NATIONAL MUNICIPAL OPPORTUNITIES TRUST,Eaton Vance Municipal Income Trust EATON VANCE NATIONAL MUNICIPAL OPPORTUNITIES TRUST,N,EOT,N,100.0,N,EOT
1449,EOX,"Emerald Oil, Inc. Common Stock","Emerald Oil, Inc. Common Stock",A,EOX,N,100.0,N,EOX
1450,EP$C,El Paso Corporation Preferred Stock,El Paso Corporation Preferred Stock,N,EPpC,N,100.0,N,EP-C
1451,EPAM,"EPAM Systems, Inc. Common Stock","EPAM Systems, Inc. Common Stock",N,EPAM,N,100.0,N,EPAM
1452,EPD,Enterprise Products Partners L.P. Common Stock,Enterprise Products Partners L.P. Common Stock,N,EPD,N,100.0,N,EPD
1453,EPE,EP Energy Corporation Class A Common Stock,EP Energy Corporation Class A Common Stock,N,EPE,N,100.0,N,EPE
1454,EPHE,iShares MSCI Philippines ETF,iShares MSCI Philippines ETF,P,EPHE,Y,100.0,N,EPHE
1455,EPI,WisdomTree India Earnings Fund,WisdomTree India Earnings Fund,P,EPI,Y,100.0,N,EPI
1456,EPM,"Evolution Petroleum Corporation, Inc. Common Stock","Evolution Petroleum Corporation, Inc. Common Stock",A,EPM,N,100.0,N,EPM
1457,EPM$A,"Evolution Petroleum Corporation, Inc. 8.5% Series A Cumulative Pfd Stk","Evolution Petroleum Corporation, Inc. 8.5% Series A Cumulative Pfd Stk",A,EPMpA,N,100.0,N,EPM-A
1458,EPOL,iShares MSCI Poland Capped ETF,iShares MSCI Poland Capped ETF,P,EPOL,Y,100.0,N,EPOL
1459,EPP,iShares MSCI Pacific Ex,iShares MSCI Pacific Ex-Japan Index Fund,P,EPP,Y,100.0,N,EPP
1460,EPR,EPR Properties Common Stock,EPR Properties Common Stock,N,EPR,N,100.0,N,EPR
1461,EPR$C,EPR Properties 5.75% Series C Cumulative Convertible Preferred Shares,EPR Properties 5.75% Series C Cumulative Convertible Preferred Shares,N,EPRpC,N,100.0,N,EPR-C
1462,EPR$E,EPR Properties Series E Cumulative Conv Pfd Shs Ser E,EPR Properties Series E Cumulative Conv Pfd Shs Ser E,N,EPRpE,N,100.0,N,EPR-E
1463,EPR$F,EPR Properties Pfd Ser F,EPR Properties Pfd Ser F,N,EPRpF,N,100.0,N,EPR-F
1464,EPRO,AdvisorShares EquityPro ETF,AdvisorShares EquityPro ETF,P,EPRO,Y,100.0,N,EPRO
1465,EPS,WisdomTree Earnings 500 Fund,WisdomTree Earnings 500 Fund,P,EPS,Y,100.0,N,EPS
1466,EPU,iShares MSCI All Peru Capped ETF,iShares MSCI All Peru Capped ETF,P,EPU,Y,100.0,N,EPU
1467,EPV,ProShares UltraShort FTSE Europe ETF,ProShares UltraShort FTSE Europe ETF,P,EPV,Y,100.0,N,EPV
1468,EQAL,PowerShares Russell 1000 Equal Weight POrtfolio,PowerShares Russell 1000 Equal Weight POrtfolio,P,EQAL,Y,100.0,N,EQAL
1469,EQC,Equity Commonwealth Common Shares of Beneficial Interest,Equity Commonwealth Common Shares of Beneficial Interest,N,EQC,N,100.0,N,EQC
1470,EQC$D,Equity Commonwealth 6.50% Pfd Conv Shs Ser D,Equity Commonwealth 6.50% Pfd Conv Shs Ser D,N,EQCpD,N,100.0,N,EQC-D
1471,EQC$E,Equity Commonwealth 7.25% Series E Cumulative Redeemable Preferred Shares,Equity Commonwealth 7.25% Series E Cumulative Redeemable Preferred Shares,N,EQCpE,N,100.0,N,EQC-E
1472,EQCO,Equity Commonwealth 5.75% Senior Notes due 2042,Equity Commonwealth 5.75% Senior Notes due 2042,N,EQCO,N,100.0,N,EQCO
1473,EQL,ALPS Equal Sector Weight ETF,ALPS Equal Sector Weight ETF,P,EQL,Y,100.0,N,EQL
1474,EQLT,Workplace Equality Portfolio ETF,Workplace Equality Portfolio ETF,P,EQLT,Y,100.0,N,EQLT
1475,EQM,"EQT Midstream Partners, LP Common Units representing Limited Partner Interests","EQT Midstream Partners, LP Common Units representing Limited Partner Interests",N,EQM,N,100.0,N,EQM
1476,EQR,Equity Residential Common Shares of Beneficial Interest,Equity Residential Common Shares of Beneficial Interest,N,EQR,N,100.0,N,EQR
1477,EQS,"Equus Total Return, Inc. Common Stock","Equus Total Return, Inc. Common Stock",N,EQS,N,100.0,N,EQS
1478,EQT,EQT Corporation Common Stock,EQT Corporation Common Stock,N,EQT,N,100.0,N,EQT
1479,EQY,"Equity One, Inc. Common Stock","Equity One, Inc. Common Stock",N,EQY,N,100.0,N,EQY
1480,ERA,"Era Group, Inc. Common Stock","Era Group, Inc. Common Stock",N,ERA,N,100.0,N,ERA
1481,ERB,"ERBA Diagnostics, Inc. Common Stock","ERBA Diagnostics, Inc. Common Stock",A,ERB,N,100.0,N,ERB
1482,ERC,Wells Fargo Advantage Multi,"Wells Fargo Advantage Multi-Sector Income Fund Common Stock, no par value",A,ERC,N,100.0,N,ERC
1483,ERF,Enerplus Corporation Common Stock,Enerplus Corporation Common Stock,N,ERF,N,100.0,N,ERF
